date,star,text
2019-12-17,4,도착하자마자 쓰는 리뷰라 시음을 하지는 않았지만 향이나 맛 정도가 좋을거 같아 구매했습니다
2020-01-07,5,달콤 한 와인 찿고 있었는데  제 입맛에 딱입니다  넘맛있어서 홀짝 홀짝 단번에 다 마셨네요
2019-12-15,5,생각보다 좀 답니다 맛은 좋아요
2019-12-28,4,맛있게 잘 먹겠습니다
2019-12-26,5,음 소주를 기준으로 했을 때 반 병에서 한 병 사이에서 취기가 오르는 그런 유형인데 와인은 어떨까 하고 구매 했는데 술은 다 술이네요 ㅎㅎ 엄청달달하다 이런 건 아닌 거 같아요 술 못 마시는 분들 참고하세요
2019-12-27,1,리뷰가 너무 좋아서 두병이나 구매했는데제 입에는 정말 너무 달아서 별로였어요약간 깊은맛 없는 복분자주 맛이랄까너무 가볍고 달기만 했네요 ㅠㅠ
2020-01-09,5,포장도 잘 해주시고 좋아요
2020-01-12,4,너무 맛있고 또 주문하겠습니다
2019-12-25,5,달콤하고맛있어요배송도엄청빨라요뱅쇼만들라고샀는데그냥먹어도좋고가성비짱이에요
2020-01-15,5,가볍게 즐기기 좋아서 재구매했습니다
2020-01-04,5,선물용으로 샀는데 다들 좋아했어요 재구매 가능할꺼 같아요
2020-01-17,5,아직 맛을 못봣어여 달겟죠
2020-01-06,4,달콤한 스위트와인입니다  부드럽고 좋았어요
2019-12-30,3,제가 워낙에 알쓰에 애기입인지라달다고해서 구매했는데제입엔 그냥 술이네요ㅜㅜ남편님은 너무달다고하면서도 잘마시네요
2020-01-14,4,괜찮네요 향도 맛도
2020-01-14,5,맛있어요 달고  ㅎㅎㅎ
2020-01-07,5,스위트와인중젤마싯는거같아요다음에3병재주문예정
2020-01-18,5,달달하니 맛있어용ㅎㅎㅎ
2020-01-12,5,만족할 만큼 배송이 빠르다
2019-12-13,5,저는 떫은 맛을 별로 좋아하진 않은데소백산와인은 목넘김도 부드럽고 술자체 메스껍다는 생각도 안들고달달해서 너무 좋았어요 와인은 후폭풍이 심하다던데 그것 또한 없었구요만족합니다 한병 먹어보고 다섯병 더 주문했서여
2019-12-24,5,와인 오프너와 함께 선물용으로 구매했습니다 ㅎㅎ 정말 달아서 드라이 한 와인을 좋아하지 않는 분들에게 안성맞춤
2020-01-18,5,늘 만족합니다
2019-12-23,4,아직맛을 못봤어요ㅜㅜ 클쓰때 먹을꺼라ㅋㅋ그래도 배송이 빨라서 너무 감사합니다ㅋ 개봉후기 남길께용
2020-01-13,4,저한테는 너무 단것 같네요
2019-12-25,4,가성비 측면에서는 완벽 근데 좀 많이 다니까 단걸 기피하시는 분들에게는 안좋아요
2020-01-09,5,국산와인이 정말좋아진거 같습니다
2020-01-07,5,부드럽고 맛나요 적당히 달아요
2020-01-03,4,와인 존문가는 아니지만 대체적으로 평범하게 먹을만 했습니다
2020-01-07,5,달콤한 와인의 정수를 잘 담고 있어요 애용할 듯 합니다
2019-12-28,5,달고 맛있고 맛이 진합니다담에 또 재구매할께요
2020-01-09,5,배송도빠르고물건도좋네요
2020-01-06,4,첫잔은아주맛나요먹다보면넘달아요ㅠㅠ
2020-01-07,3,좀 달긴한데 괜찮은거같아요
2019-12-29,5,와인초보 맛있게 냠냠   헸어요 크리스마스 잘보냈어용
2019-12-30,5,작년에 마시고 올해 또 주문했습니다맛있게 잘 마시겠습니다
2020-01-08,3,그냥저냥그냥 그래요 평범하게
2020-01-01,4,포도주스인데 약간 알콜들어간 느낌이에요술 못하는 사람한텐 좋을것 같아요
2020-01-10,1,저랑은 잘 안맞네요
2019-12-31,5,진짜 달아요 입에 포도잼 넣은것 같은 맛 포도향도 쎔
2020-01-10,3,잘먹겠습니다 수고하세요
2019-12-26,5,23일 00시 쯤에 주문했는데 24일 저녁에 배송받아서 잘마셨습니다 빠른배송도 좋았고 맛도 달달하니 좋았습니다
2019-12-28,5,선물용으로 구입했어요 연말에 먹어보랴구여
2019-12-27,3,개인적으로는 좀 너무 많이 달았습니다 단맛 좋아하시는 분들은 좋아하실거 같아요
2019-12-07,3,배송 빠르게 왔어요 전 술을 잘 못 마시는데 스위트 와인이라고 해서 마냥 달기만 할 줄 알고 샀다가 도수가 12도라는 걸 늦게 알았어요ㅋㅋ진짜 달콤해요 알쓰인 저한테는 술맛이 강했지만 원래 그런데 제가 몰랐던 거니까ㅠㅡㅠ 여튼 맛있게 다 마셨어요
2019-12-27,4,맛있고  좋아요  구매의사또있어요
2019-12-23,5,달달함이 아주 최고네요자칫잘못하면 달콤함이강해서 금방 질릴수도 있겠네요
2019-12-23,2,솔직히 별로예요너무 달아서 질리는ㅠ신랑은 반잔 먹고는 달려서 도저히 못먹겠다며
2020-01-02,5,가성비 좋은 와인 잘마셨습니다
2019-12-29,5,아주 좋아요 재구매  확정
2020-01-06,5,마음에 쏙들어요
2020-01-01,5,선물용으로 너무 좋아용
2019-12-13,3,평소 마시던 여러 종류의 스위트와인에 비해 많이 답니다 집에서 설탕 잔뜩 넣어 담근 포도주만큼 쨍하게 단맛입니다 너무 달아서 어울리는 음식을 못 찾겠네요
2019-12-06,5,포장도 고급스럽고 맛도 달달해서 재구매 의사 100에요
2019-12-24,5,정말맛있네요 만족합니다
2019-12-21,5,달콤하고 맛있어요 연말모임에 인기 좋았어요
2019-12-19,5,빠른배송 안전한 배송 좋구요 상품도 맘에 들어요 많이 파세요
2019-11-23,5,배송받아서 저녁에 맛봤는데 정말 달달하고 목넘김이 좋았어요여자분들에게 추천합니다
2019-12-19,4,음 왜 별점이 좋은지 알게해주네요 초보인 저한테도 질받습니다
2019-12-31,5,달달하고 아주 맛있습니다
2020-01-15,5,조아요조아요조아요조아요
2019-12-27,4,만족해요 찾던제품
2019-12-27,5,달콤한 와인 맛있었어 재구매 하였습니다
2019-12-29,5,와인입문자에게 최고의 와인입니다
2019-11-24,5,완전 맛있어요 추천입니다 좋은날 분위기도 내고 짱이에욤
2019-12-29,5,너무 달긴해서 섞어마셧어요
2019-11-29,5,이게 지금 몇병째 구매인 지 모르겠어요 맛있어요 ㅠㅠ
2019-12-26,4,와 엄청 달고 맛있어용
2019-12-20,5,달콤하게 아주 잘마셨어요 굿이예요
2019-12-18,4,맛이습니다 단거좋아히시는 분 추천해요
2020-01-14,5,맛있게 잘먹을께요
2019-12-14,5,후기보고 구매했는데 정말 원하던 맛이에요 재구매하러 들어왔습니다
2019-12-19,4,가격대비 좋은 것 같습니다
2019-12-18,4,믿을만하고 포장도 좋으나 제 입맛에는 달아요
2019-12-22,5,크리스마스 홈파티용으로 구매했습니다ㅎㅎ
2019-11-18,4,와인그닥안좋아하는데  맛있게  먹었네요 캠핑잘했어요
2019-12-15,5,제가 찾던 맛입니다 달콤 하고 맛있네요
2019-12-13,5,아직 안막어 봤지만 기대되네요먹어보고 후기 올릴게요
2019-10-18,5,하루 와인 한 두잔이 좋다기에남편과 함께 소소하게 한 잔씩 하려고 주문했는데초보자가 마시기에 좋습니다그런데 생각보다 알콜 도수가 높네요12인게잘 마시겠습니다
2019-12-14,4,술 못하는저한테 딱이예요 달콤하고 맛나요
2019-12-12,4,와인을 잘 먹을줄 몰라서 그런지 맛있는지 모르겠어요ㅜㅜ
2019-11-19,5,감사합니다잘받았어요
2019-12-17,4,달달해서 맛있었어요
2019-12-16,5,굿굿 맛있고 좋아요
2019-11-27,5,포장도 좋구요 맛은 스위트 와인이라 달아요 제 입맛엔 아주 좋습니다
2019-10-30,5,진짜알쓰이고 술맛보면 쓴맛이 제일먼저 느껴져서 엄두도 못냈는데ㅠㅜㅜ 무슨맛이 이렇게 달죠 딸기쨈 맛나요 ㅠㅜㅜ 진짜진짜 맛있어ㅜㅜㅜ 더 사두려고요 감사합니다
2019-11-20,5,잘 먹을게요 오프너도 주셔 감사해요
2020-01-03,3,좡요 조아요 조아요
2019-10-28,4,먼가 입에 촥촥 붙는 와인이네요복분자 같기도하구요애주가인 저희는 약간 음료같아서 좀 아쉬웠어요달달하고 알콜을 어려워하시는분들은 좋아하실것 같아용
2019-11-12,5,저녁에 한잔이 몸에 좋다고 해서 사서 이틀에 한번씩 먹는중인데 맛도 향도 농도도 만족스러워요
2019-12-01,5,좋아요  다음에 또 주문할꺼예요
2019-10-29,5,작년에 광명동굴에서 맛보고 너무 맛있어서 재구매했어요 진짜 너무 맛있고 좋아요 와인오프너도 같이 주셔서 감사해요
2019-10-26,5,엄청 달달한데 도수가 높아 금방취하네요 한잔이상 못마시겠어요 개인차겠지만 머리도 아프고 울렁거려서 많이는 못마시겠어요 근데 굉장히 맛있는 술이예요
2019-11-18,4,스윗 와인 감안하고 구매했는데 포도주에 가까운 맛입니다 많이 달아서 얼음 넣어 마시니 적당하구요 화학주와 달리 숙취가 없어요 다만 아이스와인과 비교는 무리입니다
2019-11-04,5,맛있고 좋아요 특히 단맛좋아하고향도 괜찮아요
2019-11-26,5,맛있어서 한병 다 먹었어요 다음에도 또 구매하께요
2019-11-29,4,부두럽고 잘 넘어가요 단지 단맛이 넘 강해서 와인맛이 덜 느껴져요
2019-12-07,4,아직 안묵어봣어여 잘 무그깨요우누눝
2019-11-11,3,동생부탁으로 샀는데 단맛을 싫어하는 스탈은 아닌데 좀 많이 달다고 하네요
2019-12-06,4,아직 먹어보진못했지만 괜찮아보입니다
2019-11-06,5,진짜 엄청맛있어요 뱅쇼로도 먹었습니다
2019-12-04,3,맛은 괜찮긴한데 많이 달아요
2019-11-02,5,남친이랑 1주년 기념으로 주문했는데 와인 처음인 남친도 맛있다고 하네요 양꼬치랑도 잘 어울려요
2019-11-22,5,아주 좋은 선물이되었습니다 포장도 깔끔하고 좋았어요
2019-11-28,5,달달하니 술 못하는 이에게 하루 한두잔으로 좋아요
2020-01-04,5,Gxitsyztitixyixtxiyxyxy
2019-12-04,5,맛있을것같아 구매했어요 기대돼요
2019-12-01,4,달달하니 맛있게 잘 마셧어요
2019-12-05,5,만족도 5점을 주셨네요
2019-11-28,5,맛있어요맛있어요맛있어요
2019-11-12,4,오프너랑 같이와서 좋네요
2019-11-27,5,여행갈때 먹으려고 아직 못먹었는데 기대됩니당 안전한 포장 체고체고
2019-11-26,5,너무 맛있는 와인 계속 주문할것같음
2019-11-21,3,너무 단거 같아요 술 잘 못하는 사람들에게 맞을듯 싶네요
2019-11-27,5,배송 빠르고 잘 받았습니다 잘 마시겠습니다
2019-11-28,4,달콤하니 맛있네요
2019-11-03,5,너무 맛있어서 또 구매합니다 배송도 꼼꼼히 보내주시고 무엇보다 빨라요 감사합니다
2019-10-26,5,너무 마음에 들고 좋습니다 다음에도 또 구매하고 싶은 달콤한 와인이었습니다 너무나 마음에 들어서 주변에도 추천하고 싶은 와인이었습니다 잘 만들어주셔서 감사합니다
2019-12-25,5,ㄴ오ㅅㄴㅌ솢ㄷㄹㅎ
2019-11-10,4,달콤해요 개봉을 늦게해서 후기가 늦었어요 와인은 잘 모르지만 여튼 맛있어요
2019-11-01,5,한잔만 먹을라 했는데 어느순간 한병 다먹었네요
2019-11-04,4,처음 와인 사봤는데 굉장히 부드럽고 향도 진하고 좋은 경험이었어요 감사합니다
2019-11-17,4,달아서 기분좋고 가볍게 먹기 좋아요
2019-11-09,5,제가  원하는  포도주 맛이네요선택하길 잘했어요
2019-11-05,5,제가 찾던 맛입니다 달콤하고 깔끔한 맛을 찾았는데 이거다 싶네요   색깔과 맛이 행복입니다  감사합니다
2019-11-16,5,달콤해요 재구매입니다
2019-11-17,4,엄청 달지만 맛 좋아요
2019-11-11,5,아직 먹진 못했는데 배송이고 포장이고 빨리왔고 정말 맘에들게 왔네요 ㅎㅎ
2019-11-04,4,포장상자가 열려서 뚜껑쪽이 찌그러져 있었어요 ㅠ 리뷰보고 샀는데 아직 오픈안해서 맛은 잘모르겠어요
2019-10-25,5,오늘받았구요 아직마셔보진않았는데 리뷰가 좋아서구매했고 우리나라땅에서 생산된와인접해보려고 처음으로 제돈주고 국산와인구매했네요 번창하시기바랍니다
2019-10-14,5,넘 맛있고 목넘김이 좋아요매일 한잔씩 마시고 있어요
2019-10-20,5,두 병씩 두 번째 주문입니다덕분에 잘 먹고 있습니다건승하세요
2019-11-11,5,매우 만족스럽게 사용하고 있습니다
2019-10-09,4,부담없이 즐길 수 있습니다저는 그렇게 달 게 느껴지지는 않네요감사합니다
2019-11-11,4,맛이 부드럽고 달콤하니 좋네요
2019-10-01,5,정말 포도만 들어간게 맞나 싶을 정도로 너무 달고 맛있습니다 부모님도 좋아하시네요 ㅎㅎ 정말 좋습니다
2019-11-13,5,집들이 선물로 줬어요
2019-11-07,5,제입맛에는 딱이였어요 달달해서
2019-11-07,5,달콤하니 한잔씩 마시기 좋아요
2019-11-04,5,아직 먹진 않았고 주말 파티에 쓸 예정인데 이쁘네요
2019-10-10,4,달달하니 맛있네요 다음에 또 주문할게요
2019-10-31,5,정말맛있어요재구매100퍼입니다포장꼼꼼해요
2019-11-02,5,달달해서 맛있다고 생각했는데 도수가 높네요
2019-10-17,5,배달오면소 와인병 깨질까봐 걱정했는데 뽁뽁이를 엄청 겹겹이 정성스럽게 포장해주셔서 좋았어요 와인오프너도 주셔서 좋았구요
2019-10-13,5,맛도  좋았고  목넝김도 좋더라고요  오자마자 다비웠음 ㅋ
2019-11-01,5,아직 먹어보진 안았지만 택배가 아주 빠르게 포장 잘되어 왔어요
2019-10-05,4,제입맛엔 진짜 혀가 아릴정도로 달아서 잘 못먹겠네요 ㅠㅠ 엄청 단맛 좋아하시는 분께는 최고일 듯 싶습니다 알콜향도 별로 안나고 정말 설탕을 부은듯한 단맛이에요
2019-10-09,2,너무 달아서 요리에 더 적합한 맛인것 같습니다먹고나니 독해서 속 쓰려서 죽는지 알았네요와인먹고 이런적은 없었는데 알콜이 많이 들어있네요한모금정도 마시면 될것 같네요개인적으로 재구매 의사는 없습니다
2019-10-29,5,맛도 좋고 배송도 빠르고 포장상태도 좋습니다
2019-10-04,5,다른거 먹다 요번에 바꿔보았네요  맛이 있겠죠 상품평이 좋으니
2019-10-27,5,잘먹고 있어요 수고하세요
2019-11-02,4,달고음료수 같은 맛입니다
2019-10-22,4,아주 좋아요다음에 또 구매할게요
2019-10-23,5,맛있어서 선물하려고 또주문했어용
2019-10-28,5,배송도 빠르고 좋네요 잘먹겠습니다
2019-11-04,3,너무 달아요진짜 너무 답니다
2019-10-17,5,달고 괜찮은데 무게감이 좀  있네요  그래도  딱내가 찾던 와인인거 같네요
2019-09-19,5,벌써두병째인 와인이네요 레드와인은 맛없다는 편견이 있었는데 와인축제갓다온 친구가 추천하길래사봣더니존맛탱진심맛잇네요ㅎㅎ
2019-09-05,5,매번 주문해서 먹고있습니다 최고에요 달달하고 향도 넘 좋구 포장은 정말 이렇게 꼼꼼해도 되나 싶게 꼼꼼하고 갯수 맞춰서 오프너까지 챙겨주셔서 정말 감사합니다 주변에 선물하고 얼른 더 주문하러오겠습니다
2019-10-12,5,상품평보고 구매했습니다 받자마자 하얀 고급진 포장상자가 맘에들었고 센스있는 병따게 까지 좋았습니다 
2019-10-31,5,사업번창하세요 
2019-10-09,3,광명동굴에서 시음했을땐 엄청 맛있었는데 이게 그 와인이 아닌가봐요 ㅠㅠ옴청달아서 먹기힘들었어요
2019-10-24,5,한 병 다 마시면 재구매하려구용 넘 맛나요
2019-10-24,5,빠른배송감사합니다
2019-10-23,5,아직다안먹어봤는데  포장도 좋고 굿굿
2019-10-07,5,진짜 이것보다 달면 이건 그냥 포도주스에 설탕 또 탄거겠거니 싶은맛이지만 정말 달달한거 좋아하시면 두병사세요
2019-10-15,3,알콜있는  주스같았어요  먹기편함  막단게아닌  달콤새콤
2019-10-24,5,빠른배송감사합니딘
2019-10-11,5,배송이 꼼꼼해서 좋았어요 선물 받으신 분이 좋아하셨기를
2019-10-05,5,잘받았습니다 배송도 빠르고 제품도 좋아요 자주시켜먹을께요
2019-10-19,5,달달하니  맛나네요
2019-10-18,4,와인이 생각보다 단맛이 강합니다
2019-09-29,4,달콤한와인 좋아하시는 분들은 부담없이 드시기 좋아요맛있네요부모님들이 좋아하셨어요
2019-09-17,5,와인이참맛나네요 부부가잘 마셔답니다
2019-10-14,5,사실 안먹어 보긴 했는데 먹어보고 맛있음 재구매할개연
2019-10-02,5,먹고나서 재구매했구요 배송도 빨라서 더 좋네요  다마시고 또 구매할게요ㅋㅋ
2019-11-07,5,기대중이에요 굿굿
2019-09-27,5,마싯네요옹ㅋㅋㅋ굿굿
2019-10-05,5,우선 포장상태가 너무 좋았고 개인적으로 달달한걸 좋아해서 시켰는데 좋은거 같아요
2019-10-15,5,두번째 먹는건데 정말 맛어쵸
2019-09-14,5,달콤하고 좋아요 다음에 또 주문하려구요
2019-10-01,4,생각보다 너무 달아서 놀랐어요ㅋㅋㅋ 제가 먹을때 목넘김은 좀 끈적 거렸어요
2019-09-10,5,적당한 가격의 와인 찾고 있다가 상품평도 많고 가격도 저렴해서 사봣어요 기대 이상으로 맛도 좋고 만족스러워요 그리고 배송도 빠르고 포장도 굉장히 꼼꼼했어요 다음에 또 와인 사게된다면 고려 대상 1순위 일거 같습니다
2019-10-08,5,달달한 와인 좋아하는데 너무 달달하고 맛있었어요
2019-10-05,5,선물용으로좋고 와인맛잘모르지만좋아요
2019-10-06,5,달달하고 맛있는데 많이 달아서 놀랐어요
2019-10-08,5,맛있고 부드럽습니다
2019-07-12,5,재구매하는 제품입니다 한번 맛보고 좋아서 다시 구입하려다가 다른 후기많은 국내산와인 업체 와인도 궁금해서 고민되더라구요 똑같은 질문을 두업체에 드리고 고민하다가 답변보고 역시 같은곳에서 2병 더 재주문했어요 답변에서 제품에 대한 자부심과 세심한 친절함이 느껴져서 좋더라구요역시나 너무 달콤하고 은은하게 취하는게 너무 맛있게 1병을 먹고육아맘이라 와인즐길 시간이 쉽지않아 벼르다가 나머지 와인을 오픈했는데 문제가 생겨서 마시질 못했어요 구입한지 2개월쯤 되었는데도 문의드리니 바로 조치해주셔서 한번 더 감동 받았네요ㅠㅠ그래서 또 주문했어요 ㅎㅎ 긴 후기라 보실분들이 계실지 모르겠지만 와인초보자  술맛은 싫은데 기분좋게 취하고 싶은분들 무조건 사세요  맛있고 친절하시고 신속하시고 기분좋은 구매하시게 될거예요  이번 와인은 아직 오픈을 못해서 이전에 마신  사진 올립니다 ㅎ
2019-10-26,5,생각보다 달고 생각보다 알콜 쎄네요
2019-09-17,4,배송 빨라서 좋아요 포장 꼼꼼해요 맛은 아직 먹기전이라 기대합니다
2019-09-25,5,달달하고 좋네요 수면제가 필요없네요  먹으면 졸려요
2019-09-10,5,추석 태풍 등으로 배송이 늦은 감이 있지만 잘받았고 중간에 배송지연문의도 친절히 응대해주셔서 수고하셨어요
2019-09-04,5,선물 사드리려고 샀어요 아직 먹어보진 않았지만 좋은 재료로 만들었다니 믿어볼 수 있겠죠 선물 잘 할게요 감사합니다
2019-09-23,5,선물받은 친구가 좋아합니다배송이 완전 칼배송입니다
2019-09-14,5,아직 안먹어봐서 잘모르겠지만 포장은 꼼꼼하고 너무 만족했어요 포장에 감동했어요
2019-09-26,4,달달하고 맛이 좋아요
2019-09-22,5,맛있어요 또 주문할께요
2019-09-27,4,개봉전이라서 맛은 모르겠지만 포장은 만족합니다
2019-09-27,5,담에 또 시킬게요 감사합니다
2019-09-05,5,선물용으로 구입한거라 맛은 못봐서 보통 점수를 다음에는 제가 먹어보고 맛 후기도 쓸꺼에요아무튼 포장도 깔끔하게 오고 만족합니다
2019-09-27,5,아직 안먹어봣지맘 후기를 믿고 만점
2019-09-09,4,와인초보라 단맛만 찾아서
2019-09-02,5,지인께 선물드렸는데 아주 좋아하셨어요
2019-09-22,4,맛있네요 재구매하고 싶어요
2019-08-26,5,주말 가족행사때 먹으려 아직 개봉전이예요 평이 좋으니 믿을만하겠죠
2019-09-13,3,아직시음전이네요  리뷰가좋아구매했는데  시음해보고다시 평남길께요
2019-09-20,5,너무 맛있어요 굿굿 추천요
2019-09-27,5,빠른 배송 감사해요 ㅎㅎ
2019-08-13,5,고급스럽네요 튼튼하고 가격대비 아주 좋아요 포장도 엄청 꼼꼼해서 유리라 걱정했는데  오자마자 썼네요
2019-09-23,5,14500원과 무슨차인지 오프너 차이도 아닌거 같은데
2019-09-07,3,포장이 별루네요파손되어 다시 받긴했는데 둘둘  말린 에어캡을 풀르니 박스테이핑이 안되어있어 병이 밖으로 밀려나와 또 깰뻔했네요
2019-09-05,5,와인은 무슨맛인걸까
2019-09-17,5,양파 절임용으로 구매했는데 달달하니 맛이 좋네요
2019-10-01,4,달군요 fheognrognelfmeoi hnwfoiegnjipoe
2019-08-25,5,부모님 선물 기념일 축하 용으로 구매했는데 만족스럽습니다
2019-09-20,5,이러와인처음먹어봐요
2019-09-19,5,잘마실게요 수고하세요
2019-09-10,4,포장이 예쁘긴한데 표면에 검은색 같은 게 묻고 포장도 리뷰보다 고급지지 않아서 좀 아쉬웠네요 
2019-09-09,3,배송빠르고 맛도 괜찮은거 같긴한데 제 입에늖알콜올 맛이 좀 남아서 ㅠㅠㅠ
2019-09-10,5,조아요 선물했는데 만족
2019-09-11,5,달달하니 이벤트용으로 마시기 좋고 좋은 시간 보냈습니다 ㅎㅎ
2019-09-10,5,모든것이너무좋아요감사합니다요
2019-09-11,5,아직 와인들을 경험 중이라 함부로 평판은 못하겠네요
2019-09-12,5,술을 못하는데 달고 맛있어요
2019-09-08,4,고기랑 먹으니까 합이 너무 좋았습니다 부드럽네요
2019-09-09,5,맛나네요 목넘김도 좋구요
2019-09-14,5,매우 빠르고 매우 좋아요
2019-09-02,5,조항요
2019-08-20,5,아직 마시기전인데 리뷰가 좋아서구매했구요광명동굴서 마셨던 스윗한국산 와인과 비슷할것같아서 구매했어요맛있음 재구맷날것임
2019-09-09,5,와인이 진짜 진짜 달아요
2019-09-07,5,재구매 조만간들어갑니다
2019-09-07,5,달달하고 맛난 와인입니다
2019-09-06,3,그런대로  괜찮아요
2019-08-21,5,달달하니 좋네요 
2019-09-01,5,엄청 달아요 포도향이 물씬
2019-08-20,5,스위트와인이네용ㅋㅋ 가볍게 분위기도 잡히고 맛나고 좋아요
2019-07-23,5,아직 오픈전이지만 저번에 지인을통해서시음 해본적이 있어서 맛은 의심이 안들고요포장도 꼼꼼해서 좋아요
2019-08-28,5,정말 최고의 국산 와인 말이 필요없음
2019-06-09,5,앞으로 국산 와인으로 바꿔서 마시려고 여러곳에서 주문해서 마셔보었는데 다른곳에서 배송와서 먹었을때도 감탄하고 만족하며 먹었는데도 결국은 이곳 와인이 저에겐 베스트네요ㅎㅎ좋아하는 포도향이 듬뿍나고 달달함이 제가 너무 좋아하는 맛이예요피부 트러블이랑 불면증 때문에 마시기 시작한거라 하루 한잔이면 되는데 너무 맛있어서 매일 한병씩 비울 기세라 다이어트에 걱정되긴 하지만ㅠ그만큼 푹 빠져버렸네요일주일도 안되서 혼자 3병 비우고2병 더 주문하러 왔어요한번에 많이 주문하고 싶은데 그만큼 더 빨리 마실까봐ㅎㅎ또 주문하러 올께요
2019-09-10,5,edfsgsergergerfgaqwerg
2019-08-13,4,도수가 잇어서 그런지 쓴맛과동시에 단맛이 너무 강해여 좀만 덜 달앗으면 좋겟어여 맛은 깊은맛은잇어여 단거만 좀 빼면 최고입니다
2019-08-20,5,여름휴가 가서 와인 맛있게 잘먹었습니다담에 또 구매할게요
2019-08-09,5,배송 맛 다 좋네요
2019-08-27,5,아이스 와인보다 더 달아요
2019-08-19,4,와인보다는 복분자주 같이 진한 액기스 느낌 찐하면서 달달하고 맛있어요
2019-08-23,4,달달하니 좋네요포장 꼼꼼해서 좋앗습니다
2019-08-20,5,아직은 마시지 않아지만 쓴맛이 많이 안나서 좋아요
2019-08-06,2,재구매했는데 첫번째 구매했을때랑 맛이 달라졌어요 다먹고나서 후기를 뒤늦게쓰는데 탄산이라고 해야하나 스파클링이라고 해야하나 톡쏘는게 너무심해여 변질이 됐는지 원래 이러지않았는데 4병 다그래요ㅜㅜㅜ
2019-08-07,5,달달하고 부담없습니다
2019-08-25,3,괜찮은거 같애요 호아
2019-08-20,5,목넘김도 부드럽고 달콤하고 맛있어요
2019-08-10,5,달고 좋아요 포도주 맛이 깊고 풍미 있어요
2019-08-23,3,포장이 꼼꼼합니다 ㅎ
2019-08-15,5,2번째 시킵니다와인 잘모르는데 달아서 맛있네요
2019-07-25,5,부드럽고 달달해서 기분좋게 다 마샸습니다
2019-08-03,5,다른 레드와인보다 달고 맛있어요잘산거 같아요다먹고 재구매할게요
2019-08-07,5,아직 마셔보지 않았지만 기대하고 있습니다
2019-08-05,4,생각보다 달달하네요 잘마셨습니다
2019-08-06,5,달콤한 맛입니다  초보자용
2019-08-04,4,알코올 섞인 달달한 포도주네요
2019-07-28,4,가격대비 상품이 떨어지지 않아서 좋네요
2019-07-25,5,블로그에 평이좋아서 구매했어요
2019-07-28,5,맛있네용 몇병 더 사놔야겠어요
2019-07-27,5,포장잘되어왔고 맛있어요ㅎㅎ
2019-07-23,5,두번째 주문해서 먹는데 너무너무 달달하고 맛있습니다
