date,star,text
2021-01-13,4,생각보다 많이 달달합니다 먹다보면 적응해서 괜찮아요
2021-01-24,5,한 달 전에 먹었지만 또 생각나네여 조만간 또 시킬게용
2021-01-06,5,만족합니다 ㅎㅎ 배송도 빠르고 좋아요 ㅎㅎ 감사합니다    또 구매합니다
2021-01-01,4,달고 맛있어요 목넘김도 좋네요
2021-01-07,5,포도맛이 강하네요
2021-01-20,5,맛있어요감사합니다
2020-12-24,5,지인에게 선물로 한병  제꺼 한병  구매 했는데 가격도 맛도  부담 없어 좋네요 다 마시고 후에 재구매 하려고 합니다
2021-01-23,5,생각보다 맛있었어요
2020-12-28,5,아 달달구리 너모 맛있어요ㅋㅋ재구매 각이에요
2020-12-25,4,약간 시큼하고 좀 달달해요여성분들 취향일듯하네요와인 오프너 3개나 주셔서 감사
2021-01-04,5,인생 와인을 만났습니다저는 화이트 스파클링은안맞더라구요 소백산와인은 레드와인으로목넘김도 너무나 좋고 향도 좋고 정말요 아이 물건입니다재구매 쭉쭉 할꺼예요
2021-01-25,5,햐  인정합니다 맛잇어요
2021-02-13,5,달달하니  조아요  조아요
2021-01-16,5,포장도 깔끔하고 선물용으로 좋아요
2020-12-31,5,아직 맛보기 전인데 배송도 빠르고 죻네요
2021-01-04,4,평소 먹어본 와인보다는 색다른 맛이에요 새콤한 맛 같이 먹은 사람은 특이해서 더 맛있다는데 저는 조금 낯설었어요 배송이 꼼꼼해서 좋았답니다
2020-12-23,5,포장도 잘되있고 맛도 있고 빠른 배송 넘 좋아요
2021-01-25,5,달달해서 맛있어요
2021-01-15,5,달달하니 맛있네요술잘못하는분들 추천요
2021-01-12,5,맛 괜찮아요 근데 많이 달아요  도수는 12도인데 포도주스 같기도 하구
2021-01-13,5,맛있어요 배송도 빨리 됐구요 2병을 금방 먹었네요 ㅎ
2020-12-19,5,맛있어요단맛이 강하고요 사실 포도 주스에 알코올 탄 느낌이예요 바디감은 light해요
2021-01-08,5,1 산뜻한 포도향2 부드러운 단맛과 목넘김3 꼼꼼한 포장4 두잔 먹은 후 다음날 숙취없음별다섯개부분
2020-12-18,5,잘 받았습니다엄청 달아요 ㅎㅎ달아서 맛있어요 쓴거를 워낙 못마셔서많이파세요
2021-01-20,5,맛이 좋아서 재구매할듯 하네요
2021-01-13,5,맛있네요 가성비 아주좋습니다
2021-01-01,5,선물보내기 좋아요
2020-12-24,5,크리스마스 이브에 울신랑과 한잔 하고 있어요
2021-01-20,5,술찌인데 달달하니 너무 맛있네요
2020-12-19,5,와인알못인데 까자마자 한병 다 먹었어요 적당히 달고 적당히 시고 신선한 포도향이 나요
2021-01-15,5,이제 와인은 소백산외인 말고 다른건 마실수가 없어요넘넘 맛나요
2020-12-15,5,와인을 즐겨드시는 남자친구 부모님 결혼기념일이라 선물했는데 모두 맛있게 잘 드셨다고 합니다  후기보고 혹시나 너무 달까봐 고민했던 시간이 아깝네요 ㅎㅎ 튼튼하고 안전하게 보내주셔서 감사하구요 맛있는 와인 또한 감사합니다 
2021-01-18,4,끝 맛이 너무 시지도 달지고 않아서 좋아요
2020-12-26,5,처음먹어봣는데 달달하고 맛있었어요
2020-12-27,5,모스카토나 다른 화이트 와인에서 달콤한건 많이 마셔봤는데 레드와인이 이렇게 달콤할 줄이야 ㅎㅎ 와인이 달달해서 안주는 약간 담백하거나 짭쪼로만 치즈가 딱이네요 재구매 의사 오백프로 입니다
2021-01-05,5,크리스마스때 마시려고 주문했었는데 너무 맛잇게 잘먹엇어요 알쓰인 저엑에 한성맞춤인 달달한맛  종종 구매할께요
2020-12-28,5,달달하다는 얘기듣고 연말와인으로 구입해봤어요
2020-12-30,5,너무 맛나요재구매 꼭 할꺼예욤
2020-12-20,5,캠핑가서 먹을러 구매했는데 포장상태가 너무 좋아서 편하게 가져갈수 있을거 같아요
2020-12-24,5,향과맛은좋앗어요  술을입에도 못대서ㅜㅟ알딸딸ㅎㅎ
2021-01-07,5,배송도빠르구 상품포장도 꼼꼼하게 잘왓어요많이파세용
2021-01-01,5,선물보내기 좋네요
2020-12-16,5,생신날 와인으로 축하주햇네여 달고맛나영국산최고
2021-01-04,5,ㅠㅠㅠ 진짜 맛있어요 여자친구가 완전 만족해서 기쁩니다다음에도 또 시킬려구요
2020-12-26,4,달달하고 포도향이 좋아서 술 잘 못드시는 분들은 분위기 내기 좋아요 묵직한 맛은 부족합니다
2021-01-19,4,잘 먹겠습니다번창하세요
2021-01-13,5,교회 성찬식때 마시는 포도주 맛이어요달달해서 즐겁게 마실수있네요
2021-01-22,5,남편이좋다고하네요ㅎㅎ
2021-01-16,5,배송빠르고맛있어요
2020-12-27,5,제가 술 잘 안 먹고 와인도 써서 잘 못먹는데 이건 맛나게 잘 마셨습니다 근데 술 잘 마시는 분들께는 좀 달지도 몰겠네요 제 입맛엔 아주 잘 맞았음
2020-12-27,5,생각했던대로 달고 맛있었어요
2020-12-15,5,달달하고 맛있어요 스위트 와인 중에 제일 맛있는 것 같아요
2021-01-19,4,옛날보다 산미가 강해진듯
2021-01-08,4,초보자들한테 부담없이 접근할수 있슬것 같다달콤한 맛과 향이 자꾸 손이간다
2021-01-10,5,달달하니 맛있어요 잠자기전 조금씩 마시니까 좋ㅇ네요
2020-12-29,5,달달하니 맛있었어요
2020-12-27,5,친구 추천으로 알게 된 와인인데 너무 달고 맛있습니다 와인 잘 모르는 분들이 입문하기에 딱 좋아요 ㅎㅎㅎ
2020-12-25,5,포장이 아주 꼼꼼히 잘되있어요
2021-01-11,4,배송 빠르고 포장 꼼꼼하고 좋습니다
2021-01-16,5,달달하니 아주좋습니다
2020-12-28,5,달콤 하고 적당히 매스함
2020-12-18,5,배송도 뽁뽁이로 엄청 안전하게 포장왔어요잘 마실게요
2021-01-16,5,술찌인데 달달하니 맛잇어요
2021-01-18,4,달달합니다  가벼운 맛
2021-01-15,5,가격대비 괜찮은거 같아요
2021-02-09,5,너무너무너무너무너무너무 맛있어요
2020-12-15,5,좋아요 엄마가 넘 맘에들어하세용
2021-01-11,5,달달하고 맛이 부드럽습니다
2020-12-23,5,선물용으로 구매했는데 진짜 좋은 것 같아요 제가 맛보지는 않았지만 소백산 와인이라니 괜히 더 신기하고 특별하게 느껴지는 것 같습니다 저도 크리스마스에 맛보려고요
2021-01-10,5,너무 맛나요잘먹을께요
2020-12-28,5,감사히 잘 마시겠습니다
2020-12-28,4,마셔봤는데  맛이 있다 없다를 떠나서  달콤한 와인이라고 표현하기는 좀 그렇습니다가성비 괜찮습니다
2021-01-04,5,국내산이라 좋고 달달하게 크리스마스 분위기내면서 잘먹었습니다한잔 더 하고 싶네요ㅋ
2020-12-04,5,매력있는 와인달달한 매력무료배송이면 부담없이 주문할거 같은와인ㅎ다시찾게 될거 같은 소백산와인
2021-01-10,5,달아서 술술 들어갑니다 별로 안취하네 했는데 어느덧 헤롱헤롱
2021-01-02,5,좀 달긴한데 편하게 마시기 좋습니다포장도 꼼꼼하고  선물용으로도 괜찮을 것 같아요
2021-01-04,5,와인을 처음 접하시는 분들도 맛있게 먹을수 있어서 좋아요
2020-12-25,5,스윗하고 맛있어요
2020-12-27,5,달달하고 포도맛 향이 확 느껴집니다 씁쓸한 맛을 원하시는 분에게는 안 맞을수도 저는 정말 맛있게 마셨습니다
2021-01-10,5,달달하니 포도쥬스 먹는것같고 홀짝홀짝 마시게돼요
2020-12-23,5,크리스마스에 마시려고 미리구입했어요
2020-12-23,5,빠른배송 만족합니다
2020-12-26,5,와인 오프너까지 주시고 선물 할수있게 이쁜 포장과  종이가방까지맛도 너무조아서 자주시킬껏같습니다
2021-01-13,4,맛있게 잘 마셨어요
2020-12-27,4,와인이 달콤해서 좋네요  쓴 와인은 전혀 못 마시겠더라구요 선물용으로도 괜찮을 것 같아요
2021-01-01,5,달콤하면서 맛있네요 다음에 또 구매할께요
2021-01-08,5,맛있어요 담에도살게요
2020-12-16,5,어우 맛이 좋네요 어른들이 넘 좋아하심 ㅎㅎㅎ
2020-12-26,5,진짜 포도향이 좋아요켐벨포도의 향이 느껴지고달달하지만 좀 마시니 취기가 올라오네요
2021-01-09,5,난 소백산와인이 젤루 맛있습니다
2020-12-12,5,음료수처럼 달고 맛있어요 최고에요
2020-12-21,5,안전하게 잘 도착했습니다
2020-12-23,5,이브 저녁에 마실려고 킵했습니다
2021-01-04,5,리뷰가 좋아서 구매했는데 달달하니 맛있네요
2021-01-05,5,선물이라 아직 풀러보진않았지만 맛있을 거라 믿슺니다
2020-12-05,5,맛있는 스위트 와인 찾고 있었는데 만족합니다 다 마시면 또 구매하고 싶어요
2020-12-25,5,포장도 배송도좋아요 맛도 달콤하니 좋아요 입문와인으로 적당해요 크리스마스건배했네요
2020-11-20,5,달달하고 쌉싸름하고 맛있어서 계속 먹게되요받자마자 3잔이나 마시고 뻗었어요매일 밤 한잔씩 하면서 분위기 내려구요 감사합니다더 작은 용량의 와인도 있던데 그건 솔드아웃이더라구요 그것도 얼른 그 상품도 입고되면 좋겠어요
2021-01-10,5,세상에서 젤맛있습니다
2020-12-21,4,맛이 달다는 정보가 있었는데 국내산포도 품종이 좋아서와인 맛을 기대했습니다 생각보다 달지만 고기류 크래커랑 먹었스비니다 와인만 마셔도 될것 같아요
2020-12-19,5,좋아요자주 애용할듯요
2020-12-23,5,뱅쇼 만들려고 주문했어요
2020-12-11,5,3번째 구매입니다 저번엔 재고소진되서 한동안 주문안하다가 주문했네요
2020-12-31,5,정말 맛있게 마셨어요 색깔도 좋고
2020-12-21,5,이젠 소백산정말 맛있어요 독하지 않아서 좋아요 술냄새가 안나서 더 좋아요
2020-12-16,5,와인 재주문이에용 지난번에 먹어보고 넘 맛있어서 또 주문해요와알못이지만  달달하고 맛있습니당요번주에 친구들이랑 먹을거에여용
2020-12-26,5,제가  좋아하는  맛과  향제  입맛에  딱이네요재주문 의사  있습니다 ㅎ
2020-12-28,5,술맛모르는사람인데 이건 맛있네요문제는 달아서 자꾸먹게됨
2020-12-24,5,달달한 와인 찾던중인데 제겐 딱이네용 달달하니 넘 맛나요 앞으로 자주 구매해야 겠어요
2020-11-13,4,매년 연말이 생일인 울신랑과 집에서연말파티 때 오픈하려고 주문했어요포장도 꼼꼼하게 잘 도착했어요마셔보고 다시 한달 후에 후기 남길께요
2020-12-09,5,빠른배송 감사합니다 냉장고에 보관하기 그래서 베란다에 잘 올려 놓았습니다
2020-12-23,5,크리스마스 선물로 구입했는데 좋아들하십니다배송도 타이밍 때 좋았습니다메리 크리스마스네요
2021-01-07,5,포장도꼼꼼하고맛도좋네요
2020-12-19,5,좋은가격에 맛있는 와인
2020-12-26,5,와인초보도 꿀꺽꿀꺽 목넘김이좋고 달아서 좋아요 덕분에 크리스마스 더 잘보냈네요ㅎㅎ
2021-01-12,4,달달하네요 좋아요 굿
2020-12-14,5,호불호가 갈릴꺼같은맛이긴한데 전괜찮았어요
2020-12-19,3,아직 먹어보진 않았지만 기대중입니다
2020-12-23,5,배송도 빨랐고 맛도 좋습니다 딱 제가 원했던 달달한 와인이네요
2021-01-05,5,포장에서부터 맛까지고급 와인의 품격을 느끼게 하네요
2020-12-25,5,요즘와인에빠져서 이것저것먹어보는데 아주입맛에 맞아용 ㅎㅎ 달달하니 다음에 또 시킬까해요
2021-01-03,5,부드러우면서 향이 아주 좋았습니다
2020-12-20,5,결혼기념일에 와인한잔 들이키려고 주문했어요포장도 꼼꼼히 잘되어 있고 맛도 좋으네요
2020-11-30,5,알쓰인 저는 안맞지만남자친구는 괜찮다고 했어요엄청 달다는 맛에 구매했지만역시ㅠㅜ알쓰는 웁니당그래도 저는 제가 알쓰라 그런거지만남자친구는 괜찮다고 했고 만족합니다
2021-02-07,4,음soso
2021-01-06,5,재구매했어요 친구들도 주려구요ㅎㅎ
2021-01-05,5,달콤하고 향도 좋아요
2021-01-03,5,너무 맛있어요 다음에 또 시킬게요 굿굿
2020-12-18,5,잘 받았고 이브날 잘 마시겠습니다
2021-01-06,5,배송이매우빠르고 좋습니다
2020-12-11,4,와인 초보입니다시중 마트에서 파는것들을 고르기가 어려워스위트와인 찾다가 국내와인이라 해서 구매했어요살짝 달면서 숙성된 포도즙 맛인데나쁘진않네요 반주로 조금씩 마십니다
2020-12-24,5,아직 먹어보진않앗지만 맛잇을거같아요 기대가 됩니당 배송도 빠르고 좋아요
2021-01-02,5,맛있어서 또 주문하려고 합니다
2020-12-23,5,맛기대해봅니다
2020-12-22,5,크리스마스에 엄마랑 집에서 단둘이 달달한 와인 한잔 하려고 구매했습니다 배송 빠르게 잘 받았습니다 맛있으면 재구매 하겠습니다
2020-12-24,5,포장배송오프너맛아주 만족 합니다죄송스런 부탁 이라면 마개도 같이 함께라면ㅎ
2020-12-18,5,맛이 좋아서 재구매 4병 했습니다얼른 마시고 재재구매 할게요지인들에게 연말연시에 선물 계획합니다
2020-12-28,5,스위트와인이라 뱅쇼 만들어 먹었어요 너무 맛있어요
2021-01-07,5,맛있는 와인입니다
2021-01-08,5,달달하게 마시기 좋습니다
2021-01-04,5,가성비 좋고 달달하니 맛있네요 ㅎㅎ
2020-12-27,5,다행히 크리스마스 전에 도착해서 잘 마셨어요 나중에 한번더 주문할게요 
2020-12-30,5,맛있어요재구매할계획입니다
2020-12-29,5,예전에 먹어보고 맛있어서 또 주문했습니다
2021-01-05,5,맛있게 잘 먹을께영
2021-01-08,5,늘 이 와인만 먹어툐
2021-01-06,5,달달하고 맛있네요ㅎ
2020-12-30,5,국산와인 처음 먹어보는데 달달하니 괜찮네요
2021-01-03,4,달달한데너무 달달하네요
2021-01-03,5,딱 좋습니다 감사합니다
2021-01-08,5,너무 맛있었ㅈ습니다
2020-11-17,2,딱 옛날에 동네 슈퍼에서 한병 천원에 팔던 진로와인 맛입니다 달짝지근한 저려미 맛  포도만으로 제대로 만든 와인이 아니라 설탕 넣고 만든 거네요 추억 생각하며 환불 안 하고 마시지만 재구매 의사는 없습니다
2020-12-28,4,크리스마스에 마실려고 주문했는데 26일에 도착해서 마셨는데 맛있네요
2021-01-12,5,만족
2020-12-18,5,너무 맛있는 와인입니다요달달하고 부드러운 찐 와인그렇다고 가벼운 음료수같진않아요 ㅋ홀짝마시다 취한답니다 강추
2020-12-24,5,맛있습니다 ㅎ맛좋아요
2021-01-03,5,맛있어요 많이파세요
2021-01-03,5,달달하니 맛있네요 굳
2020-12-30,5,좋아요연말에 분위기내려고 구매하였습니당
2020-12-24,5,친구생일선물로 구매했는데 친구가 좋아해요 다음에도 구매할께요 
2020-12-28,5,와인향도 너무 좋고 목넘김도 너무 부드러워요
2020-12-26,5,진짜 포도주스에 알코올있는맛이에요 달달하니 너무 좋네용
2020-12-16,5,와인은 안마시는데 평이 좋아서 주문했어요  달달하고 맛있어요
2020-12-28,5,달콤하고 부드러워서 부담없이 마시기에 좋아요
2020-12-31,5,달콤하니 맛있게 먹었습니다
2020-12-10,3,정말 달달하고 괜찮아요 생각보다 도수는 좀 있지만 재구매 의사 있어요달달한거 좋아하시는 분들에겐 추천해요
2021-01-02,4,적당히 괜찮네용 굿
2020-12-29,5,알쓰인데이 와인은 맛있고 부드러워요
2021-01-03,5,엄청달달해요 맛있어요
2020-12-30,5,넘 맛있어요 추천해요
2020-12-29,5,아직 먹어보지 않았지만 잘 왔네요
2020-12-18,4,와인 잘 모르지만 먹고는싶고 가볍고 맛있게 먹기 넘좋아요 완전 맛있어요
2020-12-27,4,달달햇어요 알코오일 잇는지는모르겍어요
2020-12-28,5,먹어본 레드와인중에 제일 맛있었어요
2020-12-24,5,집에서 담근 포도주 같아요맛있습니다
2021-01-01,5,와인은 잘 모르는데 먹을만해요
2020-11-14,5,스위트 와인 별로 안좋아하는데 이건 엄청 달고 맛있어요 약간 포도주스느낌 엄마가 엄청 좋아하시네욯ㅎㅎ다른 와인도 먹어보고싶내요 담에 또 시킬께요 많이 파세요
2020-11-03,5,배송 안내도 계속 해주시고  꼼꼼한 포장 감사합니다   믿고 구매했어요  기대이상입니당
2020-12-31,5,완전 좋아요 ㅋㅋ 굿굿
2020-12-29,5,아직안마셔서 중간점수로 리뷰남깁니다
2020-12-31,5,아직 먹기 전이지만 기대됩니다
2020-12-29,5,달달하이 맛좋네요 굿
2020-12-18,5,크리스마스에 마시려고샀어요아직 개봉전에요포장 완전꼼꼼해요
2021-01-04,5,재주문 했습니다
2020-11-24,5,미리 주문 해놓고 하루 한잔씩 너무 잘 멋고 있어요 강추 합니다 
2020-12-25,3,너무달아요국산술 우리와인을 응원합니다
2020-12-04,5,포장이 굉장히 꼼꼼하네요 잘 마셔보겠습니다 ㅋ
2020-12-24,5,코로나로 외출도 못하고집에서 분위기 좀 내보려구 구매했어요
2020-11-09,5,넘 맛있어요 기다린 보람이 있었네요ㅎ국산와인이라 어떨까했는데 적당한 알콜도수에 달콤한 맛까지 정말 맛있어요술을 잘하지 못하는데 마시기 딱 좋아요
2020-12-09,5,달달하고 맛있어서 또 주문했어요 ㅎㅎ 와인오프너 함께 챙겨주셔서 너무 감사합니다
2020-12-24,5,완전 포도즙 같은 맛인데 달달하니 맛나용
2020-12-27,5,쓴맛 하나도 안나고 달아요
2020-12-25,5,향이 넘 좋고맛있어요
2020-12-22,5,진짜맛있어요ㅎㅎㅎ두번사세여
2020-12-26,5,적당히 달콤하고 맛있어요
2020-12-23,5,배송 잘받았구요잘먹겠습니다
2020-12-26,3,오프너가 약해서 부서짐힘들게 와인땀
2020-12-25,5,처음으로 와인 한병을 다 먹어봤습니다
2020-12-25,5,맛도 부드럽고 깔끔해요
2020-12-17,5,안전하고 빠른배송 감사합니다맛있어요
2020-12-25,5,빠른배송으로 잘 받았어요
2020-12-15,5,배송 잘왔고용 맛있어서 두병더  시키네요
2020-12-25,4,하루 두세잔 달달한 와인을 찾으신다면 이 와인
2020-12-26,5,맛있게 잘먹었습니당
2020-12-10,5,달짝지근하고 제가 딱 좋아하는 와인이에요지인분께 선물도 드렸는데 좋아하셨고 그 지인분도추가로 더 구매하신것 같아요ㅎㅎ
2020-12-16,4,알콜 자체를 잘 못 먹는데 이 와인은 단 편이라서 마시기 좋은 것 같아요
2020-12-25,5,재구매해서 마시고 있어요
2020-12-01,5,달달하니 좋아요 잘마셨습니다
2020-12-18,5,그동안 맛봐온 어느 와인보다 향긋하고 맛있습니다
2020-12-24,4,성찬식 와인 딱 그런 맛이네요
2020-12-22,3,생각보다 크네요 좋아요
2020-12-11,5,맛있어요  숙성이잘되서 깊은맛이나요  여성분들이 편하게 먹을수 있는맛
2020-12-14,5,전반적으로 좋았어요또 구매하고 싶어요
2020-12-16,5,아주 맛있어요 재주문할게요
2020-11-20,5,맛있어서 재구매입니다 남편이 심장건강 신경써야해서 믿고 계속 주문합니다
2020-12-21,5,조아요 조아요 조어요
2020-12-14,5,기다리던 와인이 도착했네요맛이 좋네요종종 구매할듯요
2020-12-23,5,먹었던것들중에 가장맛있음
2020-12-20,5,완전 달달구리 엄청 맛있어요ㅔ
2020-12-07,1,특유의 소주냄새가 났어요 진로포도주맛좀실망스러워요
2020-12-15,4,달긴달아요 근데 저는 맛이고나서 좀머리아팠어요 T T
2020-12-21,5,와이프가 먹어본다고 삿다 난안먹어본게 함정
2020-11-11,4,아직 못 먹어봤지만 맛있을거 같아요 지인선물했었다가 재구매합니다 포장도 단단히 잘 해주셨구요 무사도착했어요
2020-12-18,5,연말분위기 내려 샀어요 잘마실게요
2020-12-15,5,크리스마스때 신랑이랑 먹으려고 샀는데후기보고 맛있대서 구매했습니다
2020-12-20,5,술맛이 차말 좋으네요달콤해요
2020-12-17,4,맛도좋고 오프노도 주셔서 좋습니다
2020-11-19,5,와인 초보자라서 세밀한 표현은 못하고  그저 혀끝에  감기는  달콤함과 향긋함이 좋아요
2020-12-18,5,너무 달아서 지나치게 달아서 맛있네요
2020-12-23,5,인위적인 맛이 안나고 깊은맛이 있ㅇㅓ여
2020-11-28,5,이번 와인은 성공적인것같아용
2020-11-23,5,맛있어요 또사먹구싶네요
2020-12-18,5,맛이 깔끔하고 달콤합니다
2020-12-14,5,가성비 좋은 국내산으로 믿음이 가네요
2020-11-03,5,판매자분이 엄선해서 보네주신 국내산 포도주 기다렸더니 보너스로 작은병 하나를 더 보내주었네요 감사 합너다 많이 파세요
2020-12-18,5,크리스마스때 마시려고 사 봤어요
2020-12-14,4,와인 처음 사봤는데 먹을만하네요
2020-12-14,3,달달해서 여자들이 먹기좋아요
2021-01-05,5,재구매 좋아요 좋아요
2020-11-04,4,포장 아주 잘 해주셨구요달짝지근하니 맛있어요꼭 옛날 집에서설탕 많이넣고 담은 포도주맛이에요여성분들 좋아할듯
2021-01-10,5,맛있습니다맛있습니다
2020-12-12,5,배송 잘왔고용 맛있어용
2020-11-03,5,이미 친구집에서 먹어보고 구입 했어요너무 맛있게 잘 먹었습니다 저렴한 가격에 좋은 와인 앞으로도 자주 주문 할께요
2020-10-28,1,살다살다 이런 와인맛은 첨이네요와인 검색하다 리뷰가 너무 좋아서두병사서 저하나 동생하나 줬는데동생과 지인이 먹어보더니 둘다 뿜을뻔 봤다하네요저보고는 절대 먹지마라고 동생이 신신당부 했는데오늘 먹어보니 첨 한모금 넘기고 제 입맛이 이상한가하여 물로 입 헹구고 한모금 더 넘겨보니저도 뿜을뻔 봤습니다딸기잼휘발유 냄새가 역하게나고맛도 이상한데 끝맛이 엄청 떫고 텁텁함이 심하네요속이 매스꺼워 더는 못먹고 버렸네요이젠 머리까지 지끈지끈 아파오네요ㅜㅜ리뷰쓰신분들은 대단한 입맛을 가지셨나봅니다
2020-12-20,5,좋네요 잘 마실께요
2020-11-17,5,맛있구요 너무좋네요번창하세요
2020-11-12,5,저희는 남편이랑 와인을 즐겨 하는데 밥먹고 한잔씩 마시면 포도향이 은은하게 올라와서 기분이 너무 좋아져요그래서 이번에 가족 모임이 있어서 20개 정도 구매 했는데 배송도 빨랐고요 단지 아쉬운건 제가 글을 잘 읽지 않아 쇼핑백을 못받았네요 ㅎㅎ에구
2020-11-18,4,와인을 잘 몰라서 그런지스윗이래서 달콤한줄알았더니 쓰네여
2020-12-10,5,포장도 꼼꼼하고 맛도 좋습니다
2020-11-19,5,달달하고 오프너도 같이 있어 좋아요
2020-12-17,4,좀 많이 달아요 묽어요
2020-12-13,5,달달구리 와인 좋아해서 취저였어요ㅎㅎ
2020-11-14,5,넘나맛있어요ㄷ니주문하고 싶읏ㄴ정도로근데너무 달아요ㅜ
2020-11-21,5,술잘못하는 여성분들 드시기에  깔끔하니좋아요전 뱅쇼 만들어먹을려고 구매햏는데 그냥먹기도 괜찮네요
2020-12-11,5,배송빠르고 좋아요좋아
2020-11-03,4,포장도 꼼꼼하게 와서 배송 잘 받았어요 후기 많아서 구매했는데 맛있네요 ㅎㅎㅎ
2020-12-06,4,괜찮아요  반주로마시기딱좋아요
2020-12-09,4,구매평이 맞네요 신선한 맛입니다
2020-12-06,5,미미한 탄산 느낌이 있어서 넘김이 좋습니다
2020-12-07,5,배송 굿포장 굿부모님이 너무 좋아하세요
2020-11-07,5,배송 늦어짐에 친절히 안내해 주시고 꼼꼼히 챙겨주심 넘 감사했습니다
2020-12-08,5,아직 시음전이라 잘 모르겠어요
2020-12-10,5,마시기 좋아요 ㅋㅋ
2020-12-02,5,달달한 와인을 원하시는분께 추천합니다
2020-11-07,5,배송도 만족스럽고 맛도 좋아요 선물받았었는데 맛있어서 주문했어요스위트 주문했는데 다른것도 같이 주셨어요 그것도 맛보고 맛있으면 또 주문하려구요
2020-11-24,5,와인 잘 안마시는데 이거 마셔보고 계속 주문해서 먹고있어요너무 맛나요ㅜ
2020-11-19,5,술을 전혀 못하는  나달콤한 와인 찾다가 넘 독해서 항상 실패우와 이건 주스인지 와인인지넘 맛있어요 이제 와인매니아가 될듯ㅎㅎ
2020-11-12,5,배송 빠르고 맛있어요
2020-11-03,5,오프너랑 같이 받으니까 좋네요 빨리 맛보고 싶어요
2020-11-04,5,배송이 느렸지만  맛은 최고입니다
2020-11-11,1,친구들과 여행시 먹을꺼라 우선 증정품을 먹었어요근데 후기가 좋아서 고민도 않고 구매한 실수가 ㅜㅜ달지도 않고 맛없는 독한 와인이네요후기는 뭔지에휴
2020-11-03,5,너무 맛있어요 감사합니다
2020-11-02,5,와인 맛있었습니당 와인 그냥 먹어도 맛있구 샹그리아로 먹어도 맛있었어요
2020-11-13,5,맛있고 한국포도 특유의 향이 좋네요 당도가 좀 높은편이라 많이는 못먹겠어요ㅎ
2020-10-04,5,차게 해서 먹어야 확실히 맛있는 거 같아요 처음에 오자마자 미지근한 상태로 적었을땐 알코올 냄새만 나고 별로였는데 얼음 넣어서 먹으니까 맛있더라고요 근데 얼음 넣으면 밍밍해져서 냉장고에 넣어서 차게해서 먹으니까 맛있었어요 술은 좋아하는 편이 아닌데도 괜찮게 먹었어요
2020-11-04,5,다른데는 설탕이 들어가는데 여기는 안들어가서 좋아요
