date,star,text
2022-11-18,5,일단 두말할것없이 너무 고급스럽고 달고 맛있어요 레드 와인이 소량 마시면 몸에 좋다고 해서 한 번 구매해봤는데 뜯자마자 향긋하고 풍미도 좋네요 무엇보다 어머니께서도 알코올 잘 못 드시는데 한 번 마셔보시더니 알코올 거부감 없이 맛있고 좋다고 하시네요 앞으로 레드 와인 생각날 때마다 자주 애용할 것 같아요 맛있어요
2022-11-24,5,같이 마시려했던 분이 좀 편찮으셔서 아직 못뜯었네요 와인 초보라 기대가 많이 됩니다 평가가 좋은데엔 이유가 있지요 잘 마시겠습니다 감사합니다
2022-11-21,5,오프너 필요없을때 따로 구매하는곳이 있네요 ㅎ 담엔 저기로 시켜야겠어요
2022-11-17,5,아이스와인 종류를 찾다가 후기 보고 구입합니다 지인들 선물 주려고 여러병 주문했어요
2022-11-23,5,안전하게 뾱뾱이로 잘 감싸서 보내주시고 맛도 달달하니 좋더라구요 다음에 재구매 예정
2022-11-21,4,달콤하고 맞이좋아요자기전에 부담없이 마시기 좋아요
2022-10-26,5,매번 시키네요 포장잘되어왔어요
2022-11-20,5,또 시켜 먹었는데 역시 엄청 달달구리합니다
2022-11-20,5,친구와캠핑가서분위기냄
2022-11-09,5,소백산와인 스위트버전 머루맛 강해서 달고 맛있어요
2022-10-11,5,맛있어요 달콤해서 좋아요 김치냉장고 보관중
2022-10-21,5,한병남았는데 또 시킬꺼예요
2022-10-14,4,아직 안마셔봤어요 추천받았어요
2022-11-08,5,떨어지면 항상 재구매 합니다
2022-11-01,5,부드럽고 맛있어요 좋아요
2022-11-01,5,안전하게 잘 왔어요잘 마실게요
2022-10-07,5,벌써 열병은 시킨듯신랑이 이것만 마셔요
2022-10-22,4,달달한게 목 넘김이 좋아요
2022-10-26,4,맛있게 잘 먹었습니다
2022-10-26,4,달콤한게 너무 맛나네요
2022-09-24,4,맛있고 술 냄새도 많이 나지도 않고 떫지도 않고 너무 좋았어요
2022-10-17,5,맛있고 분위기낼때 조은거같아요
2022-09-23,5,선물용으로샀어요 맛있었읏ㅇ좃계네요
2022-09-17,5,여유만 된다면 열병씩 재놓고 먹고싶습니다
2022-09-13,5,명절 선물로 보내고 처음 보내는 국산와인이라살짝 걱정했는데 리뷰처럼  다들 맛있다고해서다행이었습니다 감사합니다
2022-10-04,5,항상 여기 와인사요 맛있어요
2022-09-13,5,명절에  식구들에게 보냈는데   한국와인을 처음 보내는거라  살짝 걱정했는데  리뷰대로 다들 만족하시네요감사합니다
2022-09-20,5,잘먹었습니다 다음에 또 볼수있습니다 좋을꺼 같아요 감사합니다 수고하세요
2022-09-13,5,명절 선물로  식구들에게 보내주었어요모두 만족하신다고 하시네요한국와인 자주 이용해야겠어요
2022-09-13,5,명절 선물로 보냈습니다 포장과 배송은 절대 걱정할 필요없네요  맛도 다들 좋다고해주셔서아주 좋았습니다
2022-08-21,5,아주 만족한 선물이였습니다또 구매하겠습니다함께주신 와인따는것도 별거아니여도 함께 선물드리니 좋아하시네요
2022-08-20,5,리뷰가너무좋아서   먹어봤는데 너무맛있어요  와인초보들이 먹기에는 너무좋아요
2022-09-13,5,명절선물로 식구들과  주변 지인들에게 보냈는데배송과 포장은 절대걱정하실 필요가없을듯합니다맛또한  괜찮으니 너무 좋습니다
2022-09-13,5,주변 지인들과 식구들에게  보냈습니다다를 괜찮다고 좋다고해주시니  너무 좋았습니다감사합니다
2022-09-24,4,국산메이커의 자존심 맛있어요
2022-09-13,5,리뷰가 좋아서 명절 선물로 보내드리고  기다렸는데다들 배송도 빠르고  맛도 괜찮다고합니다
2022-09-02,5,병도 이쁘고 기대해봅니다
2022-09-21,2,맛이 와인의 느낌이 아니에요
2022-09-02,5,적당한 가격에 적당합니다 저는 와인도 술도 안좋아하는 사람이지만 그냥 평범하네 라는 느낌입니다
2022-09-11,5,항상 잘 이용하고있습니다
2022-08-11,5,뽁뽁이라고 돌돌돌 안깨지게 안전하게 포장 잘해주셨고너무 맛있어서 선물하려고 4병 구매했슴다
2022-08-16,5,음료처럼 편하게 마시기 좋아요
2022-08-09,5,시원하게 냉장고에뒀다먹으니광명동굴에서 사먹었던 그와인 맞네요
2022-08-14,5,자주 시켜먹는데 아주좋아요
2022-08-31,5,항상 맛있게 먹는 한국형 와인입니다 최고
2022-08-17,5,맛있어요 달콤하고 딱 제 취향
2022-07-17,5,맛은 좋아요 조금 단감이 높다는거 빼고는아무튼 잘마실게요 감사합니다
2022-08-10,4,친구 생일 선물로 보내서 맛은 모르겠지만 선물하기 좋은거 같아요 다음에는 저도 한번 주문해 먹어보려 합니다
2022-08-21,5,좋아요좋아요좋아요굿
2022-08-21,5,향도 좋고 맛있어요
2022-08-21,5,숙성된 느낌으로 묵직하네요
2022-07-24,5,여행가면 꼭 사고 와인마시고 싶으면 이거만 사서먹어요ㅠㅠ말이 필요없죠 진짜 이거야말고 술 잘 못마시고 잘 마셔도 알콜향싫어하시는 분들을 위한 술 그치만 그냥 술을 잘 마시는 분들에게는 포도쥬스로 느껴진다는 점 참고해주세요
2022-07-26,5,맛있게 잘 먹고 있습니다굿
2022-08-03,5,진짜너무마싯어요ㅜㅜ
2022-07-13,5,저는 술을 못해서 이것도 강했는데 주위에선 좋아해서 선물을 엄청 많이했어요 가격대비 훌륭한거 같아요
2022-07-27,5,국산 와인은 처음인데 도전해 봅니다
2022-08-17,5,빠른 배송 감사합니다
2022-07-24,5,특별한일 있을때 자주사는 와인이에요 굿
2022-07-27,5,와인을 많이 즐기지는 않지만너무 맛있어서 와인 먹을 땐 항상 주문합니다 많이 파세요
2022-07-04,4,술술 잘넘어가요단맛이 강하고 가볍게 한잔씩 마시기 딱 조아요
2022-07-03,5,작년에 3병구매하구 이번엔 선물용으로 구매했어요너무너무 밋있다고 감동해서 기분이 좋네요
2022-07-06,5,배송도 빠르고 늘 맛있게 잘 먹고 있습니다
2022-07-23,5,넘 맛있어서 여행기념으루 친구들한테 선물 했어용맛있다고 좋아해서 뿌듯했습니당 
2022-07-09,4,빠른배송 감사합니다포장도 꼼꼼하게 잘 보내주셨어요 맛있게 먹고 또 주문할게요
2022-07-08,4,아내랑 호강스 떠나면서 2병 구매해서 가지고 갔는데 집사람이 정말 좋아 하네요 알콜류를 않좋아 하는데 이 와인 만큼은 너무 좋아하고 호강스 내내 같이 한잔씩하면서 즐기다 왔어요
2022-06-30,5,술을 못하지만 이건 맛이 있네요주말에 가족여행때 가져가려고 주문했어요
2022-07-09,5,배송도 빠르고 만족합니다
2022-07-28,5,배송도 빠르고 넘 조아요
2022-06-25,5,잘 받았습니다 국산와인에 맛도 좋아요 
2022-07-05,5,와인초보 신랑은 이것만 마셔요 ㅎ
2022-06-08,5,벌써 몇병째인지 몰라요ㅎ 맛있어도 다양한종류가 있음 더 좋겠어요
2022-07-08,5,여기알고 너무 먹네요 암튼 굿굿
2022-07-11,5,와인은 항상 여기꺼 먹어요 맛있어요
2022-07-13,5,여자친구 생일때문에 샀습니다
2022-06-29,5,지인한테 선물했는데 달달하니 맛있다고 하네요 ㅎㅎ 선물용으로 가볍게 좋은 것 같아요
2022-07-11,5,배송도빠르고 좋아요
2022-06-11,5,선물용으로 구입해서 맛은 못 봤어요 ㅠㅠ 개별바틀 박스도 있어서 선물용으로 좋네요
2022-06-21,5,달달하고 맛있네요
2022-06-22,5,가성비 좋은 한국와인 최고에요지인들에게 전파중입니다 세번째구매인데 다 맛있대요
2022-06-27,5,배송도 빠르고 달달하니 맛있어서 넘 잘마셨습니다
2022-06-21,4,기대이상으로 달달한데 살짝아쉬운 맛 그래도 전채적으로는 맛있네요
2022-06-01,5,요즘 소백산 와인에 푹 빠져 살아요 넘넘 신세계 맛이에요
2022-06-27,5,진짜 포도맛나네요 좋네요 굿굿
2022-06-22,5,넘 만족했고 다음에 와인 살일 있으면 또 구매하려구요
2022-07-01,5,배송도 빠르고 포장도 꼼꼼
2022-05-31,5,부모님 선물로 드렸는데 친구분들과 즐거운 시간 보내셔 좋았어요
2022-05-23,4,항상 애용하는와인입니다  향이독특하고 달달진해요  가격이저번에주문했을때보다 올랐네요ㅠ
2022-06-29,4,가성비 좋은 와인입니다
2022-05-20,5,엄청 달고 맛있어요 딱 저희부부스타일 한잔씩먹고 푹자려고샀는데 재구매할것같아요
2022-06-22,5,바로 재주문들어갑니다 서비스많이주세요
2022-06-22,5,좋은제품감사합니다
2022-05-28,5,2번째주문 한잔먹고 자면 꿀잠보장
2022-06-07,5,달달하니  맛납니다 단맛에 혹해서 취할듯 도수가 높네요
2022-05-11,5,역쉬 좋아요 달달하니 제입맛에는 딱이네요 자꾸 구매하게 되네요
2022-05-10,5,선물로 입문용 국내와인 산건데 좋아하네요 또 주문할게용
2022-05-17,5,아주 맘에 듭니다 다음에 또 구매할께요
2022-05-16,5,항상 애용하는 제품입니다 맛있어요
2022-05-30,5,만족합니다 배송도 빠르고
2022-05-09,5,배송정말 빠르고 좋습니다 맛은 달달합니다
2022-04-28,4,먹어보진않았지만 후기믿고 선물용으로 구매했어요  배송받은거에있어 문제가있었는데 빠르게 해결해주셔서 문제는 없었습니다
2022-04-19,5,넘 맛있어서 다 마시기도전에 부족할까봐 2개 더 주문했어요나중에 선물용으로도 넘 좋을것 같아요이렇게 고급진 와인을 만들어주셔서 감사해요
2022-05-28,5,술 못먹는 술찔이인데전 한잔먹으니까 바로취함요 
2022-05-14,5,저는 첫날보다 먹고 다음날이 더 맛이 좋았던거같아요ㅎㅎ진짜 포도맛이 확느껴져서 저녁마다 한잔씩 먹는데 좋은거같아요ㅎ
2022-03-07,5,스위트 레드와인을 찾던 중에 좋은 와인을 발견했어요 엄청엄청 단편은 아니고 달달하면서 신맛이 덜하고 묽은 편이어서 목넘김 부드럽구 가볍게 마시기 좋아요 가격도 착하고 맛있어요 저녁에 까서 한번에 반병 마시구 잤어요 ㅎ 아 떫은맛은 포도먹을때 느낄 정도보다 약간 더 세요 약간의 씁쓰름한 맛이 있는데 더 달달한 걸 좋아하시는 분은 와인이랑 코카콜라랑 1대1로 넣구 와인칵테일로 해서 드시면 좋을 것 같아용배송은 택배상자에 뽁뽁이로 꼼꼼하게 포장되어 왔어용 평소 스위트 와인 좋아하는데 앞으로도 계속 구매해서 먹을 것 같아요
2022-05-03,5,선물로 보내드렸습니다 맛있으셨답니다 만족
2022-05-22,5,적당한 달달함이 완전 맛있어요
2022-04-25,5,아직 먹어보진 않았지만 맛있을거 같아요 평도좋구요 잘먹을게요
2022-05-02,5,친구들이랑 마셨는데 다들 달달해서 맛있다고 했어요
2022-05-01,5,아직 먹지는 않았지만 장식용으로도 예쁘네요
2022-04-26,5,맛잇어용 달아서 좋아요  재구매 할거예욤
2022-04-22,5,제가 제일 좋아하는 와인이에요 늘 만족합니다
2022-04-26,5,맛있는  국산  와인을  알게되어서  정말  좋아요
2022-04-06,5,지인선물로 보냇더니 넘좋아하시네여국산와인맞냐구하시면서ㅎㅎ근데 와인따개는 별도로 사야하나보네요ㅠ첨에는 줬던거같앗는데편의점가서삿네요ㅋ
2022-05-06,5,달아서 좋네요 맛있어서 자주 시키고 마시게 되는게 유일한 단점이네요 ㅋㅋㅋ
2022-05-09,5,맛있어요 다음에 또 주문 하게습니다
2022-05-07,5,너무도 만족입니다담에 재구매 의사 있어요
2022-05-04,5,다른 비싼와인보다 이게 제일 제 입맛에는 최고네요
2022-04-08,4,먹기전이라서요근데 기대 많이 하고있어요
2022-05-01,3,아직 마셔보진않았지만 리뷰가좋아 기대가큽니다제가좋아하는 스윗한맛이기를ㅎ
2022-04-13,5,간만에 맛있는 와인 한잔했네요
2022-05-06,5,달콤하고 맛있어요
2022-04-13,5,좋아요 맛도있고 또 구매할께요 감사합니다
2022-04-21,5,배송이 빨라서 좋았구요무엇보다 와인 초보자인 저도 목넘김도 부드럽고맛도 적당히 단맛이나서 맛있었습니다
2022-04-28,4,단골집입니다 달달하고 맛나요
2022-04-05,5,잘 왔습니다 맛있어요
2022-04-23,5,와인 초보인  저에겐 신맛이나떪은맛이없고 달콤함이좋았어요
2022-04-09,5,하루만에 다먹었습니다 ㅋㅋ
2022-03-19,5,저번에 먹고나서 넘 맛있어서 친구 선물로 줬어요 아주 맛있습니당ㅎㅎ
2022-03-29,5,처음시켜봤는데 맛있으면 또주문할게요
2022-04-30,5,달달한게 맛있어요
2022-04-17,5,선물로 구매했는데 너무 잘먹었다고 하네용
2022-03-22,5,최고에요 또 먹고싶어요
2022-03-24,5,입문와인으로 먹었는데 진짜 달고 맛있어요 이거 말고 와인을 한 네다섯병 더 먹어봤는데 이게 진짜 베스트 다음에 어디 여행가거나 할 일 있으면 또 사가려구용
2022-04-14,5,달콤한 와인 찾고싶으면 이거 추천해요
2022-04-12,5,먹어본 와인 중엔 이게 으뜸이에요 ㅠㅠㅠ
2022-03-02,5,쟁겨 두고 마시려고 주문했는데 다 마셔 버렸네요 맛도 좋고 향도 좋고 요즘 짝꿍하고 와인에 푹 빠져 사네요
2022-04-08,5,빠른배송 안전포장 굿굿굿
2022-04-05,5,아직 마시기전이라 맛있었으면 좋겠어요
2022-03-10,4,맛있어요 잘 먹었습니다
2022-01-24,5,지난번에 기념일 파티하느라 소백산 와인을접하게 되었는데 진짜 맛있는거예요그래서 이번에 엄마 생신때 식구들끼리마시려고 주문해봤어요배송은 빠른편이었어요소백산와인은 그야말로 입안 가득포도맛이 가득해요외국 와인처럼 떫은 맛이 없고정말 100퍼센트 포도만으로깊이 숙성된 그런 맛이에요와인을 잘 못마시는 사람들도 쉽게마실 수 있는 와인이네요특유의 떫은 맛을 좋아하시는 분들에겐어떨지 모르겠으나 저는 매우 만족입니다색깔도 얼마나 고운지 눈도 즐겁네요사진은 지난번 기념일 파티때 사진입니다재구매 의사 있습니다
2022-04-01,5,선물했는데 너무 좋아하셨어요
2022-04-05,5,항상여기서 사먹어요 맛잇어요
2022-03-16,4,달큰하고  목 넘김이  좋아요알콜이  잘  안  받는  체질인데  이건 좀  마실  수 있어요 한  잔  마시고  뒀는데  신랑이 하루만에  다  마셔버렸어요ㅜ
2022-03-11,4,빠른배송 저렴한가격 좋아요
2022-04-05,5,진짜 맛잇어요 쟁여놓아야겟어요
2022-02-20,5,많이 달긴 하지만 부모님이 좋아하셔요 달아서 술 못 하는 저한테는 딱인지라 홀짝홀짝 맛나게 먹었습니다
2022-02-08,5,지인선물해줬는데 난리도아니네여ㅋㅋ맛나다고국산와인이 이렇게 맛나도 되느냐구딱자기스탈이라며 넘좋아하네여ㅎㅎ달달이 두병씩 보내줘야겠어요
2022-02-14,4,맛있어요  색상도너무이쁘고 목넘김도 부러워요  계속시켱석고있읍니다 다먹고  재구매의사있읍니다  많이파셔요
2022-03-10,5,친구 생일 선물로 줬어요 달달한 와인 찾다가 샀는데 가격대비 너무 잘 산거 같아요
2022-03-27,5,맛있고 부드럽고 좋습니다
2022-03-18,5,취향에 차이가 있지만 전 우리나라 제품이기에 더 믿음이 갑니다재구매 의사 있습니다
2022-04-28,5,
2022-02-27,5,사진을 못찍었는데 너무 맛나게 마셨어요
2022-02-18,5,부드럽고 식사후 한잔씩 마실려구  주문햇어요 소문대로 맛나네요  또 주문할게요
2022-02-25,5,맛있고 향도좋고 저렴하고 좋아요
2022-02-21,5,와인 초보인데 너무 만족했어요 퀄리티 너무 좋네요 재구매 했어요
2022-02-18,5,우와 포장을 엄청 싸매서 보내셨네요 달콤해서 마시기 좋아요 계속 주문하게 되네요
2022-01-25,5,너무 맛있어요달콤한맛 최고에요다른 와인 못먹어요주변에 강추강추 하네요연휴동안 소백산 와인과 함께즐거운시간을 가족과 함께 보내려구요
2022-03-12,5,달달하고 맛있어요값은 전보다 약간 올랐네요
2022-02-15,5,너무 좋아요 달달하고 맛있습니다알쓰라서 걱정했는데 잘 마셨습니다
2022-03-22,5,최고의 품질입니다
2022-02-16,5,택배파업으로 인해 배송은 늦었지만 제품은 만족합니다 다음에 재구매할께요
2022-02-19,5,재구매에요 달달하고 맛있습니다 선물용으로도 좋아요 따자마자 다 마셔버려서 사진이 없네요ㅋㅋㅋ 달달한데 도수가 생각보다 있어서 조심해야해요ㅋㅋ
2022-03-01,5,처음인데 잘 먹겠습니다
2022-03-17,5,달달해서 맛있게 잘먹었습니다
2022-02-25,5,선물로도 좋아요
2022-04-08,5,마싯어요 괜찮아요 ㅎ
2022-02-18,5,와인을 제돈주고 산건 처음인데 향이 맘에 들어요
2022-03-24,5,잘 먹겠습니다
2022-02-12,5,캠벨 포도 향이 정말 좋았고여 달달해서 여자친구랑 맛있게 잘 마셨습니다
2022-03-16,5,받아만 놓았네요 좋아요
2022-03-24,5,맛잇어요 
2022-02-18,5,항상 시켜먹는데 달고 맛있어요
2022-02-21,5,믿고마시는 와인이에요 달달해요
2022-01-25,5,달달해서 와인보다는 주스 느낌이에요 와인 입문자분들이 마시기 좋을것 같아요 친구랑 고구마피자에 곁들여서 먹었는데 꽤나 잘어울렸어요 알콜 냄세도 별로 안나고 좋았습니당 담에 또 재규매하려구요
2022-02-10,5,한번 마셔보고 자꾸 주문하게 돼요너무 맛있어요
2022-02-01,5,진짜 맛있어요 ㅋㅋ 와인 잘 못먹는데 이건 매일 사먹고싶을정도류 맛있어요
2022-02-10,5,믿고 마시는 와인이에요 와인 초보라 달달하고 목넘김좋은소백산와인 맛있어요
2022-02-12,4,돌잔치 이벤트선물로 준비했어요 맛은못봤지만 저렴한가격으로 구매할수있어서 좋았습니다 다음엔 제가 먹을 용도로 구매해보려구요
2022-02-17,5,맛있어서 재구매합니당 ㅎㅎ
2022-02-12,5,항상 꼼꼼하고 만족합니다
2022-01-26,5,몇번째 재주문인지 모르겠어요부드럽고 달콤하고 목넘김도 넘 좋아요울 신랑 최애 와인
2022-03-04,5,달콤한게 좋아서 재구매 했습니다
2022-02-26,5,정말 달고 친숙한 포도향이 좋습니다
2022-01-12,5,많이 달지만 드라이랑 섞어 먹으니 맛있어요 친구가 추천해서 사봤어요 ㅎㅎ 가격도 적당하고 향기가 진짜 포도향이라 눔 좋아요 크리스마스에  마셨답니다
2021-12-27,5,친구 추천으로 한번 마셨는데 그때 맛이 너무 맛있었습니다 그때 이 와인을 기억 해두고 1년만에 직접 주문해서 마셔봤는데 여전히 맛있습니다 와인 초보인데 와인의 씁쓸한 맛이 별로 였는데 이 와인은 달콤하고 목 넘김도 좋고 딱 제가 생각한 이상적인 맛이었습니다 와인 초보나 달달한 와인을 찾으시는 분들께 꼭 추천드립니다
2022-02-26,5,달콤하면서 풍미 있는 레드와인이네요
2022-02-24,5,선물했는데 지인이 엄청 좋아하네요
2022-01-25,5,포장은 확실하고요 달달하니 목넘김이 참 좋아요
2022-01-15,5,궁금해서 한번 주문해봤는데 엄청 달콤해요 목넘김도 좋고 가볍게 먹기 좋네요
2022-02-19,5,제 최애 와인입니다 맛있어요
2022-02-19,5,좋아요좋아뇨좋아요좋아요
2022-02-16,4,선물했어요 맛있다고 하네요
2022-02-07,5,도수도 잇으면서 맛이 좋아요 ㅋㅋ  또 사먹을만 합니다
2021-12-26,5,포장이 2중으로 엄청 꼼꼼하고 빨갛고 색상도 어쩜이리도 이쁜지달달하고 목넘김도 부드럽고 맛있어요다마시면 또 구매합니다
2022-03-20,5,최고
2022-02-22,5,자주 재구매해서 먹어요
2022-02-14,5,달콤한 와인을 먹을때 적극추천합니다
2022-02-19,5,맛이 달고 진해요
2022-01-27,5,선물하기 좋은것 같아요
2022-01-01,5,너무 좋아요 전에 우연히 접한 이후로 와인 사거나 선물하게 되면 항상 소백산 와인으로 하고 있어요 너무 맛있고 좋아요
2022-02-16,5,달달해서  잘 마셨어요
2021-12-30,5,정말 맛있어요 한병순삭 맛도 목넘김도 향도 다 좋아요 너무 만족해요 감사합니다  자주 시킬께요
2022-02-10,1,너무 달아서 제 입맛에는 안맞네요
2022-01-05,5,너무 맛있어서 선물하려고 4병이나 샀네요 달콤한맛을 좋아하는 저한테는 딱이에요
2022-01-11,5,달콤해서 넘 맛있어요술 못하는 우리에게는 분위기 낼 때딱이예요
2022-01-26,5,완전 만족이염 ㅎㅎㅎ
2022-02-17,5,너무 좋아용
2022-01-24,5,너무 달콤하고 맛있어서 재주문 했는데 역시나 너무 맛있네요 다음에 또 주문할게요
2022-02-09,5,맛있어서 술술 넘어가요
2022-01-20,5,이거이거 물건이네요ㅋ넘나 맛나는데 술이 이래도 되나요ㅋ반칙이죵 한병 졸지에 다먹게생겼어요ㅜ2병시켯는데 곧장 재주문 해야될듯 합니다
2022-01-13,5,빠른배송감사합니다잘마셔볼께여
2022-01-10,5,예식 답례용으로 구매하였는데 포장도 꼼꼼하고 맛도 좋았습니다
2022-02-10,5,다시또살꺼에요 맛있음
2022-01-13,5,아직 개봉전 입니다주말에 먹을려구 달달해서 맛있다고 하니 더 기대되요
2021-12-23,5,크리스마스파티때 마시려고 구매했어요아직 안마셔봤지만 평이 너무 좋아서 기대중입니다포장도 꼼꼼해서 깨진곳 없이 잘 도착했습니다
2022-01-21,5,명절에 오픈하려구요
2022-01-05,5,선물로 샀어요 꼼꼼한 포장과 빠른 배송 감사해요
2022-01-22,4,와인을 잘 못마시는 편이라 맛이 있는건지 없는건지 잘모루겠네요ㅎㅎ 그래도 분위기 낼때 먹기 좋을 것같아용 한잔씩 ㅋㅋ
2021-12-14,5,두번째 구매에요 재구매라고 하면 만족하기에 재구매겠지요ㅎ와인에 대해 잘 알지 못하지만 전 단맛과 약간에 산미가 좋은거 같아요자꾸 마시게 되네요ㅎ
2022-02-04,5,시원하게 마시면 정말 맛있습니다
2022-01-25,5,첫 와인인데 맛도 좋고 잘 마셨어요 단맛이 확실히 있긴하네요 ㅎㅎ
2021-12-29,5,와인 입문자인데 맛있어요 달달하니 좋네요 크리스마스때 잘 먹었습니다
2021-12-28,5,달달하니 초보 와인으로 딱이네요 로켓배송 안되는 시골에 사는데 쿠팡보다 더 빠르게 배송됐어요 ㅋㅋㅋ 앞으로 종종 시킬 예정입니다
2021-12-27,5,과실향이 기분좋게 나는 달달한 와인입니다 여기저기 곁들여 먹기좋을 듯 합니다 도수가 더 낮은 버젼도 나왔으면 하네요
2022-01-26,5,맛있어서 매번 잘 먹고있습니다감사합니다
2021-12-30,5,항상 먹던맛 너무 좋아요선물해도 좋을것 같아용
2022-01-15,4,친구가 좋아했어요
2021-12-30,3,와인 좋아하는 친구들이 포도주스에 알코올 탄 것 같대요ㅠㅠㅠ 진한 맛은 부족했나봐요
2022-01-25,4,맛있네요 향도좋아요
2022-01-27,4,아직 마셔보진않았으나 일단 용량이 커서좋네요ㅎ
2021-12-23,5,우와 진짜 맛있어요 저는 신맛을 안좋아하느데 이건 너무 딱이네요 다마시면 또 구매해야겠어요
2022-01-27,5,포장도 꼼꼼하고 좋은 날 마시기에 딱이예요
2022-01-27,5,이제 선물은 무조건 이걸로 정했어요
2022-02-19,5,만족합니다 만족합니다
2022-01-19,5,명절선물로 구매했는데 포장꼼꼼하고 좋아요
2021-12-11,5,오프너 주시는걸 모르고 주문했는데 두개나 주셨네요 잘 쓸게요 맛은 아직 못봤지만 맛있어 보이네요 먹어보고 괜찮으면 대량으로 주문할게요 대박나세요
2022-01-29,5,제가 젤루 좋아하는 와인이에요 ㅎ
2021-12-11,5,2번째인지 3번째 주문인지는 헷갈리지만국산포도로 달콤하고 부드럽게만들어주셔서술을 거의 못하는 우리부부에겐 아주 좋아요그리고 오프너 감사해요
2022-01-02,5,굿입니다 향으로 한번 맛으로 한번 끝내줘요
2021-12-30,5,달달한 와인이라고 해서 주문해봅니다 빠른 배송 만족합니다
2022-01-20,5,정말맛있어서 다음에 또사먹을게용
2022-01-23,5,가격도 부담없고 와인 초보자도 달달하게 즐길 수 있는 와인입니다
2021-12-31,4,홈파티 및 뱅쇼 베이스로 3병 주문했습니다우선 랍스타요리에 잘 어울렸구요와인 초보도 달달하니 맛 있었습니다포장도 아주 꼼꼼하고 가격대비 고급스러워요재 구매율 100 입니다 
2022-01-18,5,달달하니 너무 맛있습니다여자친구와 먹기 좋아요
2022-01-12,5,너무 달콤한 와인이에요 와이프 생일이라 시켰는데 진짜 최고였습니다
2022-01-17,5,맛있는데 도수도 어느정도 있어서 알딸딸하고 좋아요 ㅋㅋ
2021-12-29,5,우선 쓰지않고 달달하고 달달한데 적당한 알콜로 내가 정말 맛있는 와인을 먹고 있다는 느낌이었어요 제가 단걸좋아해서 레드든 화이트든 쓴걸 안먹어서 그런지 이건 정말 맛있네용
2021-12-22,5,선물했어요인증샷을 보내주어 올립니다받은분도에게도 맛난 와인이기를
2022-01-20,5,너무 좋은 제품이에요만족합니다
2021-12-21,5,오랜만에 주문한 소백 이번엔 실패없이 맛있게먹었습니다 조만간 또 시킬게요
