date,star,text
2020-10-15,5,감사합니다 아직 안먹어봤는데 기대되요
2020-10-31,4,전통주중 안동소주가쵝
2020-10-10,5,향도 좋고 저렴해서 항상 믿고 구매합니다 잘 마실게요 감사합니다
2020-10-26,4,깔끔하고 목넘김도 괜찮아요
2020-09-24,4,포장상태 최고의 제품입니다 꼼꼼하게 포장 잘 되어있어서 파손될 염려가 없습니다
2020-10-16,5,맛있네요 좋은 술 감사드립니다
2020-10-20,5,빠른 배송 잘 받았습니다 감사합니다
2020-10-07,5,잘마시겠습니다 많이파세요
2020-10-15,5,이렇게 고퀄리티 소주를 저렴하게 마실 수 있어서 정말 행복하네요 
2020-09-21,5,아직 안마셔봤어요 저한테 맞는 전통주 찾고 싶어서 이것저것 구매했어요
2020-09-26,5,깨진거없이 잘 왔어요먹어보고 또 시킬께요
2020-10-27,5,항상 맛있어요 ㅎㅎ
2020-10-28,5,안동소주 22도 360ml 박재서 명인
2020-11-03,5,good and nice
2020-10-02,5,선물드릴려고 구매했어요
2020-10-09,5,좋아요좋아야ㅡㅇ조아요
2020-10-25,5,2번째 구매입니다 좋습니다
2020-10-04,4,저 사실 안동소주 마셔본적은 없고 선물로 보냈는데 사케맛이 난다더라고요 신기했습니다 껄껄 그래도 잘 마셨대요
2020-09-03,5,다양한 전통주를 저렴하고 편하게 구매할수있어서 좋습니다배송도 포장이 너무 잘되서 깨지지도 않네요선물용으로도 추천합니다
2020-10-17,5,증류주라 그런지 소주 하고는 목넘김이 확실히 틀리네요
2020-09-21,5,목넘김이 일단 좋구요 전통주 화이팅 입니다
2020-10-02,5,아부지 드실용으로 주문
2020-09-20,5,강쇠와 매실원주만 마셔봤는데 부드럽고 깔끔했어요얼릉 마셔봐야 겠어요
2020-10-18,5,높은 도수인데도 아주 좋아요
2020-10-18,5,처음마셔보는대 맛있네용
2020-10-17,5,일반 소주 질릴때 먹으면 좋아요
2020-09-18,4,배송도 빠르고 항상좋아요 많이파세요
2020-09-17,5,솔직히아직 마시기전이지만맛나보입니다
2020-09-28,5,연휴 전에 잘 받았습니다 포장이 정말 꼼꼼하고 튼튼하네요 다음에 또 이용하겠습니다
2020-10-07,5,소주랑은 확실히 다른맛이네요 향도 좋고 목넘김도 좋습니다
2020-09-25,5,맨날 요즘 소주만 먹다가 먹으니 확실히 쎄더라구요 ㅋㅋㅋ
2020-09-11,5,여러 종류의 술을 구입해보고 저에게 맞는 술을 찾고있습니다다양한 술 종류에 빠른배송 착한 가격까지 회원가입 바로 합니다
2020-10-15,5,향이  일반 소주와 확연히  차이가  있네요  굿
2020-10-11,5,숙취도 적고 맛과 향 모두 뛰어난 민속주의 매력에 갈수록 빠져들게되네요
2020-09-24,5,다음날 바로 도착해서 더 좋아요
2020-09-28,5,역시 믿고 먹는 안동소주
2020-10-05,5,35도보다 도수가 낮아서 마시기 덜부담스러웠어요 육류랑 먹는게 잘어울리는것같아요
2020-09-25,4,정종같다는 부모님의 평이 있었어요 하지만 근처에서 구입하기 어려운 술을 묶어서 편하게 구입할 수 있어 감사합니다
2020-10-02,5,배달도 빨랐고 다양한 전통주 맛볼수있어서 좋았어요 재구매하려구요
2020-10-14,5,한개도 안깨지고 와서 좋아요ㅎ
2020-09-27,5,역시 증류주는 다릅니다
2020-09-28,5,추석맞이 구매했어요
2020-10-15,5,먹고 괜찮아서 재구매했어요 굿
2020-10-14,5,안동소주 22도 맛뒤끝 등 타 주류와 비교불가
2020-09-11,5,두번째 구매입니다 모임때마다 늘 주문 할 것 같아요 너무 좋아요
2020-09-24,5,포장   만족합니다
2020-09-22,5,좋은안주있을때 함께마시면 참좋은술입니다
2020-10-05,5,정종느낌이에요 명절에 가족들과 마시면서 즐거운 시간 보냈어요
2020-09-17,5,맛잇어요 다음에 또 구매할게요 
2020-09-21,5,다음에 또 재구매 하겠습니다
2020-09-20,5,안동소주를 오래전부터 좋아라합니다
2020-09-14,5,역시 일반 소주 마시는것보단 목넘김도 좋고 맛있었습니다다음날 술냄새도 안나고 멀쩡합니다 하지만 단점은 너무 많이 마신다는거 ㅎㅎㅎ 좋은 사람들과 함께하면 참 좋은 술인것같습니다 구매한 술 벌써 다먹었네요
2020-09-20,5,안동소주가 이렇게 맛있다니
2020-09-23,5,잘마셨어요 포장이 꼼꼼하게 와서 깨질 걱정없겠네요 전통주 매력에 빠져서 앞으로도 잘먹을것같아요
2020-09-13,5,여행가사 기분도 내도 맛나게 잘 마셨습니다
2020-09-10,5,목넘김이 깔끔하고 도수가 높은데도 독한느낌이 안들어서 좋았어요
2020-09-30,5,맛있어요  최고 최고 굿이요
2020-09-17,5,배송빠르고 좋네요
2020-10-07,5,단골집이라 늘 들릅니다
2020-09-22,5,여러개 사봤어요안전배송 됐네요굳굳 먹어보고 맛있음 또 살게유
2020-09-27,5,배송은 느렸어요 ㅠ명절에 잘 마실게요
2020-09-09,5,명인 술 답게 굉장히 부드럽고 맛있습니다
2020-09-29,5,증류주 특유의 부드러움이있습니다
2020-09-25,5,선물드렸는데 마음에들어하세요
2020-09-28,5,굿 좋아요 또 이용할듯
2020-10-01,5,냄새 향긋 하고 좋넹요 추천
2020-09-08,5,다 좋아요 이거 드세요
2020-09-04,5,가성비 좋은 전통주 최고네요
2020-08-18,5,기존에 먹어봤던 술도 있고 처음 시켜본 술도 있는데 맛이 기대되네요 포장도 꼼꼼하게 잘 배송해주셨어요
2020-09-04,2,병 하나가 깨졌어요
2020-09-28,5,40도만 먹어보다가 한번 사봤어요
2020-09-28,5,한식과 아주 잘 어울려요
2020-09-14,5,이것도 다이어트용 맛잇대요 배송받은지 며칠안된거 같은데 많이도 마셧네요
2020-09-09,3,제 입에는 좀 많이 달아요 기대했던것보다 좀 달아서많이 마시지 못하고 한번 마실때 두세잔이 맥시멈
2020-09-25,5,부드럽고 맛있습니다
2020-09-06,5,역시 안동소주 깔끔합니다
2020-09-21,5,맛이 괜찮아요 만족합니다
2020-09-21,5,진짜진짜 향도 좋구 목넘김도 좋아요
2020-08-26,5,이거 기대 많이 되요 어떤 안주랑 먹을까나
2020-09-24,5,배송 받은 물품은 배송상태가 굿
2020-09-05,5,맛 배송 패키지 등모두 만족
2020-09-22,5,좋은제품 아주 감사합니다
2020-09-24,5,아직 안먹어봤지만 기대됩니다
2020-08-26,5,동생 줄려고 삿는데 싸구려 소주에 적응되서 맛잇없다던데 술 잘안하는 저는 겐찬았습니다
2020-09-02,5,좋아하지만 비싸서 자주 즐기지 못했던 안동소주를 이렇게 보급형으로 가성비 좋게 즐길 수 있도록 해주셔서 감사드립니다코로나 때문에 힘든 모든 이들에게 안동소주가 작지만 큰 힘이 되어주길 바랍니다
2020-08-23,5,항상 맛있게 먹고 있습니다 향이 너무 좋아요
2020-09-08,5,1일1소주 가능 깡
2020-08-18,5,한번 마시고 좋아서 또 주문 배송이 빨라 좋습니다
2020-08-22,5,포장 꼼꼼해요 전통주 기대됩니다
2020-09-22,5,물은 셀프어둠은 다크안동은 소주
2020-10-13,5,좋아 좋아 좋아 좋아 좋아 좋아 좋아 좋아
2020-09-19,5,마시기 좋아서 찾아서 샀네요
2020-09-16,5,안동소주 지깁니더 어느날부터 이것만 먹습니다
2020-08-31,5,항상 맛있게 먹고 있어요 이번엔 잘못 들고다니다 몽땅 깨먹어서 사진이 없네요 이번주에 또 시켜먹을게요
2020-08-24,5,목넘김촣고포장도 깔끔했어요
2020-09-11,5,다양한 종류 포장도 잘되어있고 만족합니다
2020-09-13,5,뽁뽁이로 포장이 잘되서 왔어요
2020-09-15,5,맛있어여 다 먹었는데 또 시킬예정
2020-08-25,5,전통방식으로 만드는 우리 술 좋습니다
2020-09-08,5,아주 좋았어요 추천합니다
2020-09-12,4,목넘김 깔끔하고  맛있습니다
2020-09-13,5,단골술입니다 자주시켜요
2020-09-09,5,역시 명인이 만든 술이라 그런가 좋았습니다
2020-09-03,5,외국인친구에게 선물하려고 샀습니다 좋아했으면 좋겠습니다
2020-08-27,5,자주이용할거같네요 편하게 막걸리와전통주들을 집에서 받으니 넘좋아요
2020-08-16,5,맛있습니다 자주 구매할 것 같아요
2020-08-08,5,첫향이 조금 강하지만 도수를 잘 못느끼겠어요상당히 깔끔합니다
2020-08-16,5,시원하고 뒷끝깨끗하네요
2020-09-12,5,사케보다 전통주
2020-08-06,5,안동소주는 처음이었는데 여러모로 놀랐습니다 향이 독특하던데 청주의 향기에 뭔가 짭짤한 냄새 같은것이 나고 생각보다 달콤했고 생각 이상으로 부드러웠습니다 22도라는 도수가 믿기지 않을 정도의 부드러운 목넘김에 계속 감탄했네요 잘마셨습니다
2020-08-06,5,와이프와 먹을려고 주문했어요천천히 먹어보고 딱 맞는 취양 찾을려고요
2020-08-14,5,부드럽고 은은한향이 입안에 싹 퍼집니다
2020-08-05,5,몇번 시켜보고 나름 엄선했네요전통주에 감동했습니다
2020-08-07,4,말그대로 평범한 지역청주 느낌이네요 무난했어요
2020-08-08,5,아직안마셔봤지만 안동소주 전에돞먹어봐서 어떤지알아요 굿
2020-08-11,5,이것저것 시켜봤고 다괜찮네요
2020-09-01,5,가벼운 선물로 좋습니다
2020-08-28,5,배송빠르고 물건 아주 좋습니다
2020-08-24,5,계속 재주문 중입니다 아주 만족합니다
2020-08-04,5,아직 먹지는 않았지만 전통주 배송 너무 편하네요
2020-08-27,5,아주 잘 먹었습니다종종 시켜먹을게요
2020-08-05,5,안동소주최고 만족합니다
2020-07-25,4,시음안해 봤음 솔직히 궁금하면서 구매한 리뷰가 좋아서 구매했음
2020-08-20,5,선물드렸는대 받으신분이 맛있다고 좋아하시네요
2020-08-04,5,항상 잘 마시고 있어요
2020-08-06,5,꼼꼼하게 포장왔어요
2020-07-23,5,좋아하는술 한번에 구매할수있어서 좋습니다
2020-07-23,5,잘 도착했네요무슨안주에 먹을까 고민중입니다
2020-08-10,5,명인이 빗는다고 하는데 확실히 효모향이 일반 안동소주 보다는 좀 더 나는 것 같아요 맛있게 먹습니다 단골입니다
2020-08-04,5,향과 맛이 좋고 목넘김이 좋아요 숙취도 없구요 잘 마시겠습니다 감사합니다
2020-08-13,5,또 다 마셨네요 이번에도 한 잔은 안동소주입니다
2020-07-23,5,가성비 좋아요 맛도 좋아요
2020-08-24,3,포장도 잘ㄷ되이ㅛ습니가
2020-07-23,5,희석식이랑은 다른 깔끔한 맛이라 좋습니다
2020-08-04,5,왜 안동소주가 유명한지는 마셔보면 압니다한동안 다이어트 때문에 중단했던 술이지만 조금씩 마시더라도 좋은 우리술 마시려고 합니다
2020-08-17,5,자주 시킵니다 안정적인 맛
2020-07-05,5,항상 맛있게 먹는 안동소주입니다 다만 배송 문제로 시간이 오래 걸렸네요
2020-07-22,4,아직 마셔보지는 않았어요 잘 마시겠습니다
2020-08-15,5,안동소주 맛있네오 ㅋ
2020-08-06,5,저렴한 가격에 여러병 주문했어요
2020-07-15,4,맛있게 잘 먹었고 맛이 좋았어요
2020-08-28,4,맛있어요 좋아요 ㅎㅎ
2020-07-07,5,명인 안동소주를 술마켓을 통해 처음마셔봤는데 향이 참좋아요
2020-07-03,5,구하기 힘든 술도 있는데  편하게 구매할수 있어 좋아요잘 마실게요
2020-07-25,4,처음 먹어보는 입장에서 개인적으로 평범했어요 그래도 나름 나쁘지 않았어요
2020-08-04,5,빠른배송 마음에 듭니다
2020-08-01,5,숙취 없어요 전통주 맛있네요
2020-08-04,5,평가가 좋아서 기대중
2020-07-07,5,포장도 깨지지않게 꼼꼼히 해주시고 술맛도 참좋아요
2020-07-13,5,담날에 숙취가 없어 좋아요
2020-07-17,4,부드럽고 좋아요
2020-06-28,5,다음날 숙취 깔끔하고 맛도 너무 좋아요 최고에요
2020-07-30,3,감사합니다 잘쓰고 있어요
2020-07-07,5,깔끔하고 좋습니다 맛나요
2020-07-27,5,매번 주문하고 있어요 최곱니다
2020-06-25,4,안동소주 저랑은 잘 안맞는데 평이 좋아 이건 어떤맛일까 하고 사봤는데 역시나 저랑은 안맞아용앞으론 저랑 잘맞는 강쇠를 더 많이 사야겠어요ㅎㅎ
2020-07-31,5,안동소주는 박재서 명인이죠
2020-07-14,5,안동소주는 이 제품에서 도수만 바꿔가며 마셔봤는데22도가 마시기 제일 좋네요 ㅎㅎ가장 좋았던건 다음날 숙취가 없었습니다
2020-07-28,5,아빠랑 남편이 문배주보다 낫다고 했어요 
2020-07-27,5,품질도 좋고 배송도 빨랐습니다
2020-07-23,5,배송빠르고 싸게 구입할 수 있어요
2020-06-26,5,배송도 빠르고 깔끔해서 자주 구매해서 마시고 있어요 잘 마시겠습니다
2020-07-23,5,가장 기본이 되는 증류주의 맛과 라이트함을 잘 조화했음
2020-07-02,4,포장꼼꼼하고 배송빠릅니다
2020-07-05,5,유명한 안동소주가 이름값하네요
2020-06-27,5,전통주 여러가지 모두 맛있네요 감사합니다
2020-06-23,5,사진찍기전에 몇병은 마셔버렸네요ㅎ넘 맛나요
2020-06-22,5,안동소주 너무 좋아요 벌써 몇번째 재구매인지 모르겠어요
2020-07-22,5,맛있고 정말포장잘해주네요
2020-06-24,5,배송도 빠르고 맛나요비싼 양주마실필요가없네요
2020-07-20,5,향긋하고 맑게 넘어가서 좋아요
2020-07-22,5,깔끔하고좋은술이네요
2020-06-19,5,포장도 깔끔하고 기대되요ㅎㅎㅎ맛있게 잘먹을께요
2020-07-19,4,안동소주는 향이 너무 셉니다
2020-06-21,5,안동소주는 제입맛에는안맞지만소주좋아하시는분들은 좋아할거같아요
2020-07-07,5,깔끔하고 맛있어요 또 구매해야겠네요
2020-06-17,5,2020년 3월 24일 병입된 술이 왔고 깨지지 않고 잘 왔네요 항상 마시던 좋아하는 술입니다
2020-07-16,5,맛나요 항상 먹고있어요
2020-07-02,4,머라해야하지 되게 옛날 소주맛이나요 독한건 아닌데 추억의 맛
2020-07-10,4,화이트초콜릿 향과 함께 부드럽게 넘어갑니다
2020-07-11,4,꼼꼼한 포장 넘  좋았습니다
2020-06-23,5,집에서는 이거 먹어요
2020-07-08,4,적당한 향과 목넘김이 좋아요
2020-06-07,5,안전하게 잘 받았어요  전통주를 골고루 먹을 수 있어서 좋아요
2020-06-11,5,맛있어요 전통주 최고
2020-06-08,5,맛있어요 강추입니다
2020-06-11,5,좋아요 저렴하고 맛도좋네요
2020-06-18,5,두번째 주문인데요 역시 맛있네요 포장부터 배송까지 모두 만족합니다
2020-07-07,4,더 높은 도수가 좋긴하지만SOSO
2020-06-24,5,좋아요 아주 좋아요 전통주 최고
2020-07-06,4,부드럽다 그러네요
2020-05-31,5,소주좋아하시는분이 맛있다고하시네요앞으로  안동소주많이주문할듯해요
2020-06-12,5,굿굿 베리굿 좋네요
2020-06-09,5,재주문 3번째 또 뵐게요
2020-06-11,5,소주는안동소주입니다
2020-06-15,5,첫번째 구매 후 매주마다 주문하고 있어요 최고에요오
2020-05-20,5,배송도 꼼꼼하게 잘 왔네요 보기만해도 배부릅니당 ㅎㅎ
2020-06-23,5,아버님께 선물드렸는데 좋아하시네요
2020-06-25,3,향이 저하고 맞지 않습니다
2020-06-22,5,빠른배송 훌륭한 품질
2020-06-26,5,좋습니다 맘에 들어요 또 사야ㅕ겠네요
2020-05-20,5,평소에 전통 소주 좋아하는데 진짜 깔끔하고 맛있어요 또 주문할거에요
2020-06-27,4,전형적인 안동소주 입니다
2020-06-16,5,아주 만족합니다소주맛이 지깁니다
2020-06-21,5,자주 시킵니다 좋아요
2020-06-09,5,아직 못마셔뷰ㅏㅅ어요
2020-05-19,5,맛있어요 부드럽게 술술 넘어가고 숙취도 없어서 자주 시켜먹어요
2020-06-14,5,아주 좋았습니다 다 마시면 다음에 또 살 생각입니다
2020-06-04,5,한달후기라 남은게 없어 사진은 없지만 또 구입할 예정입니다 다음주쯤 다시 뵐게요
2020-05-12,5,맛있었어요일부는 스트레이트로 먹고 일부는 수박주로 만들어 먹었습니다 ㅎ
2020-06-14,5,아직 마셔보진 않았지만 잘받았습니당
2020-05-28,5,35도 맛나서 22도 궁금해서 구매해봄
2020-06-03,5,말이 필요 없어요 최고에요 또 시킬거에요
2020-06-21,4,먹을만했어요
2020-05-07,5,안동소주 부드럽고 맛있어요 회랑 먹어도 잘어울려요 감미료 첨가된 술이 싫어서 찾다보니 이런 좋은술 참 많네요
2020-06-05,4,해외나가면 꼭 술사오는데 요즘 못나가서 우리나라술을 종류별로 먹어보려고 구입했습니다
2020-05-15,5,아버지께서 좋아하시네요배송도 빠르고 포장이 아주 꼼꼼합니다
2020-06-03,5,배송 빼르고 좋아요 아직 먹어보진 못했지만 기대되네요
2020-04-30,5,전통주하면대표적인게 안동소주아닐까싶습니다가격대도 적당해서 희석식 소주먹느니 안동소주 적당한 도수로 마시는게 좋습니다 또 구매하겠습니다
2020-04-28,5,가격도  괜찮고 맛도  좋습니다  아버지와 같이 자주 마십니다  ㅎㅎ  배송도  빠르고요  근데 병에 찍혀있는   날자가  제조일자인가요 유통기한인가요 지금  날자가  4월 28일  입니다
2020-06-04,5,빠른 배송과 꼼꼼한 포장으로 잘받았습니다
2020-05-25,2,맛은 있는데요 1병먹고 숙취가 3일이나 갔어요 죽을뻔했습니다 일반 소주보다 숙취가 훨씬 심하네요
2020-06-03,5,다양하게 먹을 수 있어서 좋았어요
2020-05-18,5,아버지가 좋아하시는 안동소주입니다
2020-06-25,5,너무너무 좋아요 또 살께요
2020-05-03,5,향이 아주 만족스럽습니다 꼼꼼한 포장은 더할나위없네오
2020-04-29,5,안전하게 잘왔어요 종종 먹는 술이라 구입했습니다 늘 좋아요
2020-06-04,5,저녁 반주로 한병 딱 입니다
2020-05-09,5,배송도 빠르고 향과 맛이 일품입니다
2020-04-21,5,제일 소주 같아요 그래도 알콜 냄새도 안나지만 다른 소주보다 독한 알콜 도수도 아닌데 맛은 독해요 그래도 전통주 마시는 느낌이고 병도 이쁘네용
2020-06-01,5,역시명인이만든 소주에요
2020-05-21,5,아주좋아요 다먹으면 계속 주문 합니다
2020-05-12,5,소주는 역시 안동소주죠
2020-05-03,5,배송 잘 왔습니다 맛있게 잘 마시겠습니다
2020-05-24,5,향도 좋고 맛있습니다
2020-05-26,5,아부지께서 좋아하시네요
2020-05-03,5,믿고 먹는 전통주 아주 좋아요
2020-04-11,5,저번에도 이번에도 친여동생한테 보냈어요오늘 펜션가서 제가 보낸 소고기와 한잔했다네요  시중 마트에서 볼수없었던 술들이 많아 좋아요 다음엔 제가 애용해볼께요
2020-05-04,5,맛있습니다 좋네요
2020-04-26,5,술 배송이 빠르고 포장상태가 좋아요
2020-05-17,5,처음 안동소주 경험해봤는데 생각보다 괜찮아요
2020-04-30,5,매우 맛있게 잘 마셨습니다
2020-05-18,5,믿고 시키는 제품입니다 좋아요
2020-04-15,5,잘 도착했어요 빠른배송 감사합니다 
2020-05-18,5,안전하게 잘 배송됫습니다 깔끔합니다
2020-04-22,3,안동소주는 높은 도수가 더 괜찮은거 같아요
2020-04-21,5,포장도 좋고 전통주 편하게 구매했습니다
2020-04-25,5,역시 전통주 좋아요
2020-05-12,5,도수가 쪼매 약하다고 어르신분들의 호불호가 좀 갈렸어여 ㅎㅎ
2020-05-14,5,아빠가 음청음청 좋하셔서 다 드셨습니다  추천
2020-05-03,5,선물로 샀는데 안 깨지고 배송도 빠르게 잘 오고 받는 사람도 좋아했습니다
2020-04-28,5,포장도 꼼꼼하고 안전하게 배송해주셔서 감사해요 잘 마시겠습니다
2020-05-09,5,안동소주는 처음 마셔보는데 괜찮네요
2020-05-17,5,감사합ㄴ대  감잘가습니다
2020-04-11,4,또구매하네여 이제 한동안 이걸로 마실려구요
2020-04-17,5,시음 전입니다파손 없이 잘 도착했습니다
2020-05-07,5,제품 배송 모두 만족합니다
2020-04-18,5,빠르게 잘 받았습니다
2020-03-25,4,최소한 에어캡은 씌워줄 줄 알았는데 그건 아니네요 안깨져서 다행이긴 한데 그런거라도 좀 있었으면 하네요
2020-04-16,5,여러가지 샀더니 리뷰를 여러개 남겨야되나바요
2020-04-29,4,도수가 낮아서 별로 맛 없을 거 같았는데 생각보다 더 맛있내요
2020-04-16,5,믿고사세요 포장부터 배송 훌륭
2020-03-31,5,안동소주를 처음먹어보는데 약간 매콤한 소주라고 생각하면 좋을듯 합니다 배송은 빨랐고 맛이 좋았습니다
2020-05-02,5,아주 좋습니다 매우만족
2020-05-02,5,잘 받았습니다 번창하세요
2020-05-08,5,찬양하라 갓재서 
2020-04-29,5,배송도꼼꼼하고좋아요
2020-05-08,5,갓재서 찬양하라 
2020-04-13,5,향이 소주보다는 덜 역해요 ㅋㅋ
2020-04-09,5,안깨지고 잘 받았어요
2020-04-09,5,안동소주 특유의 향이 저하고 안맞네욯ㅎ
2020-04-02,5,좋은 술을 저렴하게 마실 수 있어서 좋아요
2020-04-28,5,잘받았습니다 감사해요
2020-03-25,5,전통주는 더 싸져야된다고 봄어쨌든 잘받았음 술살때마다 여기서 삽니다
2020-04-24,5,맛있습니다또이용할게요
2020-03-10,5,요즘 증류주에 관심이 많아서 알게된 술마켓에서 다양한 주류 많이 구입했습니다 특히 3만원 무료배송이 너무 좋네요
2020-04-19,5,증류수 중에 제일 입맛에 맞네요 굿입니다
2020-04-04,5,빠른배송 넘 좋고 잘 마셨어요
2020-04-06,4,너무 독하지 않고 잘넘아 가네요
2020-04-26,5,항상 마시는 안동소주 최곱니다
2020-03-10,5,늘 안동소주를 안동홈페이지에서 구매했는데더 저렴하고 빠르게 주문되다니요 다마시고 또 구매하겠습니다 꼼꼼한 포장배송 감사합니다
2020-04-22,5,희석소주 보다 증류소주라 넘김도 좋고 숙취도 덜한거 같습니다
2020-04-16,5,안동소주 좋아요 맛있어요추천해요
2020-03-10,5,코로나 때문에 직접 장보기가 어려운데 술은 배송이 따로 안되더라구요그러던 중에 술마켓에서 전통주 배송해주는거 찾아서 주문해봤어요안깨지게 잘 배송해 주셨고 목넘김 부드럽고 좋습니다
2020-04-19,5,빠른배송 아주좋았습니다
2020-04-02,5,깔끔해요 맛있어요
2020-04-10,4,주문 배달이 되어서 편리 하네요 배송도 만족 합니다
2020-04-04,5,지나번에 이어 재구매
2020-04-19,5,상품 이상없고 맛도 좋네요
2020-03-25,5,괜찮아요 근데 안동소주는 40도가 낫네요
2020-04-21,5,메인으로 시켜서 마시네요
2020-04-17,5,포장이 완벽해서 좋아요
2020-04-24,5,늘맛있게먹는중입닏ㄱ
2020-04-17,5,맛없을리가 없는 전통주 비싼 이유가 있다
2020-04-16,5,술이 술술 들어갑니다
2020-04-27,5,좋아효 
2020-03-29,3,너무 기대했나봐요산뜻한 맛을 기대했는데꼭 약품 같은 맛이 나요소주와 이술의 차이점을 못느끼겠어요
2020-03-21,5,깔끔한 포장 좋은 가격 모두 좋습니다
2020-04-14,4,좋습니다 맛있어요
2020-04-17,3,더 싼데가 있어서
2020-03-04,5,기대됩니다 포장배송 모두 만족입니다 ㅎ 코로나 때문에 밖에 못나가는데 배송이 된다니 ㅎㅎ 참 좋은 세상입니다 
2020-04-04,5,빠른배송 잘받았습니다선물용으로 보냈어요ㅎㅎ
2020-03-01,5,향이좀 강한스타일 맛이좋았어요 재구매의사있습니다 더럽안동소쥬하트
2020-04-05,5,안동소주 안동소주 말만 듣다가 처음 주문해봤는데 깔끔하네요
2020-04-08,5,맛도 좋고 목넘김이 죠아요
2020-04-04,4,빠른배송 좋아요ㅎㅎ좋아요
2020-03-11,5,저렴한가격에구매했어요제조일도최근이네요
2020-03-13,5,잘받았습니다이강주 맛있었는데 이것도 맛있을거 같아요
2020-03-30,4,가성비가 좋습니다 여러번 재구매중입니다
2020-04-08,5,깔끔라고 맛있습니다
2020-04-05,5,아직 안먹어봤는데 기대중입니다
2020-04-06,5,이게 젤 반응좋았어요
2020-04-01,5,맛있고 좋아요 저렴하기까지
2020-03-13,4,잘먹을께요 고마워용
2020-03-26,5,맛있어요 포장도 심플하면서 튼튼하게 왔네요 굳
2020-03-30,5,장인어른도 사드렸어요 최고에요
2020-03-02,5,꼼꼼하게 배송 잘 되어왔어요 안동소주니까 맛있겠죠
2020-03-02,5,배달도 꼼꼼히 해서 오고 목넘김도 부드러워서 아주 맛있게 먹었습니다
2020-03-31,5,역시 안동소주는 최고입니다
2020-04-02,5,저한테 제일 잘맞는 술이네요
2020-03-17,5,포장 정말 꼼꼼하게 해주시고 잘 마셨습니다 다음에는 다른 술도 여러개 주문해봐야겠네요
2020-03-07,5,맛도좋고 배송빠르고 개꿀
2020-03-04,4,배송 빠르네요 잘 마시겠습니다
2020-03-05,5,맛은 아직 모르겠지만 안전하게 잘 도착했어요
2020-02-25,5,포장 꼼꼼하게 잘 도착했어요 감사합니다
2020-02-28,5,포장 상태 좋구요 잘 받았습니다 고맙습니다
2020-03-07,5,장인이 만든 맛있는 술입니다
2020-03-23,5,일반 소주보다 도수는 높지만 향이 좋고 진짜 순해요
2020-03-29,5,음 안동소주는 제 입맛이 아닌가봐요
2020-03-15,4,높은 도수보다 목넘김도 부드럽고맛있었어요 포장상태가 맘에들고 배송도 빨랐어요
2020-03-06,4,아주 조아요조아요조아
2020-03-30,5,혼술에는 좋습니다 추천
2020-03-26,2,맛이 너무 자기주장이 강하다
2020-03-18,5,정말 맛나요 ㅎㅎ최고에요
