,0,1,2,3,4
261,까사렐 노아 오 드 뚜왈렛 30/50/100ml,까사렐,순수한 머스크 플로럴의 극강한 부드러움,"49,500원 10.0% 할인",4.7
262,프레데릭 말 포트레이트 오브 어 레이디 50ml,프레데릭말,"비에 젖은 라즈베리와 짙은 색의 장미가 쌉싸름하고 우디한 파츌리와 어울린, 고혹적 분위기","277,800원 21.3% 할인",5.0
263,퍼퓸 드 말리 까실리 75ml,퍼퓸 드 말리,사랑스러운 푸루메리아 꽃잎에 잘 익은 복숭아 설탕을 흩뿌린 향기,"278,000원 18.2% 할인",4.0
264,끌로에 우먼 오 드 퍼퓸,끌로에,"이성 반응이 보장된 베스트셀러, 커튼처럼 부드러이 유영하는 분홍색 피오니 향기","87,000원 42.0% 할인",4.9
265,르라보 리스 41 오 드 퍼퓸 100ml,르라보,바닐라에 적셔진 백합꽃을 모아 향초로 차분히 녹여낸 듯- 흰 고급스러움,"325,000원 12.2% 할인",5.0
266,아쿠아 디 파르마 바닐라 오 드 퍼퓸 100ml,아쿠아 디 파르마,"오후 2시의 바닐라빛 햇살, 헬리오트로프를 베고 노곤히 쏟아지는 잠을 청하는 편안한 향기","185,000원 43.9% 할인",0.0
267,에르메스 오드 메르베이 오 드 뚜왈렛 50ml,에르메스,석양처럼 차분하고 단아하게 퍼지는 앰버의 우아함,"118,000원 17.5% 할인",4.8
268,세르주루텐 뉘드셀로판 오 드 퍼퓸,세르주루텐,"세르주루텐 베스트셀러, 샴푸 향기처럼 은은한 오스만투스가 마음을 홀리게 하는 상큼함","148,000원 27.8% 할인",4.9
269,에르메스 운 자르뎅 메디테라네 오 드 뚜왈렛,에르메스,"분수대 앞 공원 벤치에 걸터앉아 느껴보는, 햇살처럼 번지는 오렌지와 무화과 나무에서 퍼지는 달콤한 향기","145,000원 17.1% 할인",0.0
270,메종마르지엘라 플라워마켓 30/100ml,메종 마르지엘라,자취가 아련하게 남아 반응 좋은 촉촉한 가든 플라워 향기,"80,900원 9.1% 할인",4.7
271,아이젠버그 땅따이숑 오 드 퍼퓸,아이젠버그,"쌀쌀한 날씨에 더욱 손이 가는, 달콤한 통카빈과 핑크페퍼의 균형 잡힌 포근함","47,400원 40.0% 할인",4.0
272,아이젠버그 루즈 앤 느와르 오 드 퍼퓸,아이젠버그,새빨간 립스틱의 관능미와 느와르 식의 흑백이 자아내는 관능미,"47,400원 40.0% 할인",5.0
273,메종 마르지엘라 버블바스 100ml,메종 마르지엘라,"거품목욕 사이 비눗방울 하나, 공중에서 터진 코코넛의 달콤함이 세상을 촉촉하게 적시는 맑은 내음","145,000원 17.1% 할인",4.9
274,크리드 스프링 플라워 75ml,크리드,"천진난만한 맑음이 떠오르는 기분좋은 살구, 복숭아의 상큼달콤함","315,000원 19.2% 할인",4.6
275,딥디크 오프레지아 오 드 뚜왈렛 100ml,딥티크,"싱그러운 프리지아 한 다발이 몰고 온 봄기운, 잔잔하고 산뜻한 생화 프리지아 향기","178,000원 10.6% 할인",4.9
276,딥디크 로데헤스페리데스 오 드 뚜왈렛 100ml,딥티크,"옅은 바람을 등지고 맡아지는 비터오렌지, 민트, 로즈마리의 프레시함이 마음을 톡톡 건드는 상쾌함","175,000원 12.1% 할인",5.0
277,아이젠버그 러브어페어 우먼 30/50/100ml,아이젠버그,"정말 편한 나시, 가디건 차림에서 풍기는 살 내음이 더 여자로 느껴질 때","65,200원 17.5% 할인",4.8
278,불리 오 트리쁠 밀로의 비너스 75ml,불리 1803,섬세한 자스민과 풍성한 매그놀리아가 비누처럼 순하게 흐려지는 순간 달콤하게 피어나는 앰버 향기,"185,000원 19.6% 할인",0.0
279,킬리안 포비든게임즈 오 드 퍼퓸 50ml,킬리안,붉으스름한 홍조를 띈 복숭아의 나른함에서 금지된 장난을 떠올리게 하는 야릇한 향기,"275,000원 10.7% 할인",4.0
280,바이레도 인플로레센스 오 드 퍼퓸,바이레도,연노랑 원피스 같은 은은한 달콤함,"198,500원 17.3% 할인",5.0
281,크리드 아쿠아 피오렌티나 오 드 퍼퓸 30ml,크리드,"비 내린 이탈리아의 과수원 한가운데, 화사한 로즈와 물먹은 자두 향기","215,000원 17.3% 할인",5.0
282,딥디크 오 로즈 오 드 뚜왈렛 50/100ml,딥티크,"세상 깔끔한 헤어미스트 같은 생장미 향기, 싱그러운 향","128,000원 10.5% 할인",4.8
283,입생로랑 리브르 인텐스 30ml,입생로랑,"리브르의 라벤더 - 오렌지블라썸을 따스하게 감싸안는 통카빈, 고급스러운 럭셔리","91,500원 11.2% 할인",4.8
284,크리드 어벤투스 포허 30/75ml,크리드,시크함과 귀여운 관능미를 동시에 갖고 있는 스모키한 애플로즈,"230,000원 25.8% 할인",4.5
285,에르메스 트윌리 데르메스 오진저 오 드 퍼퓸,에르메스,"긴 쉬폰 원피스와 사근사근한 말투를 닮은 플로럴, 모든 행동과 말투에서 묻어나오는 우아함","113,000원 22.6% 할인",0.0
286,아쿠아 디 파르마 오스만투스 오 드 퍼퓸 100ml,아쿠아 디 파르마,만개한 오스만투스 꽃을 가득 모아 살결에 가까운 비누로 정갈하게 만든 상큼함,"205,000원 37.9% 할인",4.8
287,프라고나르 에밀 30/60/100/200ml,프라고나르,"동화 속 공주가 산책 중 흘린 하얀 손수건, 그곳에서 풍기는 맑고 포근한 비누내음","71,500원 8.3% 할인",4.1
288,메모 오션 레더 오 드 퍼퓸 75ml,메모,"시원한 바닷바람을 타고 부서지는 시트러스와 얇은 종이를 바닷물에 풀어헤친듯, 가볍게 올라오는 우디","263,000원 24.9% 할인",0.0
289,겔랑 미츠코 오 드 뚜왈렛 93ml,겔랑,"100년을 이어온 겔랑 하우스의 명작, 고혹스런 자스민의 자태에 매료될 수 밖에 없는 향기","54,000원 44.3% 할인",0.0
290,바이레도 슬로우 댄스 오 드 퍼퓸 100ml,바이레도,"달콤한 바닐라 코냑에 취해갈 때, 현실은 흐려지고 사랑은 더욱 짙어지는 로맨틱한 공간의 향기","255,750원 22.5% 할인",5.0
291,크리드 러브 인 블랙 75ml,크리드,"서정적이게 아름다운 바이올렛과 아이리스, 통카빈이 폭닥하게 어울린 향기","315,000원 19.2% 할인",4.8
292,딥디크 오 모헬리 오 드 뚜왈렛 100ml,딥티크,"샛노란 꽃들 사이로 허브향을 싣고 불어오는 산들바람, 그리고 일랑일랑의 향기","175,000원 12.1% 할인",5.0
293,프레데릭 말 카날 플라워 50ml,프레데릭말,세상을 포근하게 감싸듯 정돈된 튜베로즈의 우아함,"278,000원 21.2% 할인",4.6
294,프레데릭 말 로디베 50ml,프레데릭말,"보라빛 꽃 위를 살랑이는 흰 나비처럼, 헬리오트로프와 머스크가 연출하는 연약한 포근함","205,000원 15.6% 할인",0.0
295,프라다 레스 인퓨전 디 미모사 오 드 퍼퓸 100ml,프라다,포근하게 안길 것 같은 여리여리한 미모사 비누 향기,"184,000원 9.8% 할인",4.7
296,메모 일하도멜 오 드 퍼퓸 75ml,메모,"담백한 가드니아와 히아신스가 바람에 일렁이는, 밝고 여리여리하게 퍼지는 언덕의 분위기","263,000원 24.9% 할인",5.0
297,조르지오 아르마니 마이웨이 오 드 퍼퓸 30ml,조르지오아르마니,"박신혜를 닮은 생기발랄한 딸기, 투베로즈가 보석처럼 영롱하게 빛나는 순간","77,800원 21.4% 할인",5.0
298,조말론 로즈 블러쉬 코롱 50ml,조말론,"리치 과즙을 한껏 머금은 채 수줍음에 볼 밝히는, 선홍빛 두 뺨을 가진 여린 장미 향기","120,000원 20.0% 할인",0.0
299,킬리안 굿걸곤배드 오 드 퍼퓸 50ml,킬리안,"순수와 퇴폐의 미학, 붉으스름한 홍조를 띈 복숭아의 미묘함","275,000원 10.7% 할인",4.7
300,킬리안 플라워 오브 이모탈리티 오 드 퍼퓸 50ml,킬리안,"속살 하얀 복숭아를 문 채, 목선에서 어렴풋이 나는 분내가 짙은 끌림을 만들어내는 향기","275,000원 10.7% 할인",5.0
301,티에리 뮈글러 엔젤 오 드 퍼퓸 50ml,티에리 뮈글러,"유혹의 정석, 대담하게 유혹하는 달콤 아찔 플럼-바닐라","87,000원 27.5% 할인",4.8
302,입생로랑 몽파리 오 드 빠르펭 50ml,입생로랑,"상대의 은밀함을 끌어내는 로맨틱과, 스킨십을 불러 일으키는 달콤함을 겸비한 피오니 부케","105,000원 34.0% 할인",4.8
303,에스티로더 모던뮤즈 오 드 퍼퓸 50ml,,살랑거리는 분홍 스커트처럼 내 마음을 들었다 놨다 하는 플로럴,"88,500원 33.0% 할인",5.0
304,에르메스 운 자르뎅 수르 라 라군 오 드 뚜왈렛 30/50ml,에르메스,따뜻한 돌담길 너머에 아늑하게 핀 백합과 나무 그리고 정원,"70,000원 12.5% 할인",4.9
305,아쿠아 디 파르마 유자 오 드 퍼퓸 100ml,,유자의 상큼함이 주변 꽃들에 맺힌 이슬까지 가볍게 흔들 때 코 끝에 감도는 수분감있는 향기,"198,000원 36.1% 할인",5.0
306,아이젠버그 백 투 파리 오 드 퍼퓸 30/50ml,아이젠버그,"라라랜드 속 베리의 달콤함이 파츌리, 머스크와 만나 보랏빛 석양을 지게 하는 몽환적인 향기","65,200원 17.5% 할인",4.7
307,시슬리 오 뒤 스와르 오 드 퍼퓸 50ml,시슬리,"부드럽고 또 고상하게, 늘 아름답게 남는 여인의 자취","158,000원 12.2% 할인",4.8
308,세르주루텐 끌레 드 머스크 오 드 퍼퓸,세르주루텐,하얀 터키쉬 앙고라 고양이가 가지런히 앞발을 모으고 있는 듯한 아이리스 - 머스크 향기,"253,500원 14.9% 할인",4.9
309,세르주루텐 라 비에르쥐 드 페 오 드 퍼퓸,세르주루텐,촉촉한 비를 맞으며 서늘함 속에 홀로 하얗게 빛나고 있는 백합의 향기,"174,500원 14.9% 할인",5.0
310,세르주루텐 루브 오 드 퍼퓸 100ml,세르주루텐,"체리 사탕이 산산조각 날 때, 유리 조각이 크리스탈이 되어 날카롭게 퍼지는 아름다움","395,000원 15.1% 할인",0.0
311,분더샵 에버 얼웨이즈 오 드 퍼퓸 50ml,분더샵,"햇살이 닿아, 오스만투스와 피치가 반짝거리며 연출하는 상큼함","82,800원 40.0% 할인",4.5
312,메종 마르지엘라 레플리카 댄싱 온 더 문 100ml,메종 마르지엘라,밤하늘의 달빛아래 춤추는 선녀의 옷자락 같은 화이트플로럴 향기,"215,000원 14.0% 할인",4.6
313,롤리타 렘피카 롤리타 랜드 오 드 퍼퓸 40/80ml,롤리타렘피카,잔상처럼 여운이 길게 남는 베리와 자스민의 달콤함 여성미,"64,800원 28.8% 할인",5.0
314,랄프로렌 블루 우먼 오 드 뚜왈렛 40/125ml,랄프로렌,"랄프로렌 스테디셀러, 시원하게 말라가는 청사과향 샴푸 향기","87,000원 20.9% 할인",4.7
315,디올 자도르 인피니심 오 드 퍼퓸 50/100ml,디올,"쟈도르를 감싸안은 튜베로즈, 그 하얀 풍성함에서 연출되는 고급스러움","126,000원 25.0% 할인",5.0
316,미스디올 앱솔루틀리 블루밍 오 드 퍼퓸 50/100ml,디올,"밤을 입은 베리, 짙어진 피오니 꽃잎이 연출하는 고혹스러움","115,000원 48.7% 할인",4.5
317,돌체 앤 가바나 레드 오 드 뚜왈렛 100ml,돌체앤가바나,잔잔한 꽃비누내음처럼 부드러운 알데하이드 노트의 정수,"128,000원 14.7% 할인",4.5
318,끌로에 압솔뤼 퍼퓸 30/50/75ml,끌로에,센티폴리아 바디크림을 은은하게 바른듯한 담백하고 고급스러운 여성향수,"71,500원 34.4% 할인",4.9
319,끌로에 로즈 드 끌로에 30/50/75ml,끌로에,셋째딸 같은 생화장미 향기,"54,000원 42.6% 할인",4.8
320,겔랑 몽 겔랑 오 드 뚜왈렛 30/50ml,겔랑,화끈한 이태원 거리도 압살할 센슈얼하고 관능적인 프루티 플로럴,"50,000원 28.6% 할인",4.8
321,겔랑 랭스땅뜨 드 겔랑 오드뚜왈렛 50/100ml,겔랑,단발에 잘 어울리는 친밀한 허니앰버의 소프트한 구어망드 파우더 향기,"67,000원 54.7% 할인",4.3
322,바이레도 비블리오티크 오 드 퍼퓸 50ml,바이레도,"바이레도 캔들 베스트셀러가 향수로 출시된, 섬세한 가죽과 달콤한 라즈베리가 완성하는 빈티지 무드","191,750원 16.6% 할인",0.0
323,겔랑 랭스땅뜨 드 겔랑 오드퍼퓸 50/100ml,겔랑,단발에 잘 어울리는 친밀한 허니앰버의 소프트한 구어망드 파우더 향기,"70,000원 58.3% 할인",4.5
324,겔랑 라쁘띠 로브 느와르 오 드 뚜왈렛 30/50/100ml,겔랑,석양진 연회장에서 퍼지는 고급스러운 체리와 로즈의 향기,"64,000원 50.4% 할인",4.6
325,구찌 블룸 암브로시아 디 피오리 오 드 퍼퓸 30ml,구찌,노을을 삼킨 로즈와 튜베로즈 향기,"75,800원 34.1% 할인",5.0
326,구찌 블룸 아쿠아 디 피오리 오 드 뚜왈렛 50ml,구찌,"푸릇한 정원이 주는 상큼함, 구찌 블룸의 신상","104,800원 20.6% 할인",4.8
327,구찌 플로라 고져스 가드니아 오 드 뚜왈렛 50ml,구찌,"달콤한 레드베리를 가드니아에 휘감아놓은, 여성스러움이 한껏 극대화된 섹시미","86,000원 13.1% 할인",4.7
328,불리 오 트리플 페루 헬리오트로프 75ml,불리 1803,"바이올렛이 가득한 공중정원 속, 부드럽게 퍼지는 헬리오트로프 향기","170,000원 17.1% 할인",4.8
329,불리 오 트리쁠 목수 성 요셉 75ml,불리 1803,일렁이는 바닐라와 히노끼의 편백향이 나무기둥 사이로 천천히 스며드는 소프트-우디 향,"185,000원 19.6% 할인",5.0
330,본드 넘버 나인 차이나타운 오 드 퍼퓸 100ml,본드 넘버 나인,홍대 사거리 체리나무 아래에서 날 법한 매력적이고 독특한 달콤함,"186,800원 56.5% 할인",0.0
331,발렌티노 발렌티나 우먼 오 드 퍼퓸 80ml,발렌티노,첫 데이트에 가장 잘 어울릴 것 같은 여성스러운 향기,"135,000원 15.6% 할인",4.8
332,발렌티노 발렌티나 블러쉬 오 드 퍼퓸 50/80ml,발렌티노,달콤한 체리향과 화사한 로즈의 풍미에 스웨이드의 묵직함을 담아낸 향기,"97,000원 19.8% 할인",5.0
333,바이레도 라튤립 오 드 퍼퓸 50/100ml,바이레도,"촉촉한 튤립을 감싸고 있는 하얀 수건, 청순미의 극치","198,500원 17.3% 할인",4.8
334,바이레도 선데이즈드 오 드 퍼퓸 50/100ml,바이레도,설탕을 버무린 오렌지맛 코튼캔디가 석양에 스르르 녹는향기,"191,750원 20.1% 할인",4.6
335,바이레도 로즈 오브 노 맨즈 랜드 오 드 퍼퓸 50ml,바이레도,"바이레도가 그린 선명한 로즈, 라즈베리 이슬이 차가운 장미를 녹이며 깨어나는 싱그런 향기","198,500원 17.3% 할인",5.0
