date,star,text
2021-05-18,5,받자마자 마셔봤는데 탄산이 아예 없는 것 같아요 완전 부드럽고 묽은 것보단 살짝 되직한 느낌이에요 단맛이 인공적으로 강하지않고 부드럽게 달달한 맛이라 술 못마시는 사람들도 괜찮을 것 같아요 굿
2021-07-02,5,탄산느낌은 없습니다부드럽습니다
2021-07-03,5,구하기는 힘들지만 맛있다
2021-06-13,5,아주 부드럽고 맛잇습니다
2021-06-01,5,맑고 부드럽고 맛있어요 구매가 치열할 만 합니다ㅎㅎ
2021-07-06,5,맛잇게잘먹엇어요
2021-06-26,5,배송도 꼼꼼히 잘 해주시고 감사합니다
2021-07-01,5,부드럽고 맛있습니다
2021-05-27,3,후기대로 탄산은 다른막걸리에 비해 덜 하네요다음날 먹으면 맛있을까요캠핑장 가서 먹으려고 챙겨갑니다
2021-07-07,5,이 집 막걸리 대존맛
2021-07-07,5,이 집 막걸리 대존맛
2021-06-01,5,저도 표문 막걸리 참 좋아하는데요 제가 한번 마셔보겠습니다
2021-07-04,5,역쉬너무맛있네요
2021-06-11,5,날이 더워 아이스팩은 다 녹았어요
2021-06-05,5,친구에게 선물했는데 너무 좋아하네요
2021-05-16,5,포장이 꼼꼼하게 잘되어서 배송오니 좋더라구요
2021-06-25,5,포장도 꼼꼼히 되있고 깔끔하게 잘왔어요
2021-07-01,5,목넘김도좋고 맛있어요
2021-06-26,5,배송빠르고 항상 잘먹고있어요
2021-06-25,3,그냥그래요기대가컷나봄
2021-05-31,5,오자마자 바로먹었더니 그냥그래서며칠 숙성시켜 먹었어요숙성했더니 굿 입니다
2021-06-08,5,받자마자 마시는게 더 맛있었어요
2021-06-05,5,526 제조 오늘 숙성햇다 먹으니 단맛이 줄엇어요 굿굿
2021-06-07,5,어떤안주에도 딱이네요강추
2021-06-01,3,아직 안먹어봐서 잘모르겠어요 근데 아이스팩이 다 녹아서 왔어요
2021-06-30,5,부드러운데먼가싱겁고그저그냥그럼
2021-06-28,5,지인에게 한박스씩 선물했어요
2021-04-24,5,무사히 잘 받았네요 첫 구매 바로 성공해서 기분이 좋았고 받아보니 박스도 아이스팩도 친환경 소재라니  맛 좋은 막걸리만 판매 하는 게 아닌 환경도 생각하는 거 같아서여러 리뷰를 읽어보니 숙성 시켜 먹으면 더 맛나다길래 2일 정도 더 두었다가 먹어보려구요그리고 시중에 판매하는 것보다 유효기간이 한달려나 되네요 ㅎㅎㅎ
2021-05-14,3,곰표 와 말표 맥주 광팬으로 주문을해봤는데일반적인 막걸리와 다른 새로운 맛이였어요나쁘지는 않지만 너무 기대를 했는지 뭔가 아쉽더라구요
2021-06-16,4,포장 완전 꼼꼼하게 잘 담아져 왔네요 목넘김도 좋고  담에 또 주문할게요 많이파세요
2021-05-29,5,요즘 핫해서 주문해 마셔봤눈데 부드럽고 맛있어용
2021-07-25,5,잘 받아서 잘 마셨습니당 ㅎㅎ
2021-05-15,5,처음해보는 막켓팅 단번에 성공해서 주문받았고요 맛은 막걸리맛 잘 몰라서 항상 장ㅅ막걸리 어쩌다 마신게 다인데 곰표꺼 맛있더라구요 막걸리 처음 접하시는 분들은 부담스럽지않고 부드러워서 맛있게 드실수 있을거같아요
2021-06-26,5,아기자기 귀엽고 맛도 좋아요
2021-06-23,5,생각했던 막걸리의 맛이 아니라 신선했어요
2021-06-11,5,목넘김도 부드럽고 맛났어요
2021-06-12,5,깔끔하고 맛있어요
2021-06-24,5,늦은 후기네요숙성후가 더 맛있어요
2021-05-07,5,생각보다 새지 않고 잘 왔어요 상자가 젖은건 얼음팩이 녹아서 그런거 같아요ㅋㅋ숙성시켜서 먹으려고 한 모금만 마셨는데 탄산이 없어서 그런지 생각보다 진하고 단맛도 적당했어요 배송 빠르네요
2021-05-29,5,핫하다고 해서 주문했어요 아직 마셔보진 않앗지만 너무 기대 되요
2021-06-23,5,많지않은 탄산 풍부한 바디감 적은 단맛두부김치랑 맛있게 먹었습니다
2021-06-05,5,오자마자 한병 마셔봤는데 부드러운 느낌이 좋네요
2021-06-28,5,부드럽네요 알콜맛도 별로 안나서 좋아요
2021-06-08,4,엊그제 해막걸리를 먹어서 그런지밍밍하다 느껴졌음ㅠ
2021-06-15,5,먹어본 막걸리 중에 제일 맛있어요 너무 맛있어서 재구매 성공했습니다
2021-06-29,5,어머니도 완전 좋아하시고 삼촌도 완전 좋아하셔요  
2021-06-06,4,세번만에 성공은 했지만글쎄요 막걸리 맛이 특별한지는 모르겠어요
2021-06-28,5,부드럽고 맛있어서 재주문했어요
2021-07-02,5,부드럽고달콤하고탄산없이
2021-06-07,5,주변에서 시켜달라 아우성이라 계속구매중이예요
2021-05-30,5,맛있어요 오자마자 다 먹었네요 탄산이 없으니 부드럽게 쭉쭉 넘어가네요
2021-06-03,5,부드럽고  목 넘김이 좋지만톡쏘는 맛이 없어 아쉽네요
2021-06-08,4,선물했는데 받는 분들이 좋하네요
2021-06-25,4,탄산은 전혀없고 달달합니다 목넘김은 좋고 자주먹는 십장생보다는 묵직해요
2021-06-11,5,와이프가 좋아해요
2021-05-03,5,오오 인기의 그것을 광클에 성공하여 구매했습니다 ㅎㅎ 너무 맛있음 ㅠㅠ살짝 도수있는 새콤한 요구르트 느낌이에요 ㅎㅎ
2021-06-16,5,맛있게 먹어ㅆ어요
2021-06-09,5,두번째구매늘만족합니다
2021-06-14,5,표문보다 나루다 더 맛잇는거 같아요  표문은 약간 탄산 좀더 있는거 그래도 생각보다 없는편 달달한 막걸리 추천
2021-05-25,3,기대한만큼은 아니였지만탄산없는 부드러운 막걸리네요전 더 숙성시켜 다시 먹어볼게요두병은 부모님 맛보시라고 드림 ㅎ
2021-07-04,5,너무 맛있어요 ㅎㅎ
2021-06-29,5,한병쯤은 먹어볼만해요
2021-06-27,3,맛있어요 순한 느낌
2021-06-05,5,주문하는데 애먹었지만 포장도 귀얍고 맛있네요
2021-06-13,4,막걸리 맛이 밸런스 있고 적절하게 달달합니다 곰표와 콜라보해서 제품을 만들다니 막걸리 맛있게 잘 마셨습니다
2021-06-11,5,아직 먹기전인데 기대되네요
2021-06-10,5,2주도전하다 주말에 성공월욜배송 화욜 밤에 도착했어요이제 더워서 아이스팩이 다 녹아서 왔는데하나더 넣어주심 감사하겠습니다전 술을 못마셔서 신랑주려고 합니다ㅎ
2021-06-09,5,막걸리 맛나고 부드러워요
2021-06-09,5,담엔 몇일 숙성시켜서도 먹어봐야겠어요
2021-06-17,5,탄산이 전혀 안느껴지는 깔끔한 맛입니다 먹고나면 배가 너무 불러요
2021-06-02,5,기다림보람이 있네요 너무맛있어요 ㅠㅠ
2021-06-25,5,글쎄요 너무 인기있다해서 샀는데ㅜㅜ 별로예오
2021-06-12,5,두번째 구매성공했어요많이  사고싶어요
2021-06-25,5,아직 마샤보진않았지만 맛있겠죠 헤헤
2021-05-25,4,택배는 빠르게 받았어요 근데 오다가 좀 샜는지 ㅜ 막걸리가 축축 하게 묻어있더라구요 아직 먹어보진 않았지만 기대중입니다
2021-06-09,5,깔끔하네요 맛있어요
2021-06-20,5,빠른배송과 목넘김이 좋은 막걸리 맛 좋아요
2021-06-26,5,맛있어요그런데 좀 비싸네요
2021-05-27,5,포장도 꼼꼼히 잘 해주셨고맛은 뭐 달다구리 맛있어요
2021-06-03,4,구하기 힘든 상품을 맛볼수 있어서 좋았어요 ㅎㅎ
2021-05-22,5,포장도 꼼꼼히 오고 배송도 빨랐어요 상표때문에 너무 귀엽네요 오늘 저녁에 먹어보려구요
2021-05-21,5,오 알콜도수가 높지 않아서 알콜맛 싫어하는 저한테는 부드럽게 넘어가면서 달달하니 맛있어요 패키지도 너무 귀엽구요 ㅎㅎㅎ
2021-05-28,4,배송도 빠르고 맛도 좋아요 묵직하면서 부드럽네요
2021-06-06,5,ㅠㅠ사기 넘 힘든 막걸리에요 탄산이 없고 부드러워 어른막걸리 느낌이에요 ㅋㅋ
2021-06-30,3,탄산이 없어서 저랑은 잘 안맞아요
2021-06-01,5,맛있어요 재구매의사있습니다
2021-06-09,5,맛있어서 친정에도 주문했어요
2021-06-11,5,핫한 곰표 맛있어요
2021-06-28,5,맛이 있긴한데 아침부터 열클 할 정도는 아니구요
2021-06-28,5,적당한 탄산과 깔끔한 맛이예요
2021-07-03,5,맛있어요  감사해요
2021-05-05,5,어린이날이 있어서 조금 늦게 배송 받을줄 알았는데 담날 바로 받을수 있었어요포장도 잘되어서 배송되고 제조일날 바로 배송되는 제품이라 좋아요일단 한병은 먹어보니 맛있어요2병은 숙성 된 후에 먹어보려 합니다
2021-05-28,4,너무 귀엽고 맛있어요 포장도 꼼꼼하고 좋아요
2021-06-27,5,제스타일은좀아닌데괜찬습니다
2021-06-08,5,드디어 만난 곰표막걸리 맛나요
2021-06-24,5,기대이상이네요 기가맥힘
2021-05-25,5,동동주같이 진짜 목넘김이 부드럽더라구요9시1분에 결제완료했는데 2분되니 금새 품절ㅠㅜ운 좋았답니다
2021-05-26,5,지인께 보내드렸는데 너무 맛있다네요ㅋ 구하기힘든거 보내좋다고 너무좋아하셨어요ㅋ
2021-06-07,5,맛있어요 재구매원해요
2021-06-29,5,달달하니 쭉쭉 들어가다가 픽 쓰러졌어요
2021-06-09,5,부드럽고맛나요 추천
2021-06-22,5,맛있어용 저는 운 좋아서 두번 성공했어요
2021-07-04,5,아주아주 만족해요 ㅋ
2021-06-04,4,포장이랑 주문하기 빡센것빼곤 다 좋네요일단 가격은 좀 마이 비싼평
2021-06-19,5,맛있고 부드러워요 용기가 귀여워요
2021-06-17,5,선물용 재주문이에요  귀한거라고 좋아하시더라구요
2021-06-11,5,진짜진짜 부드럽고 맛나요
2021-05-26,5,오늘아침배송됐구요 아이스팩포장에꼼꼼하게왔어요바로냉장고넣어뒀는데저녁에먹을거에요감사해요
2021-06-09,5,너무 부드럽고 맛있네요
2021-05-26,5,포장깔끔하게 잘 도착했구요끝맛이 깔끔해서 좋아요 
2021-05-23,4,음후기가 극과 극이라 좀 고민하긴했는데 구매고 어렵고 먹어보고싶어 어렵게 주문했네요악평도 많아서 걱정했는데 그냥 쏘쏘해요 ㅎ 지평이나 원래 드셨던 막걸리 생각하시면 실망하실거같구요 ㅎ 좀 탄산있게 업글해도 좋을거같아요 ㅎ
2021-06-02,3,약간 밍밍한 맛이였어요 통은 너무 귀여워요 ㅜ
2021-06-09,5,달달하고 맛있었어요
2021-06-11,5,한번에 구매 성공했어요
2021-06-29,4,탄산없고 달달하니 부드러운 맛이였어요
2021-06-09,5,옛날 막걸리맛이 난다고 하시네요
2021-06-25,4,점점 더워지는데 아이스팩 포장 방식은 제발 바꿨으면 좋겠네요
2021-06-10,5,달달하고 맛나요 잘먹을게요
2021-06-04,5,정말 맛있어요 많이 팔아주세요
2021-06-05,5,구매하기는 힘들었지만 부드럽고 맛있네요
2021-05-25,5,너무 기대했나봐요 ㅠㅠ 탄산이 없어 좋은데 뭔가 싱거운 한번은 호기심에 사먹고 두번은 안사먹을ㅡㅡ
2021-05-30,5,막걸리 아담하니맛있어요반주하기좋아요
2021-06-25,5,포장도 꼼꼼하고 빨리왔어요 맛있어요
2021-06-13,4,두번결제실패하고 세번째에 성공했네용 ㅎ ㅎ 되게 막걸리가 묵직합니다 그리고 탄산이 없어서 그런지 더 배부른느껨 이에요
2021-06-03,4,커뮤니케이션 문제가 있었지만 배송은 빠르게 받았습니다
2021-06-09,4,제 스타일은 아닌듯합니다 ㅎㅎ
2021-06-03,4,부드럽고 살짝달아요막 대박대박대박 은 아니에요ㅎㅎ개취입니다
2021-06-12,5,저랑은 잘 안맞는거 가탕요
2021-06-24,5,좋아요 부드럽고 목넘김이 좋네요
2021-06-04,5,포장이 매우 꼼꼼하게 잘되어 있는걸 보면 배송과정에서 다 터져서 온거 같아요ㅜㅜ 그외에는 아무 문제없고 터져도 그나마 절반이상 살아있어서 맛있게 잘 먹었습니다
2021-06-05,5,어렵게 성공했지만 배송도 빠르고 좋습니다
2021-06-27,5,배송 빠르고 좋아요
2021-06-09,5,믿고마시는표문자주 애용하고 있어용
2021-05-09,5,아주 귀한제품 빠르배송에 너무 감사드리고 왜 요즘 곰표곰표하는지 알겠어요 1인당 한박스 구매가 조금 아쉽네요ㅠㅠ4병으론 둘이 먹기에는너무 맛있어서 부족하네요 ㅎㅎ 하루빨리 물건이 풀려서 마트나 편의점에서 구매하길 바랍니다
2021-05-17,5,핫한 표문 구할수있던것만으로도 행복해요배송예정일에 딱맞춰 도착 비오는 날씨에 딱 맞게 마셨습니다 탄산이 없는 편이예요
2021-06-19,5,시간이 지날수록 탄산이 생긴다고 해서 3주 뒤에 먹어봤는데 정말 맛있어요
2021-04-22,5,라방때 구매 성공 후 이번주에 또 성공했네요표문 지난번엔 첫주에 3병 그리고 그 다음주에 한병 마셔봤더니 오 다른 맛이이번엔 한주에 하나씩 먹어보기로 했어요오늘 받았는데 어제만든 막걸리가 딱너무 감사합니다두병 남았을때 또 도전 할께요
2021-06-21,5,막걸리가 이렇게 부드러울 수 있나요 넘 맛있어요
2021-04-15,5,저 첫날 받자마자 먹었을때 놀랬어요 기대가 컸던지 탄산이 없어서 좋았지만 니맛도 내맛도 아닌게 맛있는 막걸리 찾아 사먹는 편인데 좀 실망함요 다음날 한병 더 마셔보니 전날보다 맛이 들었는지 더 괜찮아 졌지만 여전히 뭔가 부족한 맛 에 좀 속상했음요 제가 막걸리 맛 있다면 전국어디든 마다 않고 찾아서 맛보는편인데 남편이 술을 좋아하는 편인데 냉장고서 꺼내 마시질 않네요 ㅠ 며칠 지나 먹어볼려고 놔뒀어요 두번 주문해서 또 다시 먹어보고 평가할게요 맛있다고 쓸수도 있지만 그러지 않으려구요
2021-05-27,5,아직 시음전입니다후기가 좋아 기대됩니다
2021-05-26,5,운좋게 처음 시도에 구매했는데다시 구하려니 또 안되네요 ㅎㅎ감사히 잘먹었습니다 
2021-06-09,5,곰표와 함께 잘 어울리는 술입니다
2021-06-27,5,한번 결제 성공하니까 나름 방법을 터득했네요
2021-06-01,4,부드러워요 한번 먹어본걸로 만족
2021-06-09,5,술잘 못 마시는데 맛있네요
2021-06-20,5,선물용이라서요 ㅋ ㅋ친구가좋아할꺼같아요
2021-05-28,5,아직 맛은 못봤지만 기대가 되네요과연 이번주 캠핑이 기다려집니다 ㅋㅋ
2021-06-30,5,맛있게 잘 먹었습니다
2021-06-09,5,아직 먹기전이라 기대가득입니다
2021-06-16,5,맛있어요ㅠ 달달하고 진하고 맛있습니다또사먹을겁니다
2021-06-06,5,부드럽고 목넘김이 깔끔하고 좋았어용
2021-06-26,5,재주문했어요 맛있어요 헤헤
2021-05-26,5,요즘 곰표에 빠졌는데 곰표 막걸리도 맛있네요목넘김이 부드러워서 한방에 다 마실뻔 했네요
2021-06-14,4,다좋은데 막걸리가 한통이 샛어요ㅠ그래서 여름철이라서 냄새기낫어요ㅠ닦아서 넣엇는데 넷중 어디서 샛는지 몰라서ㅠ
2021-06-13,5,매우 부드럽습니다 
2021-05-30,4,목요일에 구매성공하고 토요일에 받았어용 아직 맛은 안봤는데 기대중
2021-06-11,5,탄산이  없어서 목넘김이 좋네요
2021-05-21,5,알쓰지만 부드럽다고 하길래 주문해봤네요역시 부드러웠어요 두번 주문해서 지인들한테도 나누어 주었어요 디자인도 너무 이뻐요
2021-04-20,5,핫했던 곰표맥주에 이어 곰표막걸리가 출시됐다길래 어렵게 광클해서 구매했네요 사이즈는 500ml라 기본 막걸리들보다는 작게 느껴졌어요인당 한병씩은 먹어야할거같은 ㅋㅋ 그래도 가득하게 담겨져있어서 좋구요 곰표 거꾸로하면 표문막걸리 이름부터 막걸리스러우면서도 독특합니다 자주 구매하는 막걸리리스트에 추가하려구요매일 판매하는 수량을 조금만 더 늘려주시면 감사요
2021-07-25,5,조아조아 조아조아 조아조아
2021-05-19,4,부드럽고 정말 좋아요 바로 마시느라 막걸리 사진은 못찍고 팜플렛 사진만 찍었다는ㅜㅜ정말 좋아서  또 주문했어요
2021-06-04,5,처음 먹어봤는데 부드럽고 깔끔하고 맛있어어요
2021-06-28,5,힘들게구매햇지만좋아요
2021-05-18,4,생각보다 묽은 맛이 나는데요 설명서대로 좀더 숙성해봐야할거 같아요 부모님은 단맛이 나서 싫다고 하는데 저는 좋아요
2021-06-04,5,맛있네요재구매재구매중입니다
2021-06-10,5,맛있었어요 ㅎㅎㅎ 굿굿
2021-06-13,5,잘받았습니다
2021-06-24,5,기대이상이네요 기가맥힘
2021-05-31,5,부드럽고 맛있어요재구매의사있어요
2021-06-10,5,진짜 구매하기 빡샜습니다
2021-06-08,5,부드러운 표문 막걸리 짱
2021-05-15,5,핫한 표문막걸리를 드뎌 영접했어요 ㅋㅋ 9시 알람까지 맞춰가며 ㅋㅋ 구매하기 드뎌 성공 와 너무 맛있어요 막걸리 ㅋㅋㅋ 포장도 꼼꼼하게 잘 도착했어요
2021-06-26,5,자주 사먹는데 23일째가 제일 맛있는거 같아요
2021-06-26,3,두번째 구매입니다부드럽고 좋아요
2021-05-21,5,요게요게 요물이에요 막걸리의 톡 쏘는 맛도 없이 스리슬쩍 부드러운 목넘김이매일 아침 9시 나의 승부욕을 불태우게 하네요 오늘도 도전해 봅니다
2021-06-06,5,좋아하는 맛은 아니지만 괜찮아요
2021-06-06,5,좋아하는 맛은 아니지만 괜찮아요
2021-06-17,5,맛있어요 탄산들어가 있지 않아 전 더 좋았어요 부드럽고요
2021-05-18,5,첫구매했는데 성공했어요 배송도 하루만에 오네요 패키지가 너무 귀여워용ㅋㅋ 아직먹어보진 않았지만 구매한거만으로 만족
2021-06-25,5,와ㅋㅋ 맛있네요 ㅎㅎ사재기하렵니다
2021-05-24,5,곰표맥주에 이어 곰표막걸리까지 너무 맛있고 좋아요 목넘김이 너무 좋네요 다먹으면 또 사고싶어요
2021-06-10,5,자꾸 생각나는 막걸리
2021-05-13,4,저는 어렵지않게 한번에 주문했어요ㅎㅎ  샌 거 없이 박스에 잘 담겨오긴 했는데 날이 더워서 그런가 아이스팩은 다 녹아서 왔더라구요 먹는데 문제는 없겠죠 받자마자 김냉으로아직 먹어보진 않아서 맛은 모르겠네요ㅎ 먹어보고 다시 후기 남기러 오겠습니다
2021-06-10,5,자꾸 생각나는 막걸리
2021-06-04,5,탄산없는 부드러운 맛이에요호불호 갈릴수도있으니 참고하세요
2021-06-01,4,탄산 없고 부드러워요 그리고 도수도 낮아서 술같지 않네요 
2021-05-12,5,와 끝내줍니다엄청 부드러워요 재구매하고 싶은 맛이네요기존에 먹었던 맛고ㅏ 다르고이렇게 부드러울수가잇나 싶네요완전 꿀꿀
2021-07-28,3,없음
2021-05-29,5,재구매 했습니다 최근 마신 막걸리 중에 제일 맛있네요 굿
2021-05-23,5,맛있어요그러나 너무 기대했던터라음 기대안하고 마셔야됩니다
2021-05-27,5,무난무난 사려고 3일 시도한 끝에 성공했네요 다들 막걸리에 진심이시군요 물론 나도 재밌었습니다
2021-05-22,4,핫한 막걸리저도 먹어봤어요9시에 주문하고나니 1분만에 품절되더라구요부드럽지만 개인적으로 탄산있는 막걸리가 좋은데표문은 탄산은 별로 없어요
2021-05-30,3,기대한것보단 맛있진않네요ㅎ그래도 달달하니 맛있어요ㅎ
2021-06-09,5,진짜 너무 맛있네요
2021-06-08,5,어렵게 구했어여귀여워요
2021-06-08,5,기념으로 선물용으로 재구매함
2021-06-27,5,4번째 구매입니다 선물용으로 구매합니다
2021-05-22,5,하나도 새지 않고 잘 왔네요사실 티켓팅을 오래 해봐서 구매하기는 쉬운편이었어요 ㅎㅎ
2021-06-07,5,주문이 어렵지만 맛있습니다
2021-06-14,5,너무 좋아요
2021-06-03,5,점점 구매하기 힘들어지는 표문 맛있게 잘 먹었습니다
2021-06-04,5,맛있네요재구매재구매중입니다ㅎ
2021-06-08,5,병도이쁘고 맛도 좋고 짱입니당
2021-06-12,1,이제 고만 사야겠습니다 ㅎㅎㅎ
2021-06-02,5,탄산없는 막걸리는 처음이라 낯설지만 부드럽고 맛있어요
2021-06-26,5,빠른배송 귀엽고 맛도 무난해요
2021-05-18,5,진짜 최곱니다 매일매일 주문해서 받아서 마시고 싶어요 광주광역시에 판매처가 없어서 아쉬울 따름입니다ㅠㅜ
2021-05-31,5,아주 맛있어요양도 혼자먹기 딱 입니다
2021-06-26,4,생각만큼 혁신적이진 않음 유행타는정도입니다
2021-05-27,5,너무 부드럽고 달큰  왠만한 음식과잘어울려맛있게 잘 마셨어요
2021-06-07,5,먹어보세요 두번 먹으세요 돈값합니다
2021-06-21,5,재주문해서 선물도하고 맛있게 잘 먹었어요
2021-06-01,5,정말 맛있어요ㅎㅎ 오늘 또 주문했어요
2021-05-27,5,맛있었어요정말 탄산이 없네요부드러워요
2021-05-11,5,배송도 빠르고 맛도 좋아요막걸리 못 먹던 사람인데  이건 괜찮아요 매운갈비찜과 같이 먹엇는데 술술 넘어갑니다ㅋ
2021-06-18,5,9시정각에  한번의 실수없이 딱딱딱 성인인증후  결제까지 딱  덕분에 지인분들께 선물해서 참 좋네요
2021-06-04,5,이런막걸리도있구나 하는 맛입니다자주 주문할듯합니다
2021-06-17,5,패키지가 너무 귀여워요다 먹으면 또 주문 도전
2021-06-29,5,너무좋아요 또 도전할래요
2021-05-13,3,아이스팩이 터져서 바닥에 물이 흥건하게 왔네요ㅜ요즘 너무 인기있는 막걸리라 기대하고 주문했는데 포장신경좀 더 써주시길요
2021-06-25,5,부드럽고 고소한맛이 나네요
2021-06-06,5,목넘김이 부드럽고 맛있어요
2021-06-02,5,달달하니 맛나요 비싸긴 한데 맛있어용
2021-05-26,5,1분컷이라 성인인증에서 매번 실패했지만 결국 성공했네요 부드럽고 괜찮아요
2021-06-05,5,탄산이 별로 없고 진해서 맛있었어요
2021-05-31,5,처음에먹는거랑 숙성시켜먹는맛이달라서 좋은거같아요
2021-06-23,5,부드럽게 잘 넘어가네요 힘들게 구입한만큼 잘 마셨네요
2021-06-22,5,두번째 구매하는건데 넘 부드럽고 적당히 달달하니 맛있습니다 ㅎㅎ
2021-05-25,4,아침햇살 맛이 조금 났던 거 같아요 양이 많이 적긴 했지만 맛있었어요
2021-06-08,5,맛있어서 재구매합니다
2021-05-24,4,디자인은 예뿌고 좋은데 술 안좋아하는 저한텐 별로였어요 ㅠ 다른막걸리보다도 그냥 그렇더라구요
2021-06-06,5,탄산이 없는 상태만 마셔보았는데 부드러워요
2021-06-24,5,재구매했어요만족합니다
2021-05-19,5,정말 시간 알람 맞춰 기다려 구매 성공 ㅋ사람마다 입맛 차이는 있겠지만 제입에는 괜찮네용ㅎㅎ 또 알람맞춰 구매준비해야겠에요 ㅎ
2021-06-14,5,맛있게 잘 먹었어요부드럽게 잘 넘어가는 맛이네요구하기 힘든게 단점이에요ㅜㅜ
2021-05-11,5,배송도 빠르고 꼼꽁하게 포장되어 왔어요 너무 예뻐서 마시기 아깝네요ㅋ유통기한 30일로 넉넉합니다
2021-06-08,5,부드러운 막걸리네요 새롭습니다
2021-06-10,5,부드럽고 맛있어요 ㅎㅎ
2021-06-05,5,너무귀야워서 먹고싶지않음 으어
2021-06-22,5,맛있어요 부드럽고 좋아요
2021-05-07,5,기대했던것만큼 맛있네요 목넘김도좋고ㅎㅎ 신랑이 요즘 막걸리 러버라서 구매해봤는데ㅎㅎㅎ 탄산없이 부드럽게 넘어간다고 합니다 하루이틀 더 뒀다가 먹어보려구요ㅎㅎ 한병 500ml인데 캠핑와서 신랑이랑 종이컵으로 두잔씩마시니 없네요ㅎㅎ 또 사고싶어요
2021-06-08,3,어렵게 구매한거라 기대가 커용
2021-06-11,5,몇번의 실패끝에 드디어성공하고 영접했습니다 부드럽고 맛있네요 감사합니다
2021-06-29,4,정말 예전에 먹던 탁주의 맛이네요
2021-06-26,5,좋아요 또 주물 할게요
2021-06-22,5,늘 마시는 막걸리 떨어지면 불안해요 중독인가요
2021-05-31,4,일반 막걸리보다 좀 달달하긴 한데 엄청 부드러워서 목넘김이 좋았어요 
2021-06-03,5,진짜 순삭이예여ㅠㅠㅠ한순간에 다먹어버리는 ㅠㅜ
2021-07-01,5,너무 달지 않고 부드러워요
2021-06-22,5,처음엔 그냥 막걸리다 했는데 자꾸 생각나는 맛이에요
2021-06-27,5,탄산 거의 없고 묵직하면서도 부드러운 맛
2021-06-07,5,뷰드럽고 순하고 조아요
2021-06-26,5,주변분들한테 드린다고 여러번 구매했네요
2021-06-28,5,맛있게 잘마셨습니다
2021-06-04,5,성공하고 마실때마다 진짜 맛있어요
2021-06-26,5,매번 만족하면서 사먹고 있습니다
2021-06-15,5,아이스팩 하나가 터져서왔어요 ㅠㅠㅠ백신맞아서 아직 맛보진않았으나 얼른 맛보고싶네요
2021-06-21,5,완전맜있어요ㅎㅎㅎ아침마다 쾅클로 얻을수있는막걸리ㅠㅠ
2021-06-26,5,빠른배송감사합니다
2021-04-14,4,숨뚜껑이라 약간 새긴 했지만 포장도 꼼꼼하게 온 편이에요 다만 문의에도 남겼듯이 음용에는 문제없다는 답변을 받았지만 밀껍질 가루들이 좀 마니 떠다녀서 아쉽네요 4병 다 ㅠㅠ 제 막걸리는 끝물 막걸리가 왔나 좀 더 보완되었으면 좋겠습니다
2021-05-26,5,아직먹어보진 않았는데약간 샜어요ㅠㅠ바닥에 많이 흥건한건 아니지만병 옆에 치덕치덕좀 숙성시켜서 먹어보려고요
2021-05-28,5,목 넘김도 부드럽고 깔끔해요 탄산맛이 거의 없이 부드러워요
2021-06-05,5,배송이 썩 빠르지는 않았지만 좋아용
2021-06-21,5,막걸리를 별로 좋아하지 않는데 인기라기에 사봤는데 맛있어요
