date,star,text
2022-11-22,5,표문 막걸리는 제가 제일 좋아하는 막걸리예요표문막걸리 런칭 첫 라이브 에서부터 편의점에 팔았을때도 마트에서도 지금까지 사서 마시는 막걸리입니다집이 지방인데 내려 갔을때도 마트에서 판매하길래 사서 가족들과 마셨는데 부모님이 옛날 막걸리 맛이 난다고 너무 좋아하셨어요역시 입맛은 다 똑같나 봅니다 역시 한강주조 이번에 오랜만에 라이브 한다길래 일주일 내내 기다려서 보고 주문했는데 후디도 당첨되고 너무너무 행복합니다후드 재질도 엄청 탄탄하고 기모도 있고 두껍고 정말 좋아요 잘 입고 다니겠습니다 너무 감사드려요도착한 막걸리 중 한병과 후드 사진 그리고 얼마전 마트에서 표문이 없어서 산 두번째로 좋아하는 나루생 막걸리 사진 올려요 막걸리는 한강주조 입니다 더더더 번창하세요
2022-11-22,5,와라이브 이벤트에 후디 당첨되었어요와 진짜 당첨될줄 몰랐는데 너무 기분이 좋네요후디도 엄청두껍고 고급집니다블랙색상에 꺄표문막걸리는 제가 가장 좋아하는 최애 막걸리랍니다그 어떠한 안주랑도최고의 궁합이쥬김장김치또는 굴보쌈하고 이번주에 가족들과 함께 먹어야겠어요 이런 이벤트 자주자주  해주세요선물받은 기분이네요 ㅎㅎㅎ표문은 사랑입니다소프하면서 크리미한 매력을 갖춘 표문막걸리 말해뭐해 ㅎㅎㅎ 빠른배송과 꼼꼼한 아이스팩 포장 최고입니다 한강주조 화이팅유통기한 넉넉하고 굿입니다ㅎㅎㅎ
2022-11-26,5,한강주조를 처음 알게된건 인사동 어느 고기집이었는데 부모님과 함께 간단히 마시려고 시킨 막걸리가 어찌나 부드럽고 맛있는지 취하지도 않는다며 기분좋게마셨던 생각이 들어 표문 막걸리도  주문했어요원래 막걸리는 자주 마시지도 않지만 탄산이 들어간 막걸리를 선호했는데 한강주조 마시거 나니 취향이 바뀌었나봐요 꾸릿한 누룩 막걸리 맛이 전혀 안나고 목넘김이 부드럽고 마신 후 뒷끝에 은은하고 달달한 바닐라 향이 입안을 감돌아요 음식이랑 같이섭취하면 모를수도 있어요 옴뇸뇸 꼭 꼭 첫잔은 음미해보시길
2022-11-28,5,축구경기 보며 마셨어요부드럽고 은은한 단맛이 너무 좋아요계속 생각나는 맛이네요 라이브 방송 자주 부탁드립니다
2022-11-24,5,가격이 많이 내렸네여곰표 막걸리 중독성있습니다쏘는맛없지만 부드럽고 맛있어요
2022-11-09,5,막걸리를 제대로 먹기 시작한건 지독한 장염에 걸렸을때예요 병원 치료와 의사쌤 권유로 유산균을 열심히 먹고 있는데도 2주가 지났는데도 낫질 않더라구요 그때 동생 전남친 현남편이 막걸리를 마셔보라는거예요 막걸리에 유산균도 많고 주정뱅이에게 2주는 길었기에 두사발 드링킹 했죠 다음날 어제와 다른 변고가 생기드라구요 그렇게 막걸리의 기적을 맛본후 지금까지 즐겨마시고 있지만 저 따라하진 마세요 장염에 알콜이라뇨 떼끼어쨌든 표문 막걸리 만세
2022-11-19,5,아이스팩도  넉넉히  들어있고  포장도  꼼꼼히  하나도  새지  않고  잘  도착했어요3번째  구매인데  막걸리는  너무  진하고  맛나요 ㅎ쉽게  구입하게  되서  넘  좋네요 ㅎ
2022-11-22,5,포장부터 잘돼서보내주고 표문막걸리 처음인데 기대가되네요에코백도 당첨되서 좋네요
2022-11-22,5,김장을 앞두고 주문한 한강주조 표문막걸리어찌나 배송도 빠른지 게다가 라이브방송 이벤트 당첨으로 한박스 더왔어요  너무너무 행복합니다 잘마시고 또 주문할께요
2022-11-26,5,넘 맛있네요단골될것같아요연말에 최애가될것같아요
2022-11-09,5,바나나를 품은 듯한 은은한 단맛에 약간의 시트러스한 맛마트에서 우연히 한병먹고 완전 반해버려 주문했습니다 이런 프리미엄 막걸리를 집으로 배달해 먹을수 있다니 너무 행복합니다 한강주조 사랑합니다
2022-11-26,5,달콤달콤 딱제입에맞네요 사이즈는작아요 귀요미
2022-11-23,3,너무 기대했나봐요ㅠㅠ 제스타일은 아니네요
2022-11-28,5,맛납니다 아스파탐이 진짜로 없는지 뒤끝없어요 머리 안아프고요 술술 잘 넘어갑니다 막걸리마니아로서 조금 싱거운 느낌
2022-11-22,5,엄청부드럽습니디 도수도 약해요
2022-11-22,5,월드컵 응원하기 위해 재구매합니다ㅎㅎ
2022-11-10,4,첫맛은 역대급 막걸리임 아주 부드럽고 달콤하고 향기롭고 하지만 일반 시중 막걸리에 비해 상당히 비싼편 다른 막걸리는 유통 기한 지난 막걸리라도 숙성에 따라 맛이 좋아지는데 이 막걸리는 시간이 지나니 맛이 쎄하게 변하네요 수령 후 10일 정도 지났는데 말이죠 다 못먹고 버렸어요
2022-11-22,5,인생 막걸리 주문했습니다 가끔 주문해 마시는데 적극 추천드립니다 그리고 이번에 운좋게 11 이벤트에 당첨되어 감사드립니다
2022-11-22,5,맛있는 막걸리 입니다
2022-11-12,5,곰표막걸리 좋아해요 인터넷구매 넘 편해용
2022-11-19,5,배송도 빠르고 좋네요
2022-10-12,5,맛있어요 코에 걸리는 알콜향 없이 부드럽게 달콤하게 드실수 있습니다 토욜 낮에 반주 삼아 한병 하고 눈떠보니 주방 바닦에서 잠들었더라구요 술 맞습니다 포장상태 완벽합니다 겉종이 박스도 코팅된 두꺼운 박스예요 스토어에서 구매하시면 신선한 상태의 막걸리를 맛볼수 있습니다 그럼 전 이만 맛보러 가겠습니다
2022-11-02,5,가격이 내렸어요 더 가볍게 즐기겠습니다 술쟁이는 뭐 그저 신났죠 캬캬캬
2022-11-26,5,맛있어요ㅎㅎ 곰표 막걸리 굿
2022-10-06,5,어제 도착했어야는데 오늘에서 왔네요 QA로 온도에 따른 맛변화의 얘길 들어서인지 맛이 3일째 맛이 나요 ㅋㅋ 막걸리 박사 나셨네 싶으시겠지만 막걸리 좋아합니다 이것저것 가격 안따지고 사먹을 정도로요 한강주조 막걸리는 첨가물이 없다보니 마시면 왠지 건강해지지 않을까란 간이 싫어할만한 착각도 해봅니다 맛있습니다 기분 좋은 자리에 부드럽고 달콤하게 즐기기에딱입니다
2022-10-27,5,맛있었어요 재구매 할게요
2022-11-23,5,엄마가 좋아하셔서 구매했네요맛좋다고하셔용
2022-11-08,5,부드럽고 술 냄새 많이 않나고 맛있어요
2022-11-14,5,달다 달어 저 혼자 롤하면서 병나발로 4병 다마셨어요 ㅎ워낙 달아서 안주는 김치하나 놓고 먹는게 젤 조음
2022-11-05,5,배송도 빠르고 포장도 꼼꼼히 잘 해주셨는데 아이스팩 녹은 물이 밖으로 흘러나와 박스가 다 젖었네요 제품에는 아무 이상 없습니다 잘 마시겠습니다 번창하세요
2022-11-19,5,이건 내입맛에 딱이에요술술 잘도 넘어가요근방 냉장고속이 이놈이 없어져요ㅎㅎ
2022-11-27,4,부드럽고 마시기 편합니다좀 가벼운 느낌이예요
2022-11-18,4,막걸리크기가 정말 조금해서 조금 아쉽네요선물용이라서 
2022-11-25,5,정말 너무 맛있고 막걸리 통도 너무 이쁘네요
2022-11-03,5,배송도꼼꼼합니다곰표술진짜 부드러워 술술 넘어갑니다
2022-10-22,5,포장 꼼꼼이 잘되어 왓어요 맛도 좋아요
2022-11-07,4,부드럽고 맛있네요
2022-11-27,5,언제나 맛있네요 ㅎ
2022-11-15,5,언니가 좋아하는 막걸리에요정말 맛있더라구요
2022-11-25,5,좋아요좋아요좋아욯ㅎ
2022-11-01,4,부드럽고 넘김이 좋아요
2022-11-25,5,좋라요좋라요좋아욯ㅎ
2022-11-08,5,무난무난한 맛이네요 워낙 느린마을이 인기가 많아서 그런가
2022-11-02,5,빠르게 잘받았습니다
2022-10-30,5,빠른 배송 감사합니다
2022-10-30,5,빠른 배송 감사합니다
2022-11-17,5,평소에 먹던 막걸리들보다 부드러운 느낌이에요
2022-11-07,5,하루 지나서 마셧는데 단맛이 더 올라온 느낌이에요 맛있게 잘먹었어요
2022-11-12,5,술술 잘도 넘어갑니다넘 자주 마시는거 같아 약간의 걱정이 됩니다ㅎㅎ
2022-11-20,5,상품잘받았습니다
2022-11-16,5,맛도 포장도 디자인도 모두 좋아요
2022-11-10,5,아직 맛은 안봤지만 빠른배송 감사합니다
2022-11-13,5,우유처럼 배달시켜먹는 막걸리
2022-11-13,5,늘 맛있는 제품입니다
2022-10-25,5,선물했는데 좋아하십니다
2022-11-09,5,지인한테 선물했는데좋아라하네요
2022-08-13,5,폭우로 인한 강남과 경기권 물난리로 택배배송에 문제가 생겼다는 빠른 전화로 친절하게 상담해 주신 판매자님 이번주 주말에 여행갈때 급히 필요했는데포기해야겠구나 싶었던 찰라에배송이 재개되었다는 문자와 톡톡문의가 답변이와서 빠른 상담 처리 시스템  업계최고가 아닐까 싶습니다판매자님  정말 친절하세요아이스는 녹아왔지만  술은 아직 살짝 찬기가 남아 집에 오자마자 냉장보관했어요귀요미 사이즈에  반했답니다경주여행때 먹어보고 반해서 편의점에 있는 찾아보다 실패해서 결국 인터넷으로 빠르게 도착해서 너무 좋았어요빨리 다시 먹고싶어요ㅎㅎㅎ크리미하고 소프트하면서 달달한 크림 막걸리 같은맛 너무 좋아요 여자분들이 좋아하는 그런 부드러운달단한 막걸리 안좋아하시는 분들이 드셔도 좋을거같아요 부담스럽지않아서 너무  맛있었어요가격이 개당4500원인지라 비싸긴하지만술집에서는9천원에 판매하는지라 ㅠㅠ 저렴하게  잘 산것같아요이제 이곳에서 계속 주문 해먹으려고요판매자님 번창하세요
2022-11-06,4,맛있는 막걸리입니다
2022-09-28,5,한달이 다 되어 갈때쯤엔 잘 익어서 오자마자 먹을때와는 또 맛이 달라요일 마치고 와서 기분좋게 한전 했어요
2022-10-08,5,부드럽고 달달해요 양이 좀 많으면 좋겠네요
2022-10-05,5,꼼꼼하게 아이스 포장되어서 받자마자 열었는데도 시원하네요 맛있게 잘 먹겠습니다
2022-09-28,5,밖에서 사먹다가 너무 맛있어서 주문했어요용량도 적어서 들고 다니면서 먹기도 좋아요
2022-10-27,5,술이  잘도 넘어 갑니다ㅎㅎ한잔에 또 한잔을 마셔도 취하는거 
2022-09-27,5,빠른도착 했습니다 좋아요
2022-10-24,5,맛있게 잘 먹었어요재구매 할겁니다
2022-10-31,5,술술 잘도 넘어가는 나한테 딱인 막걸리
2022-10-08,5,전이랑 먹으니 맛나요 헤헿
2022-09-24,3,맛이 기대가 컸는지 싱겁고 그렇네요그냥 일반 막걸리가 더 맛있네요 곰표 통 디자인은 넘 귀여워요
2022-10-07,5,무슨 맛일까 궁금해서 구매했네요
2022-10-16,5,맛있어요 먹어보고 싶어서 주문했는데 맛있네요ㅎㅎ
2022-10-17,5,부드러운 감이 먹기좋습니다 추천받아서 주문했는데 후회없네요
2022-10-13,5,포장 아주 굳물론 운송중 괴롭힘은 조금 있었던 듯 하나왜냐면 보냉팩 열었을때 쿰쿰했음걱정했던 것 보다 아주 잘 와서 기쁨
2022-10-07,5,탄산없이 부드러워요
2022-11-15,5,좋아요맛잇어요
2022-10-24,5,기대했던만큼 좋아요
2022-09-30,5,대충 먹는 저녁밥에 좋은 막걸리 친구가 옴 ㅋㅋㅋ
2022-09-15,5,재구매해서 먹고 맛있어서 또 시켰습니다 적당히 달달하고 목넘김 좋아요
2022-10-17,5,배송빠르고 맛도 좋아요
2022-10-20,5,술이 술을 부르는데 냉장고에 없내요ㅎㅎ
2022-10-18,5,맛있게 잘 먹었습니다
2022-10-20,5,술이 술술 잘도 넘서갑니다ㅎㅎ
2022-10-21,5,좋아요좋아료좋아요ㅎㅎ
2022-10-05,5,맛이 좋아요술술 잘도 넘어 갑니다
2022-09-04,1,밤늦게 택배가 도착해서 이미 아이스팩은 다 녹고 아침에 들여놨네요 실온에 오래 방치되어서 발효가 더 됐어요 먹던 맛이 아니라 아쉬워요
2022-08-26,5,자꾸만 생각나는 맛입니다 마트에서도 팔던데 한병사러 가야겠네요
2022-09-19,5,맛아요 곰표 맥주 잘 먹고 있어요
2022-09-21,5,좋아요좋아요젛아욯ㅎ
2022-09-23,4,배송은 빨랐지만 술이 새어서 온 것 같아요 포장 한번 더 확인해주세요 맛은 달달하고 목넘김도 부드러워요
2022-09-14,4,엄청 맛있지는 않았지만 그럭저럭 괜찮아오
2022-10-03,5,맛있어요 덕분ㅇ기잘먹었습니다
2022-10-03,5,배송 빠르고 좋아요 감사합니다
2022-09-13,5,빠른 배송에 부드러운 목넘김으로 온 가족 즐겁게 마셨습니다
2022-09-26,5,곰표 막걸리가 제일 맛있어요포장도 꼼꼼하게ㅣ 잘 왔어오
2022-09-26,5,부모님께 보내드렸는데 맛도 배송도 빠르고 맛도 넘 좋다고 하시네요 고맙습니다
2022-08-28,5,항상 맛있게 잘 먹고 있어요갓 만든 막걸리도 숙성시켜도 맛있어요
2022-09-04,5,막걸리 입문용으로 좋을듯합니다너무맛있게 잘 먹었습니당
2022-09-28,5,시골 막걸리 보다는 탁도는 약하지만 시중 다른 막걸리에 비해 탁도도 높고 당도도 적당해서 남녀 모두 좋아할 맛입니다
2022-10-08,5,배송이 빠르고 좋습니당
2022-10-06,5,정말 맛있는 막걸리 입니다 
2022-10-05,5,깔끔한 맛에 반했어요
2022-09-14,5,믿고 먹는 한강주조 표문 막걸리입니다
2022-08-03,5,이전에 늘 품절이라 못 사서 맛볼 기회가 없었고 그러다 잊고 지냈는데 어느날 캠핑가는길에 들린 마트에서 있는거 보고 반가운 마음에 두병 사서 먹어보고는 이거다 해서 인터넷에서 찾으니 이젠 편히 살 수 있어 좋네요 저와 막걸리매니아인 신랑 입엔 맛있어요 또 구매할게용
2022-10-21,5,좋아요좋아요좋아요 ㅎㅎ
2022-09-14,5,표문막걸리 맛있기를
2022-09-19,4,부모님 드렸는데 옛 탁주 마시는 느낌이라고 하시네요 ㅎㅎ 탄산이 없어서 그런지 좋습니다
2022-10-07,5,잘 먹었씁니다  ㅋㅋ
2022-09-24,4,맛있네요가볍게 마시기 좋아요
2022-09-22,5,곰표 막걸리를 너무 즐기다보니 곰도 좋아하게 됐어요ㅎㅎㅎ꽐라
2022-09-26,5,선물 받은 이가 한강주조 막걸리매니아가 되었습니다 고맙습니다
2022-09-26,5,너무맛있어여 또먹겠습니다
2022-09-06,4,조금 비싸다는 생각입니다 잘 마셨습니다
2022-08-11,5,예전엔 품절이어서 늘 못먹어 보다가 최근 마트에 진열되어 잇길래 먹어봤더니 너무 부드럽더라구요  스토어팜도 이제 품절없이 편히 살수 있는 듯 해서 쉽게 구입했습니당
2022-09-09,5,안전하게 잘 도착했습니다
2022-08-17,5,포장도 곰표 상자에 꼼꼼하게 해주셔서 너무 좋았어요 맛보니 너무 부드럽고 먹기 좋네요
2022-09-06,5,선물용으로 샀는데 빠르게 왔네요
2022-09-26,5,매장에 먹어보고 저렴하게 주문했습니다
2022-09-20,5,맛있어요와이프가 혼자 다마셨어요 
2022-08-20,4,보냉제 2개가 다 녹아서 찬기가 없어진채로 배송되었어요더운 날씨엔 좀 더 신경써주세요
2022-09-23,5,술술 잘도 넘어갑니다한번 맛보세요
2022-09-25,5,선물해준 지인이 맛있다하네요 
2022-08-03,1,그냥 가격만 비싸고 대박이나 장수가 훨씬 맛있네요 가격도 500m에 4천원꼴인데 재구매의사없어요 달인보고 구매했는데 후회됩니다
2022-07-14,5,그레놀라 먹을려고 시킨건데 막걸리라 스티커만 와서 그거라도 먹어야겠어요 주막은 지땡 막걸리 제땡유산균막걸리 좋아해요 좀 되직허니 코에서 걸리는 냄새없이 꿀떡 넘어가는 오늘 도착하자마자 2시간 냉장 시키고 반잔 마셔봤는데 코에서 걸리는 알콜향 없이 정말 부드러운 맛인것 같아요 마치 아기 고양이를 바라보는 분노끼 싹 빠진 원초적인 순수함과 아련함이 범벅된 착해지는 그런 알쓰도 두려움없이 먹을수 있을것 같아요나루 생 막걸리도 가끔 먹어봐서 시간의 흐름에 따라 달라지는 맛이 독특하다 생각했는데 이 막걸리도 내일은 어떤 맛으로 변했을지 모레는 어떨지 기대가 되네요
2022-09-26,5,아쥬 배송빠르고 죠아유 ㅋㅋㅋ
2022-08-23,5,진하고 달달하고 먹기 좋습니다 특히 막걸리 처음 드시는 분들이라면 더 먹기 좋을 듯 합니다
2022-08-30,5,일반 막걸리보다 맛이 진함
2022-09-07,5,늦어질까 걱정됐는데 다행히 다음날 왔어요 맛은 부드럽고 끝맛이 깔끔합니다
2022-08-09,5,주류 박람회에서 시음 후 구매했습니다 막걸리  원래 좋아하는데 달다구리해서 너무 맛있었어요 진짜 배민 수준으로 칼 배송이고 시원하게 왔습니다
2022-09-21,5,제거 제일 좋아하는 막걸리예요
2022-08-20,5,좋은사람과 맛있는 음식과 함께 먹으려고 주문했어요 잘 먹을께요
2022-09-12,1,술 맞나요최악의 맛  음료에 가깝습니다ㅜ
2022-08-21,5,막걸리 맛있어요 배송도 꼼꼼하고 빠르게 왔어요
2022-09-18,5,새로운 맛 경험 잘 구입했어요
2022-09-08,5,정말 부드러운 막걸리 입니다  목넘김도 좋고 맛있어요
2022-09-18,5,부드럽고 목넘김이 좋습니다
2022-08-09,5,저번에 코엑스에서 시음했는데 인터넷으로 주문할 수 있다고 알려주셔서 구매하게 됐습니다달달한 막걸리 좋아하는 분들께 추천드려요
2022-09-17,5,우유처럼 정기 배달해서 마시고 싶네요
2022-10-06,5,맛있어요 맛있어요
2022-09-10,5,배송도 빠르고 목넘김이 좋아요맛있어요
2022-09-09,5,맛이 좋아요색다른맛이네요
2022-09-10,5,맛이 부드럽고 안주 없어도 잘넘어 갑니다
2022-09-06,5,후레쉬 한맛을 올려 주시면 더 좋은 막걸리가 될거 같아여
2022-08-15,4,약간 느끼한듯하지만 맛있어요
2022-09-12,5,술술 잘도 넘어 갔니다
2022-08-19,5,역시 맛있게 잘마셨습니다
2022-08-15,5,살짝 달콤하면서도 부드럽고 맛있어요
2022-08-15,5,맛있어서 재구매해서 잘마셨습니다
2022-08-09,5,늘 맛있습니다유통기한이 길어 좋아요
2022-09-02,5,너무 맛이 좋아서재구매  했네요
2022-09-01,5,가격이 조금만 내리면 금상첨화일 거예요
2022-09-06,5,배송 빠르고 좋습니다 
2022-09-06,5,술술 잘도 넘어가요
2022-09-01,3,잘 받았습니다 감사합니다
2022-08-13,4,배송이빨라  좋아요
2022-08-10,5,포장도 깔끔하고 맛도 깔끔하고 막걸리 하면 역시 한강주조X곰표 콜라보너무 맛있어요 ㅎㅎ몇번째 재 구매인지 또 사먹을거에요
2022-09-08,5,맛잇습니다
2022-08-30,5,부드럽고 달달해서 맛나요
2022-08-16,3,신랑한테 서프라이즈로 사줬는데 촌스러운 그분은 기존에 마시던 두번깍아 만든 뭐시기가 더 맛있대요
2022-08-15,5,맛있어요 단맛이 없고 부드럽고 맛있어요 좋아요
2022-08-31,5,부드럽고 달달해요
2022-08-15,5,빠른 배송 감사합니다맛도 좋네요선물하기에 좋을거 같네요
2022-08-09,5,숙성시켜 먹어도 맛있어요
2022-08-04,5,용량이나 가격이 부담되긴 하지만 맛은 진한게 좋네요
2022-07-30,4,후기대로 부드럽네요 가격이 부담이라 자주는 못마실것 같아요 ㅠ
2022-08-08,5,진하고 부드러운 맛에 뿅뿅 반해버렸어요요렇게 맛난 음식은 혼자무믄 배탈나죵남친에게 슝 보냈어요부모님도 알아보시는 맛맛맛따봉
2022-07-25,5,맛있게 잘마이고 있어요
2022-07-28,3,바로 먹는것보다 열흘에서 보름정도 숙성시켜 멋는게 더 맛있긴하지만 별다른 특색있는 맛은 아니네요
2022-08-24,5,기대했던 그대로 잘 맞아서 다행요
2022-07-28,5,옛날 엄마가 담가  놌으셨던 그맛이나고요맛도 최고이구요  향이풍부하게느껴져서 좋아요 부담되지않아세 좋고  만드신분들 축복합니다
2022-07-20,5,부드럽고 역한 냄새도 없어 좋네요
2022-08-10,3,부드럽긴하나 저는 그냥 장수에 한표요아이스팩이 터져서 박스가 전부젖어왔고  정리하는데 짜증났슴 ㅠ
2022-07-17,5,깔끔함에 끝판왕막걸리 특유에 냄새때문에 막걸리를 즐겨하지않는 제가 인생막걸리를 발견했네요 짱조아맛있어서 큰일입니다ㅎㅎ
2022-08-21,5,좋아요 좋아요 좋아요 
2022-08-22,5,배송은 좀 늦어지만 제품은   먹을만 합니다
2022-07-16,4,옛날 막걸리맛이에요 탄산이 없으니까 막걸리본연의 맛이 살아나는것같네요 제 취양에는 맞는듯 맛있습니다
2022-08-05,4,탁도도 진하고 부드러워요 전통막걸리 특유의 향과 맛이 덜 느껴져 아쉽지만 그래도 젊은 사람들 입맛에는 딱이에요
2022-07-24,5,제가 먹어보고 맛있어서 지인께 선물해드렸는데 좋아하시네요
2022-07-18,5,ㅋ 비싼감있지만 나쁘지않았어요근데 비싸서 다시 구매는 안할것같아요ㅜㅜ 지송
2022-06-21,5,뚜껑의 공기구멍 때문인지 약간 새나왔어요함께 보내주신 스티커그래놀라 등포장박스부터 모두 만족합니다
2022-08-15,5,목넘김이 좋고 아주 맛있어요
2022-07-25,5,넘뷰드럽고맛나서좋어요
2022-07-16,5,배송도 빠르고 부드럽네요우연히 생활의 달인 보다가 생각나서 바로 구매했습니다
2022-07-14,5,아직 먹어보지 않았지만 기대 하고 있습니더김치냉장고에 보관중
2022-08-10,5,아이스팩 두 개 넣어주셔서그런지 바로 먹어도 될 정도로 시원해요
2022-07-14,5,얼음띄워 마시니  시원해서 좋네요사이다를 섞어  먹어보려구요
2022-08-14,4,건강한 맛이라 좋습니다
2022-08-08,5,비싼막걸리ㅎ그래도 계속 찾게되는 이유는 뭘까요
2022-07-14,5,소비자를  배려 한 꼼꼼한 포장  굿 이에요
2022-07-29,5,안주 없이도 술술 들어가네요 그리고 병 모양이 귀여워서 술 안마시고 음료수 마시는 기분이에요   
2022-07-20,5,달달한 맛에 또 구매합니다
2022-07-06,5,1년만에 재구매하는데요전에는 9시에 광클못하면 못샀는데이제는 여유있게 구매되서 좋네요변함없는맛 좋네여
2022-07-21,5,신선하고 빠르게 배송되었어요 포장도 만족스러웠고탄산이 별로 없어서 개인적으론 부담없이 먹기 좋았어요
2022-07-21,4,다른거 먼저 먹느라 이건 아직 못 먹었어요
2022-07-25,4,맛있게 먹었습니다
2022-07-28,5,부드럽고 좋네요새콤한맛이 나요포도향 같기도 하고마시기 괜찮았어요
2022-07-15,4,맛은 괜찮지만 조금 비싸네요지역 막걸리보단
2022-08-12,5,달인에서 보고 바로 주문했습니다
2022-07-14,5,상품재고없어 하루 늦는다고 미리 안내문자주시고 금방 제조한 새 제품으로 유효기간 짱짱한 제품 보내주시고 포장도 어쩜 보냉팩에 넣어 받을때까시 C1하게 보내주시고 택배도 신속히 보내주셔서 감사합니다 맛역시 짱
2022-06-17,5,첫날 받자마자 먹고 3일연속먹어봤는데 개인적으로 다음날먹으니 더 맛있었어요단맛이 살짝줄고 요거트처럼 새콤한맛이 끝에 올라오더라구요재구매할것같습니다큰사이즈도 있었으면 좋겠고 가격에 부담이 좀 있네요
2022-08-08,5,아버님이 드시고 딱 옛날 막걸리라 하시네요
2022-05-26,5,곰돌이는 언제나 실망 시키지 않아요 여름철이라 아이스팩도 잘 넣어주셨고요배송도 엄청 빠르고 젤 중요한 맛은 말해 뭐하나요 입만 아프죠 ㅋㅋㅋ가볍게 한잔 하기 딱인 너가격만 좀 싸면 1일 1병인데그레놀라도 너무 맛있고 스티커는 아까워서 못쓸것같요
2022-07-19,5,맛나요굿굿또시킬게요
2022-07-22,5,제가 사실막걸리안 마시는데엄마를 위해 주문했었던건데그런데너무 맛있어서제가 한 병을 다 마시고아껴 마시려고 냉장보관 해두었어요ㅎㅎ너무 맛났습니다ㅎㅎㅎ
2022-07-14,4,누룩향이 좋은 전통적 막걸리 맛을 느낄수 있습니다
2022-08-02,4,양이 적어서 금방 다 먹었는데 곰표는 맥주가 더 맛있는듯 합니딘
2022-08-02,4,잘 받았습니다 술을 잘 안먹는 제겐 그냥 그런정도
2022-07-25,1,제가 먹어본 막걸리중 최저점을 주고 싶네요누룩 냄새가 너무나고 발효가 덜 됬었는지 쓴맛이 납니다
2022-08-04,5,부드럽고 목넘김이 아주 좋습니다
2022-07-16,4,사이즈가 아담해서 수량 2개로 주문했어요 맛은 좀 센 것 같은데 엄마가 맛있다고 하시네요 전 좀 독한 것 같아서 사이즈가 아담한데도 다 못 마실듯 ㅎㅎ잘 먹을게용 감사합니다
2022-06-24,5,막걸리집에서 먹어보고 너무 제스탈이라 직접 주문했어요 흔들어 섞어먹는게 젤 맛나네요 또 주문할꺼 같아요
2022-07-15,5,처음 주문했는데 맛이 너무 궁금했어요
2022-07-19,5,처음 주문 입니다 지금 마시고 있는데  정말  따봉  입니다
2022-07-30,3,그냥 저한테는 잘 맞지않네요밍밍해요
2022-06-09,5,집앞에  막걸리가 도착했어요 ㅎㅎ박스도 곰표스럽게   솔직히 아직 맛은 못봤지만 ㅎㅎ맛날것같아요 주말에 남편과 한잔하려해요
