date,star,text
2021-08-03,3,막걸리가 너무 부드럽다고 해야하나 입맛에 맞지않아요
2021-06-30,4,곰표 곰표 저 자체로 상자까지 귀여움맛은 괜찮은데 양이 적 ㅎㅎ
2021-07-31,4,기대를 너무 했나봐요술은 개취니깐  부드러운 좋은 술 이였어요
2021-07-21,4,생각보다 포장도 잘되어있구요500ml양이 좀 적은듯하지만 혼자먹기는 딱 좋으네요금액이 살짝 비싼듯 하구요
2021-06-23,5,재구매입니다 한번이 어렵지 하고나니 주문쉬운듯우연인가 ㅎㅎ 너무 맛있어요 탄산없고 부드러워요 살짝 달달하이 목넘김 좋아요 또다시 재구매 의사있어요
2021-06-22,5,아직 먹어보진 못했어요 맛있으니  인기가 있는거겠죠 맛있게 잘먹겠습니다  이동네 택배가 밤에 배송되다보니  얼음팩이 다 녹아서 막걸리가  실온상태더라구요ㅠㅠ 아쉬워요
2021-07-24,5,터진거 없이 주문후 익일 바로왔어요 ㄱㅅ
2021-07-24,5,터진거 없이 주문후 익일 바로왔어요 ㄱㅅ
2021-07-26,5,숙성되면서 맛이 달라져요 좀 비싸지만 한번쯤 먹어 볼만해요
2021-08-10,5,부드러우면서 아주아주 맛있어요
2021-08-01,3,정말 맛이 없었어요 막걸리도 다 새서 왔고요
2021-07-24,5,역시 맛있어요
2021-07-14,4,사이다랑 타서 먹으니 달달하니 먹기좋게 맛있네요
2021-08-02,4,더 숙성시킬수록 깊은맛이 느껴져서 좋았습니다
2021-08-09,4,기대감보단 평범한 맛
2021-07-22,3,광클에 비해 평범해요
2021-07-21,5,아주 좋아서 처제내 보냈어요
2021-08-06,4,전에 먹어보고 맛있어서 주문합니다
2021-07-25,5,맛이죠쿤요 잘ㅇ억엇습ㄴㄱ다
2021-06-20,2,너무인기가많아 여러번 시도끝에 성공해서 드디어 마셔보았습니다 마셔보니 그냥 목넘김만 부드러운 막걸리입니다 부드러운 막걸리 좋아하시는 분에게 추천드려요 재구매의사없습니다
2021-08-13,5,ㅎㅎ진짜 존맛입니다
2021-08-11,5,시켜봤는데 맛있더라구요
2021-08-16,5,잘 마셨습니다 ㅎ
2021-07-09,4,알람맞춰 놓고 어렵게 구매했어요 넘 기대했나봐요 그냥 그래요
2021-06-21,5,빠른 배송 및 안내가 가장 마음에 들었고 무엇보다 맛이 너무 최고에요 일반 막걸리랑 다르게 탄산이 적고 깔끔하니 최고에오
2021-08-08,5,요즘 푹 빠진 막걸리짱 맛나요
2021-07-18,5,제주도 배송은 너무느리네용 ㅠ광주에서 가서 제주도착하고 배송 출발하고보통 다음날 도착인데 제주는 그날 제주 도착해서 배송이 다음날 가니 여름이라 좀 걱정했어요
2021-07-08,5,너무 부드럽고 맛있어요 기대없이 먹었는데 기대 이상이였어요
2021-07-08,5,너무 부드럽고 맛있어요 기대없이 먹었는데 기대 이상이였어요
2021-07-08,5,너무 부드럽고 맛있어요 기대없이 먹었는데 기대 이상이였어요
2021-07-08,5,너무 부드럽고 맛있어요 기대없이 먹었는데 기대 이상이였어요
2021-07-19,5,막걸리가부드러워요
2021-07-20,5,포장박스가 따 찌그러지고 속에서 터진건가 싶을정도로 술 냄새가 났어요 포장은 좀 신경 써주셔야 할꺼같아용
2021-07-30,5,아직안먹어봤는데 판매하시는분도 너무친절하고 피드백도 좋았습니다
2021-07-11,5,너무너무 맛있어요 계속 주문 고고 곰표막걸리쵝오
2021-08-11,5,맛잇어요 드뎌 먹어보네영
2021-06-28,5,배송 빠르고 패키지 넘 예쁘네요 다만 탄산 없는 막걸리를 좋아하지 않아서 한번 마셔본걸로 만족해요
2021-07-24,5,배송이 얼음이 다 녹아서 왔어요 ㅠ
2021-07-14,4,양이 적어서 조금 아쉬운데 패키지도 귀엽고 만족합니당 
2021-08-02,5,옛날 시골에서 직접 만들어 먹었던 맛이에요맛있게  잘먹었어요
2021-08-04,5,박스까지 아주 잘 왔어요 역시요
2021-07-15,5,시간 맞춰 사니 구입할 수 있네요
2021-06-26,5,맛있어요주변에서 구입하기는 너무 어렵고 먹어보고 싶다고 하고  계속 주문하게  되네요
2021-08-10,5,나도 사고 선물도 줌 더 살걸 ㅠㅠ
2021-07-23,5,맛이 진하고 부드럽네요 가격대비 양은 좀 작네요ㅎ
2021-08-07,5,맛있고 추후에 시중에 나오면 구매합니다
2021-07-03,5,구매 세번 시도만에 성공했어요 배송도 빨리 왔고 맛은 제가 안먹어봐서 모르겠지만 너무 귀여워요
2021-08-02,5,선물받아서 먹어보고 맛있어서 주문했습니다
2021-07-20,4,피케팅 버금가게 열심히 주문해서 드뎌 맛봤어요기대이상의 부드러움이 살짝 술 맛에는 아쉽게느껴졌지만 전체적인 평은 만족합니다
2021-07-13,5,늘 믿고 사는 한강주조입니다 역시 막걸리는 나루 
2021-06-26,5,깜빡하고 제품 사진을 못 찍었네요 전이랑 같이 먹었는데 막걸리 저는 맛있더라구요 ㅎㅎ파손 없이 잘왔어요 
2021-07-12,5,자꾸 잊어버려서 8시50분 알람 맞춰놓고 드됴 겟 했네요탄산이 적다해서 앗 내스탈 아닌가 했는데 적당히 톡 쏘는 탄산감 찐한 쌀막걸리의 부드러움이 더해져 진짜 맛있더라구용재구매각 ㄱㄱ 처음엔 식구끼리두번짼 동료들과 공유하려고 재구매했어요
2021-07-12,5,한번에 성공했어요 ㅎㅎㅎ아직 마셔보지 않았는데 기대됩니다
2021-08-12,5,정말 만족합니다 
2021-06-26,4,배송 빨리 와서 하루의 마무리를 표문 막걸리로 했습니다ㅋㅋ 달고 맛있는데 막걸리는 제 취향이 아닌 것 같아요ㅋ큐ㅠ
2021-07-23,5,맛잇지만 넘 비싸여 ㅠ
2021-07-17,5,잘먹었습니다 자주 주문해서 마셔요
2021-07-18,5,빠른 배송에 맛도 맛잇네여
2021-07-15,5,맛있게 먹고 또 주문할께요
2021-08-02,5,맛있어요 며칠 숙성뒤가 훨 맛잇어요
2021-06-27,5,배송 빠르고 제품은 역시나 맛있어요다만 밑에 리뷰들처럼 배송포장 부분은 다른방식을 사용하셔야 될꺼 같습니다 혹시나 했는데 저희도 박스 다 젖어서 왔구요박스가 젖어서 물이 좀 흐르는 상태다행히 제품에는 이상이 없었는데 요즘같이 더운날씨에 제품 이상 생길수도 있을정도로 좀 불안해보였습니다 포장부분은 한두분이 얘기하는게 아니고 거의 주문하시는분들이 얘기하시는거니깐 다시한번더 생각해주셨으면 좋겠습니다
2021-05-26,5,두번째 구매 성공해서 받았습니다 두병은 지인한테 먹어보라고 주고 나머지는 먼저 받은 막걸리랑 순차적으로 숙성 시켜서 먹어 보려고요 받고 바로 마신 막걸리도 맛있는데 숙성되면 어떤 맛일지 기대가 됩니다
2021-08-09,5,양은 조금 아쉽지만 맛은 좋음
2021-07-18,5,너무 어렵게 구매 해서 먹어보니 맛있내요
2021-08-05,5,잘 받았습니다 맛있습니다
2021-08-01,5,한번에 마시기 부담없는 용량에 부드러운 맛이 좋아요
2021-07-08,5,맛이 궁금해서  주문 목 넘김이 부드러워서 좋아요 파전과 홀짝홀짝
2021-07-06,4,술 잘 못하는데 너무 부드럽고 맛있네요주문성공의 기쁨도 한몫합니다 
2021-07-19,5,제가 몇 번 시켜먹고 시아버지께서 막걸리 애주가이셔서 선물 드렸어요 좋아하시니 뿌듯합니다 탄산없이 부드럽고 맛있어요
2021-05-03,5,인스타에서 보고 궁금해서 주문해봤어요목요일 주문해서 금요일 발송 토요일 받았구요일요일에 남편과 맛을 봤는데 평소 소주를 즐겨마시는 남편이라 이거뭐 음료수잖아 할줄 알았는데 맛있대요 동동주 맛이라고  제가 마셔보니 알코올 냄새도 없고 탄산 없이 부드럽고 진하면서 감미료 무첨가인데 달달해요술을 잘 못하시는 분도 충분히 드실 수 있을것 같아요평소 아주 가끔씩 맥주 한캔이나 막걸리나 와인 한잔 정도 마시는 제 입에도 너무 맛있고 순해서 좋았어요술을 많이 마시지 않는 저에게 작은 용량이라 맘에들고 디자인도 넘 귀여워요 또 사야할것 같습니다ㅎㅎㅎ
2021-08-06,4,탄산없는 막걸리 신랑이 좋아해서 주문했어요
2021-07-07,5,부드러운 넘김과 살짝 달콤하면서 끝에 오는 쌈싸름함이 좋네요비오는 날엔 전과 막걸리죠 ㅎㅎ
2021-07-07,5,2주정도 숙성시키고 먹었는데 너무 맛있네요 또 시켜서 먹을거예요
2021-08-06,4,무더운날씨라 아이스팩이 다녹아서와서 아쉬웟오요 ㅠㅠㅜ
2021-06-29,5,막걸리 좋아하는 친구에게 선물했어요 맛있게 잘 먹길 바래요
2021-07-13,5,두번만에 주문성공했는데역시 표문막걸리 맛있어요
2021-07-08,5,오 선택된 자들만이 구매한다는 그 막걸리 드디어 받았네요오늘 꼭 먹어봐야겠어요
2021-06-30,5,맛있어서 캠핑때 먹으려고  재구매했어요 어른들도 좋아하시는 맛 시중막걸리보다 비싼데 맛있어서 자꾸 시키게되네요
2021-08-10,5,부드럽고 아주아주 맛있어요
2021-08-10,5,부드럽고 아주아주 맛있어요
2021-08-02,5,막걸리에서 느껴지는 마지막쓴 맛이 전혀 없는 것 같아요
2021-07-24,5,아직도 아침에 뜨는지 모르겟네요 맛있었는데더사고싶지만 술을 자제중이라 아쉽지만대신 지인들한테 소개했어요
2021-07-27,4,포장은 꼼꼼합니다 근데 아이스팩이 다 녹아서 왔는데 문제는 없겠죠ㅜㅜ
2021-08-06,5,좋아요 빠른배송 굳굳
2021-07-17,5,정말 맛있습니다 자주 주문해요
2021-07-16,5,일주일 정도 두었다 마시니 더 좋아요
2021-07-22,4,탄산이 강하지 않았어요쓴맛이 적고 적당히 달콤합니다감미료를 쓰지 않았다는데 풍미가 좋네요
2021-07-09,5,달달구리 너무맛있어요 근데 막걸리 가격치곤 넘 사악해요 용량두 넘적ㄱㅜ
2021-07-04,5,부드럽고 달큰하고 너무 맛있어요숙성해야 더 맛있다는데 참지못하고 오자마자 한병마셨네요ㅎㅎ
2021-07-17,4,숙성시켜야 조금 먹을만 하네요ㅠ
2021-07-15,4,부모님 선물했는데 맛있다고 좋아하시네요
2021-07-07,5,목넘김 부드럽고 맛있어요조금 비싼감이 있는게 단점이지만 ㅜ
2021-06-21,5,성분표가 너무 좋네요다른 막걸리는 이것저것 많이 들어가서 별로인데말이죠맛도 좋아요조금만 저렴하고 사기 쉬우면 자주 먹을듯해요ㅜㅜ
2021-07-21,4,목넘김은 부드럽습니다
2021-07-25,4,19일제조 20일주문 22일수령했어요배송이 늦어지면서 더운날씨탓에냉매팩 3개든게 다 녹아서왔어요맛은 괜찮아요
2021-08-02,4,아직 맛은 못봤고 빠른배송 감사합니다
2021-06-28,5,옛날막걸리같아요부드럽고 맛있어요사이다타먹어도 맛있어요병도 너무 귀엽고곰표매니아라 그냥 맛있어요
2021-08-02,5,포장지에 막걸리가샌건지ㅜㅜ 박스가다 젖어서왔어요ㅜㅜ
2021-07-28,5,막걸리가 부드럽고 맛있어요 전 두번째 구매하고있어여
2021-08-06,5,아직 안 먹어 봐서 맛은 모르지만 배송은 빨라요
2021-07-20,5,먹기전이지만 기대됩니다
2021-06-02,4,핫하기도하고 맛도 궁금해서 주문했어요전체적으로 괜찮았어요가격대가 조금 높긴해요든든하게 포장해주셨습니다막걸리 특징 감안하면 안전하게 잘 왔고 냄새는 어쩔수가 없지요맛있게 잘 먹었습니다
2021-07-22,5,아직 숙성이 덜 되서 그런가 쫌 많이 가벼운 느낌 입니다 부드러운 느낌인데 너무 가벼워서 쪼금 실망했는데 3개는 몇일 두고 먹어봐야겠어요
2021-07-18,5,아주 맛있게 잘 마셨어요
2021-07-24,5,달달하고 막나용ㅎㅎ
2021-07-13,4,부드러운 막걸리 ㅎㅎ 궁금해서 먹어봣네요 드디어ㅜ 근데 포장이 허술한지 새ㅅㅓ왓어요
2021-07-07,5,배송도 빠르고 병도 이쁘고 맛있고 포장박스도 정말 맘에 들어요
2021-08-03,5,맛있어요 감사핫니딛
2021-06-26,5,처음 사서 먹어보고 맛있어서 재구매했어요포장도 꼼꼼하고 사이즈 귀욤하고 맛은 두말할것도없이 최고네요
2021-06-07,5,사기힘들다해서 걱정했는데 이틀 연속으로 도전해서 이틀 다 성공했어요요고 마시려고 김치전 구워서 부모님이랑 마셨는데술 좋아하시는 아빠는 달다고 하셨지만 부드럽다고 맛있다하셨고 술 안마시는 엄마도 넘 부드럽다고 세잔이나 드셨어요ㅋㅋㅋ달달하고 묵직하고 탄산없어 부드러워요캠핑때 가져가려고 두번샀는데 캠핑이 취소돼서ㅜ다음번 캠핑때 또 도전해보려구요맛있게 잘먹었습니다
2021-06-22,5,몇번 실패 끝에 구매했는데 왜 상품 올리자마자 품절인지 알겠네요 맛있어요
2021-07-13,5,맛있어요 대신 오자마자 먹음 안되요
2021-07-05,4,포장이 다 녹아서 와서 좀 그거 땜에불만이었어요맛은 좋아요
2021-06-30,4,정말 부드러운 막걸리에요탄산이있는 막걸리좋아하는 저한테는 별로네요ㅜ다른사람들은 괜찮다합니다
2021-07-12,5,핫템이라 사봤어요 막걸리에 탄산이 강한편은 아니에요
2021-07-04,5,너무 먹고 싶었던맥주는 편의점에서도 간간히 보이던데막걸리는 편의점에서 구경도 못해봐서 온라인 주문욥
2021-07-19,5,생각보다맛잇엇어요
2021-08-03,5,배송도 빠르고 맛있게 잘 마셨어요
2021-07-14,5,요즘 아주 핫한 곰표 제품들을 이렇게 채워두니 부자된 기분이랍니다 ㅎㅎ
2021-07-13,5,오자마자 먹음 안되요 숙성후에 드세요
2021-07-21,5,다만족합니다만막걸리특유의 약간샜을때나는 냄새는 어쩔수가없나봐요 포장열었을때 그거말고는 모두만족입니다
2021-07-29,5,전 맛있네요 위에 맑은것도 담날 머리도 안 아프고
2021-06-17,4,어렵게 구매한만큼 맛나게 마셨네요재구매각입니다
2021-08-07,5,처음 먹어봐서 설레었습니다
2021-07-08,5,배송이 빠르고 시간이 지남에 따라 여라가지 맛을 느낄수 있어 좋습니다
2021-07-07,5,오랜만에 막걸리 먹었어요맛있네요시중에서도 살수있었으면 좋겠네요
2021-07-05,5,어쩜 이리 부드럽고 맛난 막걸리가 있나요여러사람과 나눠먹고 싶은데 자유롭게 살수있음 좋겠어요
2021-08-05,5,부드러운 막걸리 옛날막걸리 병이귀여워요
2021-07-24,5,두번 구매 성공해서 맛있게 먹고 한병 남았어요 대 마시면 또 구매하려구요
2021-07-05,5,몇번의 구입 실패로 어렵게 구입했는데 레이저 치료로 금주 하느라 모셔두고 있다 늦게 먹었는데 기다린만큼 달달하고 맛있어요
2021-08-07,5,시간이 지날수록 맛이 훨씬좋습니다
2021-07-12,4,배송 빠르고 맛도좋아요
2021-07-08,3,구매팁을 알고나니 쉽네요막걸리이지만 건강한맛이 나요 ㅎㅎ
2021-07-14,5,또 사먹고 싶어요 너무 맛있네요
2021-08-07,5,시간이 지날수록 맛이 훨씬 좋네요
2021-08-05,5,빠른배송 감사합니다
2021-08-10,5,맛있게 먹었어요
2021-07-17,5,맛있거 좋네염 곧 또 재구매함
2021-07-06,5,맛있네요부드럽고 재구매하고싶네요
2021-07-13,4,패키지 넘 이뿐거 아니예요기대한데로 맛도 좋네요
2021-08-02,5,엄마가맛있데요막걸이는이래야한다며
2021-07-31,3,맛있어요이제 구입하기가ㅜ좀 쉬워졌네요
2021-07-24,2,일반 막걸리 생각 하시면 안되요 탄산도 없고 뭔가 심심하다 할까 암튼 핫한 제품이니 도전 해보세요
2021-07-11,5,또 쟁여놨어요저한테는 순하고 넘 좋아요
2021-06-19,5,리뷰에 포장이야기가 많았는데 받아보니 알겠어요 택배박스 자체도 귀욤귀욤한데 한여름엔 포장이 너무 약할듯해요 아이스팩은 다 녹은상태로 왔네요 그거빼곤 좋아요 한병은 먹어보니 약간 가벼운 느낌의 막걸리네요 숙성 후가 맛있데서 하루씩 숙성해서 먹어보려구요
2021-08-07,5,만족하며 먹고잇습니다
2021-07-08,4,진짜 어렵게 구매 했어요ㅠㅠ힘들어서 맛본걸로 만족합니당 ㅠ
2021-07-11,5,맥주만큼은 아님 옛날 허니버터칩사태 생각남
2021-07-12,4,한정판매라 구매가 쉽지않아서 아쉽지만넘 맛있어요
2021-07-14,4,곰표막걸리 병은 귀엽지만 단맛은 없고 맛은 밋밋해요
2021-07-01,5,목넘김도 좋고 달큰하니 맛있어요용량은 쬐끔 부족하나 많은것 보다 좋은거 같네요
2021-07-06,5,여러번 시도에 주문성공해서 잘받았습니다  주말껴서 배송이 좀 걸렸네요
2021-07-24,5,완전추천요  머리도 안아프고 맛있어요 근데구매가 어렵습니당
2021-07-08,5,배송 빠르고 맛도 좋고부드러워서 먹기 좋아요
2021-08-02,5,3번째 구매 좀 비싼거랑 여러개 구매못하는건 아쉬운데 맛있어요
2021-08-05,4,좋네요 ㅋㅋ 근데 기대이하긴함
2021-07-16,5,좋아요배송도빠르고좋아요
2021-08-04,5,밀막걸리는 많이는 못 마실 것 같지만 맛있네요
2021-07-29,3,부산러 개인적인 취향으론 생탁이 훨 맛나네여 뭔가 밍밍하고 시큼한게 강해요
2021-07-20,3,괜찮아요 ㅎㅎ 네 괜찮아요
2021-07-20,5,신랑이 막걸리를 너무좋아해서 샀는데 부드럽고 맛나다고하네요 다음날 두통도없다고합니다
2021-08-02,5,ㄷㅓ운날씨에 배송이 약간 걱정스러웠지만 꼼꼼한 보냉포장에 아주 감사합니다
2021-08-13,5,진짜 너무 맛잇어요
2021-07-02,5,금날 일있어 토날 맞춰 주문했는데 결제한 당일 배송되어 금날왔네요ㅠㅠ밖에 오래 있었는데 괜찮겠죠ㅠㅠ
2021-07-20,5,부드럽고 맛있어요
2021-07-09,5,저랑 남편의 인생 막걸리예요일이주 지나서 먹으면 당도가 딱 좋은데그때까지 남겨두며 기다릴수가 없어요ㅠㅠ
2021-07-09,5,받자마자 먹었을 때는 크리미하고 단맛 몇일 지나고 먹으니 크리미하고 단맛은 좀 줄고 단백한 막걸리 맛이었어요
2021-08-10,5,목넘김이 좋아요
2021-08-01,5,넘 맛있어요 남편이랑 잘 먹었어요
2021-08-08,4,지인에게 선물했어요
2021-07-27,3,지금 받았는데 아이스팩 3개가 다 녹았어요날씨가 워낙 더우니비싼데 궁금해 사봤어요
2021-08-09,3,저는 사실 잘 모르겠어요
2021-07-14,5,맛있어요 굿굿홓ㅎㅎ헿헤
2021-07-14,4,막걸리가 목넘김은 부드럽지만 맛은 밋밋해요
2021-07-13,4,탄산없이 부드러운 건강한맛  가볍게 마시기 좋았어요
2021-08-04,5,늘만족하면서 먹는 표문막걸리지요
2021-06-15,5,배송이 늦은밤에 왔네요입소문 듣고 구매해봤습니다9시땡하면 구매하기 버튼이 생겨 누르는 손맛이 장난아니예요ㅎ해물파전과 먹으니 꿀맛이었어요
2021-08-02,5,너무 좋아여 굳굳 어프매장에도 팔았음 좋겠어요
2021-07-25,5,맛있어요
2021-08-03,5,좋아요 맛있게먹었어요
2021-07-14,4,막걸리 밋밋해서 사이다 타서 마셨어요
2021-07-14,4,사이다 타서 마시니 달달하니 맛있네요
2021-08-02,5,배송 꼼꼼하게 잘 왔습니다맛도 있어요
2021-08-08,5,좋은제품감사합니다
2021-07-02,3,어렵게 구매했는데 전 별로였어요개취로 전 탄산 강한걸 좋아해서  탄산없고 부드러운 느낌이예요 ㅠ 이렇게 힘들게 먹을 정도는 아닌듯
2021-08-06,4,단맛이 좀 강한 느낌입니다술이라기보단 음료수같은 느낌이ㅎㅎ
2021-08-22,4,조아요조아요조아요조아요
2021-08-04,5,얼음에 넣어서 먹으니 더시원하고 맛있어요
2021-07-10,5,두번만에 성공했는데 빠른배송 감사합니다
2021-08-05,5,너무 맛있어서 재주문 하고 싶어용
2021-08-03,5,유통기한도 길고 너무 맛나요
2021-07-16,5,곰표막걸리 매력적이네용
2021-07-01,5,매우 부드럽고 굉장히 크리미한 맛이예요 전 맛있네요 배송도 안전하게 잘 왔어요
2021-07-28,5,너무 부드럽고 맛있어요 딴건 못먹을정도로
2021-07-13,4,일반 막걸리보다 부드러우나 가격적인 면은 쬐금 부담됩니다
2021-08-03,5,좀 비싸긴 하지만 맛이 좋아요
2021-07-11,5,곰표 막걸리 너무너무 맛있고 좋아요 목넘김이 짱
2021-06-29,4,몇번 시도끝에 드디어 결제성공 병이 작아보였는데 막걸리 34잔은 나오네요 단맛이 있고 포장도 잘 왔어요
2021-05-26,5,일요일  주문해서 어제 화요일 받았어요 배송도 빠르고 오랜만에 제육볶음에 곰표막걸리 먹으니 딱이네요 어제 도착후 오늘 먹어서인지 약간 달면서 고소하면서 부드러웠어요 포장도 꼼꼼하게 해주셔서 샌거없이 잘왔어요주변사람들 하나하나 주니 내껀2개 남았네요 ㅎㅎ 또 사먹을래요
2021-07-24,5,만족합니다 
2021-07-04,5,몇번 실패해서 포기하려던 찰나 ㅋㅋ 드디어 주문에 성공 했습니다 ㅋㅋ 맛있어용
2021-08-10,4,택배열자마자 흔들렷는지엉망이더라구요 ㅡㅡ
2021-08-05,5,뒷맛이깔끔하고부드러워요
2021-06-22,5,진짜 일반 막걸리하고는 맛이 절대 다름요 3번만에 성공 이 맛을 나만 알 수는 없어서 동생네도 선물로 보냈어요 이제는 성공하는 방법을 터특해서 다 먹고 나면 또 도전 할꺼예여
2021-07-08,5,달달하니 목넘김이 좋네요 부드럽기도 하구요 둘이 한잔씩 먹으면 딱이네요 ㅎ
2021-07-22,4,달달하고 맛있어요근데 포장엔 좀 더 신경써주셨으면 좋겠네요
2021-08-08,5,목넘김이 아주 부드러웠어요
2021-07-16,5,좋아요구매하기는힘드네요ㅎㅎ
2021-08-01,4,맛은 있어요가격이 좀 비싸서 재주문은  좀 망설여지네요
2021-07-15,3,목넘김은 부드러워서 좋은데 특별하지는 않아요
2021-06-25,5,부드럽고 달콤해요 아이스팩도 들어있고 이중포장으로 완전히 새진 않았지만 배송중 흔들림으로 포장뜯으니 막걸리 냄새가 확 올라오더라구요 그래도 많이 안 새서 다행입니다 ㅎ
2021-07-03,5,요즘은 잘 구매되네용ㅋ전숙성해서 먹을려고 놔둿어요
2021-08-03,5,맛있어서 또 주문했어용
2021-08-07,5,목넘김이 부드럽고 맛나요
2021-07-17,5,드디어 구매해서 좋아요
2021-07-07,5,패키지가 너무귀여워요 한번실패하고 두버째 결제성공입니다
2021-07-18,5,부침개랑 먹으니 꿀맛이네요
2021-07-12,5,두번째 구매입니다친구도 선물해줬는데 좋아했어요
2021-08-02,5,병이작아 한번에 다 먹기도 좋고 탄산은 없지만 부드럽네요
2021-08-08,5,탄산없고 너무 달지않고 좋네요
2021-07-30,5,가격이 좀 착하진 않지만 특별함을 주고 싶을 때 마시면 좋을거같아요
2021-07-28,5,부드러운 막걸리에여 ㅎㅎ 저는 좋았는데 탄산좋아하시는분들은 비추여
2021-06-30,5,제껀 포장 잘되서 왔어요며칠 있다 먹으니 더 맛있었구요 오늘 또 주문 성공했지요잘먹을게요 
2021-06-30,5,이젠 좀 시들한지 첫성공에 기다렸는데 맛있어요ㅎ전단맛이 마니 날때가 더 좋네요ㅎ
2021-08-11,5,부드럽고달고 안하ㅠ넣노나ㅙ놰에우ㅐ유ㅐㅇ
2021-07-11,5,곰표 맛있어요 재구매의사 굳
2021-06-24,5,톡톡상담도 친절히 해주시고캠핑가서 안주로 먹으려고 구매해봤어요부드럽고 단맛이 맛있었어요다음번에 또 주문할게요
2021-07-26,5,알콜향이 많이 없어요 무난하고 부드러운 맛인데 숙성을 좀 더 시켜 먹어봐야겟어요
2021-06-22,5,8번의 실패를 이겨내고 드디어 구매완료 했네요ㅋ 아직 맛보기 전 이지만 괜히 기대가 됩니다 오늘 받아서 우선 션하게 냉장고 넣어두고 내일 맛난 안주와 함께 할 예정입니다 박스까지도 귀엽네요
2021-06-07,4,목 넘김은 엄청 부드럽네요단맛이 있는걸 좋아하는데 그 부분에서는 조금 아쉬웠어요시간이 좀 지나면 단맛이 올라온단 리뷰를 보고 기다려볼려구요ㅎㅎ그래도 병은 너무 귀엽고 예뻤어요양도 신랑이랑 나눠먹기 딱 좋았어요
2021-08-03,5,한병씩 지인들에게나눠줬는데 다들어디서났냐고하네요
2021-07-28,5,부드러워 목넘김이 너무 좋았어요재구매입니자
2021-08-06,5,맛있어서 또 생각나네요
2021-07-14,5,도수 약해서 먹기 좋고 편해요 맛있게 잘 먹을께요
2021-07-24,5,안전하고 빠른배송 감사합니다 맛있어요
2021-07-04,4,배송 꼼꼼히 잘 왔어요 맛도 괜찮았구요부드러워요
2021-07-19,5,부드럽고 달달합니다 가성비로는 0점주고싶지만 맛은 기존의 다른 막걸리보다 좀 더 젊은 사람들에게 잘 맞는듯합니다
2021-07-02,5,ㅊ억 막걸리만 애정하는 사람 호기심에 구매일단 탄산이 없어  우유 막걸리 느낌  무척 묘한 맛오렌지 쥬스와 믹스해서 먹으니 굳 ㅎ
2021-07-19,5,맛있게 잘 먹었어요
2021-07-04,5,깔끔해요 아침에 알람 맞춰서 일주일만에 성공 했네요 ㅎㅎ여름에 캠핑예약 해놨는데 다시 또 도전 해봐야겠어요 성공하면 인증샷 남겨야 게ㅆ다죵
2021-08-07,5,탄산없이 부드럽고 단 막걸리입니다
2021-08-07,5,잘 마셨습니다 한달 후 후기 남깁니다
2021-07-11,4,귀여운 디자인과 달리 묵직한 맛이지만 맛있었어요
2021-08-09,5,조금 달달한 감이 있어요 ㅎ
